Company Name,Job Description
Beckman Coulter Diagnostics,"At first glance, you’ll see that for more than 80 years we’ve been dedicated to advancing and optimizing the laboratory to move science and healthcare forward. Join a team where you can be heard, supported, and always be yourself. We’re building a culture that celebrates the backgrounds, experiences, and perspectives of all our associates. Look again, and you’ll see we are invested in you, providing the opportunity to build a meaningful career, be creative, and try new things with the support you need to be successful.
Beckman Coulter Diagnostics is proud to work alongside a community of six fellow Diagnostics Companies at Danaher. Together, we’re working at the pace of change to improve patient lives with diagnostic tools that address the world’s biggest health challenges.
The Software Engineer II for Beckman Coulter Diagnostics is responsible for designing, developing, Integrating, and debugging highly complex software programs for laboratory medical devices and new product development. We are seeking Software Engineers with hands-on C# and/or Python-based solutions and experience with any user interface development.
This position is part of R&D Software in Miami, FL, and will be an onsite position. At Beckman Coulter, our vision is to relentlessly reimagine healthcare, one diagnosis at a time.
You will be an active and integral member of the R&D Software Development team and responsible for the design of certain software components and development of new products, applications, and features based on industry and technological trends and advances. If you thrive in a collaborative, autonomist, highly technical role and want to work to build a world-class R&D software Engineering organization—read on.
In this role, you will have the opportunity to:
Prototype, design, code, unit test, and maintain Windows / Linux-based software applications
Translates detailed design into a computer program for the medical device software
Assist in developing any technical documentation needed to accurately represent application design and code
Document software, write technical specifications for interfaces and testing
Participates in code reviews to represent reviewed work for adherence to standards and specifications.
The essential requirements of the job include:
Bachelor’s degree in Computer Science, Biomedical Engineering or closely related field
Minimum 3 years of hands-on experience designing and developing C# and/or Python-based solutions and experience with any user interface development
Minimum 3 years of hands-on experience with MS tools and technologies such as Visual Studio, unit testing frameworks, Azure DevOps, or AWS
Skills in strategic thinking, problem-solving attitude, good planning, and time management
Expert in Unit Testing, OOA/OOD development methodologies, and design principles
It would be a plus if you also possess previous experience in:
Experience in medical device design & development is a plus
Experience in Agile development processes and philosophies
Ability to work well with people and be both highly motivated and motivating
At Danaher we bring together science, technology and operational capabilities to accelerate the real-life impact of tomorrow’s science and technology. We partner with customers across the globe to help them solve their most complex challenges, architecting solutions that bring the power of science to life. Our global teams are pioneering what’s next across Life Sciences, Diagnostics, Biotechnology and beyond. For more information, visit www.danaher.com."
Stony Brook University,"Software Developer

Required Qualifications: (as evidenced by an attached resume)
Bachelor’s Degree. Three [3] years of full-time software experience to include developing, supporting, configuring and maintaining. Experience formulating programming code in structured query language (SQL). Experience analyzing problems as well as formulating and designing solutions.
Preferred Qualifications:
Advanced degree. Additional years of full-time software experience to include developing, supporting, configuring and maintaining. Experience with Business or Systems Analysis. Experience developing enterprise software. Experience developing and supporting Enterprise Resource Planning systems. Experience developing web applications, Web services, and/or API. Experience formulating programming code in two or more programming languages. Experience with object-oriented languages. Experience with database management systems. Experience with Cloud Applications, including SaaS, PaaS, and LaaS.
Brief Description of Duties:
Working under the general direction and guidance of a Supervising Programmer/Analyst, the Software Developer is responsible for Integration Broker configuration and maintenance as well as the development and implementation of standards for building interfaces between systems. This position will prepare test data, verify logic, document code, and develop integration and deployment procedures and application user manuals. The selected candidate will be enthusiastic about new technologies and willing to research and quickly learn and employ new technologies and standards to applications, systems, reports, and interfaces.
Essential Duties
Develop and/or implement and configure new applications software, programs, reports and interfaces. Utilizing ERP security structure knowledge, perform security setup and process access requests. Document existing business processes and application software. Develop programming/configuration specifications for applications and solutions. Collaborate with staff of Division of Information Technology to ensure effective maintenance, troubleshooting, problem resolution, management and support for systems and applications. Employ standards to ensure data accuracy, security and privacy of information. In performance of all job duties, at all times be responsible for delivering optimal customer service, for protecting institutional data and privacy, and the excellent delivery of solutions and services by following divisional and University policies, procedures, and processes.
Maintain existing application software. Troubleshoot and debug malfunctions in complex applications programs. Review and analyze user specifications in writing programming code; verify program logic by preparing data for trial runs and by implementing tested changes. Assist with proposing and implementing modifications necessitated by changes in technology and vendor-supplied code. Document applications, reports, and interfaces to describe program objectives, use cases, development, logic, coding, configurations, corrections, and other elements required to ensure others have sufficient information to support.
Provide operational support for administrative systems. Act as liaison between Enterprise Applications and Integrations, Client Support, and customers. Recommend new or modified standards and procedures. Ensure compliance of applicable state and university policies and procedures. Advise management of potential breaches of data and systems security. Ensure compliance with applicable security policies.
Training and learning: Keep up with new technological development in related areas, update skill sets to perform job duties effectively, such as evaluating and applying new products, standards and procedures.
Other duties or projects as assigned as appropriate to rank and department mission.
Special Notes:
This is a full-time appointment. FLSA Exempt position, not eligible for the overtime provisions of the FLSA. Minimum salary threshold must be met to maintain FLSA exemption.
This position will remain posted until filled or for a maximum of 30 days. An initial review of all applicants will occur two weeks from the posting date. For full consideration, applications must be received before the initial review date. If within the initial review no candidate was selected to fill the position posted, additional applications will be considered for the posted position; however, the posting will close once a finalist is identified, and at minimal, two weeks after the initial posting date.
SUNY implemented a hybrid telecommuting pilot program. This position has been approved to participate in the pilot, which allows for up to 5 remote days per pay period.
Resume/CV and cover letter should be included with the online application.
Stony Brook University is committed to excellence in diversity and the creation of an inclusive learning, and working environment. All qualified applicants will receive consideration for employment without regard to race, color, national origin, religion, sex, pregnancy, familial status, sexual orientation, gender identity or expression, age, disability, genetic information, veteran status and all other protected classes under federal or state laws.
If you need a disability-related accommodation, please call the university Office of Equity and Access (OEA) at (631) 632-6280 or visit OEA.
In accordance with the Title II Crime Awareness and Security Act a copy of our crime statistics can be viewed here.

Visit our WHY WORK HERE page to learn about the total rewards we offer.

Job Number: 2403254
Official Job Title: Lead Programmer/Analyst
Job Field: Information Technology
Primary Location: US-NY-Stony Brook
Department/Hiring Area: Division of Information Technology - Enterprise Applications & Integrations
Schedule: Full-time Shift :Day Shift Shift Hours: 8:30 am - 5:00 pm
Posting Start Date: Sep 27, 2024
Posting End Date: Oct 20, 2024, 10:59:00 PM
Salary:$80,000-$110,000
Appointment Type: Term
Salary Grade:SL3
SBU Area:Stony Brook University"
State Street,"Who We are:
Charles River Development (CRD) is the FinTech division of State Street. Together with State Street’s Middle and Back-office services, Charles River’s cloud-based Front Office technology forms the foundation of the State Street Alpha® Platform, the first front-to-back solution in the industry.
Industry momentum has seen CRD grow over 135% in headcount over the last 5 years, and we continue to grow. As a digital innovation leader, we invest into our solutions, processes, systems, and talent.
CRD / Alpha® Platform Engineering organization is innovating and transforming the platform by moving away from monolithic software to utilising next generation cloud-based technology that leverages Microsoft Azure, Kafka, Snowflake, etc.
As a part of our talent growth strategy, CRD Engineering is partnering with leading universities in North America to develop new talent. We are looking to hire recent university graduates and graduating seniors majoring in Software Engineering or other technical field of study for the Full Stack, UX/UI, Quality and Performance Engineering roles. Junior engineers will receive coaching and guidance from senior engineers and leadership as they develop their skills and will become an integral part of an agile organization contributing to the development of the CRD/Alpha Platform.
Position Summary:
Be an integral part of an agile organization and contribute to the development of one or more CRD/Alpha Platform modules. Junior engineers will receive coaching and guidance from senior engineers and leadership as they develop their skills and contribute to the team.
We will match candidate’s existing knowledge and career interest to the company’s priorities to help you build knowledge and practical hands-on experience in one or several of the areas below:
Full Stack Development
Front-end UI/UX development
DevOps
Database Engineering
Responsibilities:
Under guidance of senior engineers contribute to analysis, design, development, testing, and debugging large and complex software enhancements and solutions within the CRD/Alpha Platform domains including modifications to core frameworks and other primary facilities critical to system operation
Collaborate with Business Analysts to create simple and sustainable software solutions for complex problems
Participate in the agile software development process including attending all daily standups, sprint planning, backlog grooming, and retrospectives
Participate in on-the-job and formal trainings to develop your career
What would give you a hands-on experience and growth in the following technologies:
Implementing Single Page Application (SPAs) using React and Angular with major cloud vendors (e.g., Azure)
Building React packages and best practices, including Redux and RxJs
NodeJS ecosystem, including NPM and/or Yarn.
JavaScript, ReactJS and Typescript
Develop practical experience with object-oriented programming (JAVA and/or C#), compiler or interpreter technologies, embedded systems, operating systems, relational databases (RDBMS), scripting and new/advanced programming languages
Learn how to build an event driven architectures
Build knowledge of Kafka and /or Kubernetes
Learn to develop cloud native services on one or more of the major cloud providers (Azure, AWS, Google Cloud) and using Java and Spring
Learn Snowflake and SQL Server
Learn to develop observable, operable cloud native software that horizontally scales and is aligned with the modern architectural principles
Develop business acumen in Portfolio Management, Trading, Compliance, Post-Trade, IBOR or Wealth Management
Build knowledge of test standard and popular supporting frameworks such as Jest, Cypress, and Jasmine
Qualifications:
B.S. or master’s degree in computer science, Engineering, Mathematics, and Physics or other technical course of study
0 – 2 years of professional experience or equivalent college project experience
Interest and passion about building high quality software in FinTech space
I Ideally, you already have initial experience with Java, PowerShell and batch scripts and have knowledge of C#
You are familiar with concepts such as DevOps, continuous delivery, clean code, TDD and agile methods
You have worked with tools like Jira and Confluence
You are eager to learn and challenge status quo and are characterized by a very analytical and solution-oriented way of thinking
You have effective written and verbal communication
Able to work well with peers in a collaborative team environment
Our employees are expected to work from our office locations per country-specific guidelines
Salary Range:
The range quoted above applies to the role in the primary location specified. If the candidate would ultimately work outside of the primary location above, the applicable range could differ.
Job Application Disclosure:
It is unlawful in Massachusetts to require or administer a lie detector test as a condition of employment or continued employment. An employer who violates this law shall be subject to criminal penalties and civil liability.
State Street's Speak Up Line"
Sterling Systems & Controls,"Want to be a Part of Our Growing Team?
For over fifty years, Sterling Systems & Controls, Inc. has designed, engineered, and specialized in producing custom-engineered material weighing and batching systems, bulk bag filling and unloading systems, process controls and automation systems, liquid handling systems, and more. The company is nestled in the heart of agricultural northern Illinois, in Sterling, IL. We offer highly competitive wages and company benefits. Sterling Systems & Controls, Inc. is looking to fill the following positions.
Please send applications and resumes to:
Human Resources
Sterling Systems & Controls, Inc.
P.O. Box 418 • Sterling, IL 61081

You can also apply using form below or contact us by phone for email address.

This position works under the direction of project managers to program and develop software applications on many different platforms. The position provides customer support during startup as well as troubleshooting.
Principle Responsibilities:
Work under the direction of Senior Engineers.
Modify existing customer programs.
Programming of material handling application using various platforms.
Create customer approval packages and sequence of operations.
Write detailed instruction manuals for completed projects.
Conduct in-house checkout of completed systems.
Research new technology available in market.
Assist customers with onsite and phone troubleshooting and system startup.
Skills:
Accuracy and high attention to detail.
Time management skills.
Excellent verbal and written grammar skills.
Problem solving ability.
Methodical thinking skills.
Ability to communicate to all levels of plant personnel.
Knowledge, Education or Experience:
Bachelor’s degree or related field experience to include but not limited to:
C++ and C# programming languages; WPF, ASP.NET; SQL Scripting; and SSRS. Have an understanding of Ling-To-SQL, MVVM, and Prism patterns and practices.
Knowledge of PLC programming is a Plus.
Electrical/Electronics Aptitude with ability to read basic schematics is a Plus.
Mechanically inclined is a Plus.
Characteristics Required:
Ability to work independently without supervision.
Travel enthusiast (Drive, fly and other means of travel).
Dependable hard working.
Flexible to changing priorities and routines.
Physical Requirements:
Long periods of standing or sitting, with extended periods of work at a computer & traveling.
Squatting, lifting and stretching."
"Softova, Inc.","Date of Opening: 09/27/2024
Date of Closing: 10/27/2024
Description: Seeking qualified Senior Software Developer with Bachelor's Degree or foreign equivalent in CS or Engg or CIS related along with 60 months of related work experience to Design, Develop Client/Server applications of SDLC using Java, J2EE, RPA, Blue Prism, Java Script, .Net, SOAP & RESTful web services, Oracle and SQL Server. Create functional, technical requirement specifications. Develop, test and maintenance of SQL, PL/SQL, AWS, Unix, Python and resolve any defects raised, maintain complex projects using TFS, GIT. Follow Agile/SCRUM methodologies. Occasional travel to unanticipated client-site locations within USA may be required as a roving employee.
Job Location: Piscataway, New Jersey, 08854.
Qualified Candidates should send their resumes to: HR Manager
Softova Inc.
15 Corporate Place South Suite 315, Piscataway, New Jersey, 08854."
"Softova, Inc.","Date of Opening: 09/27/2024
Date of Closing: 10/27/2024
Description: Seeking qualified Senior Software Developer with Bachelor's Degree or foreign equivalent in CS or Engg or CIS related along with 60 months of related work experience to Design, Develop Client/Server applications of SDLC using Java, J2EE, RPA, Blue Prism, Java Script, .Net, SOAP & RESTful web services, Oracle and SQL Server. Create functional, technical requirement specifications. Develop, test and maintenance of SQL, PL/SQL, AWS, Unix, Python and resolve any defects raised, maintain complex projects using TFS, GIT. Follow Agile/SCRUM methodologies. Occasional travel to unanticipated client-site locations within USA may be required as a roving employee.
Job Location: Piscataway, New Jersey, 08854.
Qualified Candidates should send their resumes to: HR Manager
Softova Inc.
15 Corporate Place South Suite 315, Piscataway, New Jersey, 08854."
University of Florida,"Develops web-based applications and sites for internal or external research, program and department support, and college marketing activity. Engages in creating user-centered web-based applications for a variety of users and platforms. This position is time-limited and soft-funded.
Responsibilities:
Web Development Coordination and Measurement
Create specifications and develop customized features of the College CMS properties via theme editing and augmentation. Provide guidance and direction to web content editors in the use of these features and with the use of source-code management tools, track and resolve issues relating to their use. Meet with stakeholders to assist in the creation of new content for the specific purpose of communicating the achievements and goals of the College, and the activities of its Faculty. Refine content and implement changes, keeping within UF policy guidelines and usability standards as a consistent look and feel throughout all web properties. Provide analytics related to the impact of implemented marketing campaigns, and other communications products/output, including campaign-specific website design and build projects. Promote ideation in the web design field to improve site usability and productivity in developing and/or maintaining websites.
Development Services Liaison
This position is responsible for management of ETC development environments including Git source management, issue tracking and production versioning. This involves basic Linux server management, Apache web server configuration and tuning, and communication and coordination with production servers under the supervision of the Systems Administrator. Operations should be in keeping with College and Unit level best practices including data security protocols, disaster remediation processes, and the concept of minimal privilege while serving the needs of the College and Unit development teams.
Research Collaboration and Prototyping
This position should collaborate with College and Center faculty to build web and mobile applications to support their research efforts through data collection and analysis including expertise on data mining methodologies in order to help the faculty expand their projects' capabilities. This includes designing and developing custom software solutions to provide faculty and other stakeholders with the information required to better identify research trends and patterns to inform decision-making.
End-User Support
This position provides support to College program coordinators, graduate assistants and others responsible for updating website information through the College CMS. In addition training and support should be provided as needed on understanding the processes and maximize the benefits of locally developed applications. This includes response and redirection of end-user questions and problems in order to quickly resolve client issues.
Performs other duties as assigned by the Assistant Director of Operations E-Learning, Technology, and Communications, the Director of Operations at E-Learning, Technology and Communications, and the Dean of the College of Education.


Expected Salary:
Salary is competitive and commensurate with education and experience.


Minimum Requirements:
Bachelor's degree and three years of appropriate experience. Appropriate college coursework may substitute at an equivalent rate for the required experience.


Preferred Qualifications:
Bachelor's Degree in computer science or web design and online communications or equivalent combination of education and relevant experience.
Minimum of three years experience in developing websites and promotional activities.
Two or more years of website development experience in Wordpress CMS, preferably with experience in large Wordpress multisite installs and working with child themes.

Special Instructions to Applicants:
In order to be considered, you must upload your cover letter and resume.
Application must be submitted by 11:55 p.m. (ET) of the posting end date.
This is a time-limited position.


Health Assessment Required:
No"
