Company Name,Job Description
King.com,"Category
Technology & Development
Location
San Francisco, California, United States of America
Job ID
R023602
Regular
Craft:
Technology & Development
Job Description:
Activision Blizzard Media is the gateway for brands to the #1 cross-platform gaming company in the western world, with hundreds of millions of players across over 190 countries. Our legendary portfolio includes iconic mobile game franchises such as Candy Crush™, esports opportunities like the Call of Duty® and Overwatch® Leagues, and some of the top PC and console gaming franchises such as World of Warcraft®, Call of Duty®, and StarCraft®.
The idea is simple: great game experiences offer great marketing experiences.
We are seeking a Staff Backend Engineer in our Ads Engineering team, empowering groundbreaking mobile advertising technologies to create the next generation of our Ads Platform.
Your role within the Kingdom
Do you want to build an amazing high scale backend systems for Advertising using the latest technologies? Are you an excellent communicator who enjoys working with people from several different business units? Can you translate business needs into technical requirements and implementation?
If you answered yes, then our Staff Backend Engineer role on our ads engineering team may be the right role for you!

We are an impactful team of problem solvers that are constantly reviewing how and why we do things and learning from each other. We are experimental, trying out new tech and ideas and willing to do things differently to drive the entire industry forward. We are sociable and fun, and we like to hang out together. We are passionate, some might even say quirky, and while we love what we do, our lives are about more than work. We love games, and are obsessed with creating the best player experience!
Your role within Activision Blizzard Media
Design and develop highly scalable, highly available and highly reliable Ads & Monetization platform that handles billions of requests per day
Work with architects and other engineers to craft and architect backend systems
Collaborate with Product and peer engineering teams on multi-functional projects
Work with DevOps engineers to ensure operational excellence
Genuine curiosity about working with and mentoring junior engineers
Qualifications
5 years of demonstrated ability leading the development of highly performing services in Java
Experience with AdTech platform preferred like AdServing, Demand Side Platform, etc.
Experience with NoSQL systems e.g.,Bigtable, HBase
Experience working in a cloud-based environment with Google Cloud Platform or AWS
Expert knowledge in Java, JMeter and performance engineering
Experience working in Multi threading, Asynchronous processing
Experience with streaming technologies e.g. Kafka, Flink
Experience in designing overall architecture of end to end solutions
Great interpersonal skills and a consistent record to work in a collaborative team environment
BA/BS degree in Computer Science, similar technical field of study or equivalent practical experience. .
Preferred Qualifications
Knowledge and experience in CI/CD, test automation, Jenkins, Gradle and related technologies
Experience with open source technologies like Docker, Kubernetes, Google BigQuery
Passionate about usability, maintainability and quality, building for the long term
About Activision Blizzard Media
Activision Blizzard Media is the gateway for brands to the #1 cross-platform gaming company in the western world, with hundreds of millions of players across over 190 countries. Our legendary portfolio includes iconic mobile game franchises such as Candy Crush™, esports opportunities like the Call of Duty® and Overwatch® Leagues, and some of the top PC and console gaming franchises such as World of Warcraft®, Call of Duty®, and StarCraft®. The idea is simple: great game experiences offer great marketing experiences.
A Great Saga Needs All Sorts of Heroes
King strives to be a place where everyone can be their most authentic self. We recognize that diversity, equity and inclusion is a vital and continuous conversation, and that change only happens when we all come together. It’s our mission to build a diverse and inclusive Kingdom for our people, players, and community.
Making the World Playful
Making the World Playful is our mission – it’s the thread that connects our people, our players, and our passion for our games. Let’s face it, who doesn’t love a bit of fun?
Kingsters are seriously playful: creative thinkers who balance art and science to bring moments of magic to millions daily. But our players aren’t the only ones that can level-up. We’re always looking for ways to champion each other and make what’s already great, even better.
So, if this feels like a fun way to spend your days, and you share our passion, our values, and our hunger to shape the future, join us in Making the World Playful.
Applications needs to be in English.
Discover King at careers.king.com
Rewards
We provide a suite of benefits that promote physical, emotional and financial well-being for ‘Every World’ - we’ve got our employees covered! Subject to eligibility requirements, the Company offers comprehensive benefits including:
Medical, dental, vision, health savings account or health reimbursement account, healthcare spending accounts, dependent care spending accounts, life and AD&D insurance, disability insurance;
401(k) with Company match, tuition reimbursement, charitable donation matching;
Paid holidays and vacation, paid sick time, floating holidays, compassion and bereavement leaves, parental leave;
Mental health & wellbeing programs, fitness programs, free and discounted games, and a variety of other voluntary benefit programs like supplemental life & disability, legal service, ID protection, rental insurance, and others;
If the Company requires that you move geographic locations for the job, then you may also be eligible for relocation assistance.
Eligibility to participate in these benefits may vary for part time and temporary full-time employees and interns with the Company. You can learn more by visiting https://www.benefitsforeveryworld.com/.
In the U.S., the standard base pay range for this role is $111,780.00 - $206,882.00 Annual. These values reflect the expected base pay range of new hires across all U.S. locations. Ultimately, your specific range and offer will be based on several factors, including relevant experience, performance, and work location. Your Talent Professional can share this role’s range details for your local geography during the hiring process. In addition to a competitive base pay, employees in this role may be eligible for incentive compensation. Incentive compensation is not guaranteed. While we strive to provide competitive offers to successful candidates, new hire compensation is negotiable."
Clear Street,"About Clear Street:

Clear Street is modernizing the brokerage ecosystem. Founded in 2018, Clear Street is a diversified financial services firm replacing the legacy infrastructure used across capital markets.
We started from scratch by building a completely cloud-native clearing and custody system designed for today's complex, global market. Our platform is fully integrated with central clearing houses and exchanges to support billions in trading volume per day. We've agonized about our data model abstractions, created horizontal scalability, and crafted thoughtful APIs. All so we can provide a best-in-class experience for our clients.
By combining highly-skilled product and engineering talent with seasoned finance professionals, we're building the essentials to compete in today's fast-paced markets.

The Team:
The mission of the Clear Street Broker-Dealer Clearing (BDC) team is to design the technology that enables the largest trading firms in the world to operate. We automate the processes that ensure trades happen: ensuring the details are correct, the money and assets change hands on time, and making sure that the risk is managed appropriately. The team works across our technology stack and core services and systems (Clearing, Custody, Settlement, Account Management and Trade Processing & Middle Office) to address gaps through enhanced engineering solutions.
Tech Stack: Java, Spring Boot, Microservices, Go, TypeScript, React, Redux, Kafka, Docker, Kubernetes, AWS

The Role:
You will solve challenging engineering problems that underpin the financial system, handling tens of millions of trades/day
You will build highly available, scalable, mission-critical applications in a modern technology stack
You will collaborate with other engineering teams to address scalability concerns to enable higher volumes of trades
You will work with users to understand and define new features and drive them to completion
You will develop a deep understanding of the business domain


Requirements:
At least five (5) years of professional software engineering experience and strong proficiency with Java and our tech stack listed is preferred
BS degree in Computer Science, Computer Engineering or similar major
Deep knowledge of computer science fundamentals, such as algorithms and data structures
High degree of self-motivation and willingness to jump into unfamiliar areas to solve problems
Ability to work with stakeholders to develop new product ideas, design the technology to implement them, and see them through to completion
Experience in building trading systems or high-throughput streaming applications

We Offer:
The Base Salary Range is $170,000 - $250,000. These ranges are representative of the starting base salaries for this role at Clear Street. Which range a candidate fits into and where a candidate falls in the range will be based on job related factors such as relevant experience, skills, and location. These ranges represent Base Salary only, which is just one element of Clear Street's total compensation. The ranges stated do not include other factors of total compensation such as bonuses or equity.
At Clear Street, we offer competitive compensation packages, company equity, 401k matching, gender neutral parental leave, and full medical, dental and vision insurance. Our belief has always been that we are better as a business when we are all together in person. As such, beginning on January 2, 2023, we are requiring employees to be in the office 4 days per week. In-office benefits include lunch stipends, fully stocked kitchens, happy hours, a great location, and amazing views.
Our top priority is our people. We're continuously investing in a culture that promotes collaboration. We help each other through challenges and celebrate each other's successes. We believe that modern workplaces succeed by virtue of having high-performance workforces that are diverse — in ideas, in cultures, and in experiences. We put in the effort to make such a workplace a daily reality and are proud to be an equal opportunity employer.
#LI-Hybrid"
Formotiv,"Overview:
Fully Remote (US required; East Coast preferred)

ForMotiv is the first Digital Behavioral Intelligence (DBI) platform. Using advanced, explanation-based predictive behavioral analytics, ForMotiv gives organizations unprecedented levels of insight into their users, leading to increased conversions, better digital experiences, and reduced risk and fraud. We’re well financed and have earned the business of some of the world’s most well-respected insurance companies. We’re a scrappy, collaborative group that is open to challenging each other and believe in learning something new every day.

The Role:
ForMotiv, a rapidly growing startup at the cutting edge of web and AI, is seeking an energetic Senior Data Backend Engineer to join our innovative team. We're looking for a software engineer with a strong backend and data focus who thrives on challenging problems and is excited to work with industry experts.
In this role, you'll be at the heart of developing our high-volume, high-speed behavioral collection platform and related tooling. You'll work with Python services in a serverless, container-based AWS environment, architecting and optimizing data solutions across multiple stores, including an S3/Redshift/Iceberg data lake and real-time Postgres RDS service. Collaborating directly with technology, data science, and management teams, you'll solve real customer problems at the intersection of web technology and AI. This position offers the chance to push the boundaries of highly performant and reliable service-based architecture.
This is a rare opportunity to get in on the ground floor of a company revolutionizing digital behavioral intelligence. If you're passionate about backend systems, data engineering, and creating scalable solutions that push the boundaries of what's possible in behavioral analytics, we want you on our team.

Responsibilities:
Responsibilities:
Work with Platform Lead, Product Management, Data Science, MLOps and TechOps to understand and refine service and data requirements, ensuring that services are in-line with architectural and operational needs.
As part of the Engineering Team, provide feature and service development and bug resolution for our server and data platforms.
Understand and contribute to our leveraging of AWS services. Evaluate and test new technologies to enhance ForMotiv’s offerings
Provide performance and reliability testing of services and data storage solutions.
Qualifications:
Qualifications:
4 year computer science or related degree (highly recommended, but may be waived with relevant experience)
Strong mathematics and problem-solving skills
At least 1 year of Python experience is required. This position will spend a significant portion of time coding back-end services.
2 years of SQL experience with multiple dialects. Experience observing and managing database performance is a plus.
Experience working with containers and other serverless technologies is highly desired.
Machine Learning or Data Science experience (not required but a plus)
Self-motivated, proactive, organized and a willingness to learn.
You’re comfortable in a fast-paced, unstructured environment
Eagerness to wear multiple hats and lend a hand to your teammates when called upon

What ForMotiv Offers:
Stock options with vested interest in growing the business
Ground floor access to venture-backed technology start-up with global presence
Permanent, full-time employment with company sponsored employee health, dental & 401k plans
Flexibly offer both remote & in-office work environments
The Cultural Characteristics we look for:

Curiosity: You look at each day as an opportunity to learn something new, not as an opportunity to prove what you already know.
Work ethic: You look at each day as an opportunity to get better for yourself and your team.
Empathy: You care how others feel around you, and you have the capacity to understand their points of view.
Coachable: You know your strengths and weaknesses and you aren’t afraid to ask for help."
Sofar Ocean,"The Company
Sofar is on a mission to connect the world’s oceans. We design, build, and deploy the largest privately owned network of marine weather sensors to power the world’s best marine weather forecasts. Our data helps our customers to increase efficiency and reduce emissions, delivering tools to governments and other stakeholders to understand impacts of climate change on extreme weather and ocean health. We live on Planet Ocean, and our goal is to create the ocean intelligence needed to ensure a sustainable future.
About The Position
We are looking for a product-driven software engineer to join our team as we build a new software product for the maritime transport industry. Our Wayfinder product runs on board the largest shipping vessels in the world, providing critical decision making context for sea captains as they navigate the world's oceans.
Building a great product will require you to have a deep understanding of our customers, their workflows, and the data they work with every day. You will collaborate with a top-notch team of engineers, ocean scientists and product designers to translate these user needs into high quality software that empowers our users with data to get their work done more efficiently.
Our tech stack includes Typescript and React on the frontend with backend APIs written using Typescript, Express, Postgres, and Nest.js, along with some data processing services written in Python. We have important work to do on both the frontend and backend and are looking for candidates with experience and fluency across these technologies.
About You
Passionate about building a product with a positive impact on the world
5+ years experience of professional software development experience
Significant professional experience with modern Typescript, Node JS, and AWS
Demonstrated experience designing & building high-availability HTTP APIs, high throughput backend services, including knowledge of CDNs, authentication & authorization protocols,
Willing to learn new tools, languages, and patterns as needed to build a great product
A strong communicator who enjoys collaborating with other engineers, designers, PMs, and scientists
A considerate technical leader who will mentor junior engineers through design sessions, code reviews, and team meetings
Excited to be be a part of a small but growing startup team
Estimated Salary Range
$165,000 - $180,000
The range listed is what we reasonably expect to pay for this role at the time of this posting. We may ultimately pay more or less than the posted range and may be modified in the future. Actual compensation packages are based on several factors that are unique to each candidate, including but not limited to skill set, experience, and equity package.
Sofar's Commitment to Climate Justice
We at Sofar Ocean acknowledge that careers in the marine sciences “... have traditionally been, and remain, non-diverse work environments”, thereby limiting the entry and prosperity of underrepresented groups in the space. (Johri et al., 2021) Many of these same groups are disproportionately affected by climate change, and are often excluded from decision-making that directly address their interests and needs.
We are committed to addressing these climate injustices and highly encourage people who identify as women, LGBTQ+, Black, Indigenous, and people of color (BIPOC) to apply.
Employee Conduct
It is the responsibility of every employee to contribute to a positive work environment through cooperative and professional interactions with co-workers, customers, and vendors.
Equal Employment Opportunity
All qualified applicants will receive consideration for employment without discrimination on the basis of race, color, religion, sex, sexual orientation, gender identity, national origin, protected veteran status, disability, or any other factors prohibited by law."
"Criterion Systems, Inc.","Overview:
At Criterion Systems, we developed a different kind of business—a company whose real value is a reputation for excellence built upon the collective skills, talents, perspectives, and backgrounds of its people. By accepting a position with Criterion Systems, you will join a group of professionals with a collaborative mindset where we share ideas and foster professional development to accomplish our goals. In addition to our great culture, we also offer competitive compensation and benefit packages, company-sponsored team building events, and advancement opportunities. To find out more about how Criterion can help you take your career to the next level please visit our website: www.criterion-sys.com. Criterion Systems is a Military/Veteran Friendly Company therefore we encourage Veterans to apply.
Responsibilities:
We are seeking a mission-focused Backend Software Engineer to support and contribute to our government customer’s success in Denver, Colorado!

This opportunity is on a program that is at the forefront of developing and operating Geospatial Intelligence analysis software. The team builds and maintains an exceptionally powerful platform enabling our users to address challenging real-world problems by converting disparate data into actionable information.

We work directly with operational users to design, develop, and maintain capabilities that empower analysts to create actionable intelligence from the massive volumes of Geospatial Intelligence data to give our intel and combat organizations the decision advantage over our near-peer adversaries.
Qualifications:
Required Experience, Education, Skills & Technologies
Must have an active TS/SCI with a CI polygraph security clearance or an active TS/SCI with the ability to obtain a CI polygraph.
Bachelor’s Degree and or equivalent experience in a related field in lieu of a degree.
Seven (7) years of experience in software development (analysis, design, development, testing, deployment, maintenance).
Experience as a software developer or software engineer with at least one programming language.
Experience with Java and Object-oriented programming.
In depth knowledge of architecture styles and APIs including REST, SOAP, etc.
Full time onsite with the potential to work a hybrid schedule.
Preferred Experience, Education, Skills & Technologies
Knowledge of containerization tools such as Docker, Kubernetes, Minikube, etc.
Experience with Spring Framework and Spring Boot.
Experience with ElasticSearch
Experience with AWS environments
Experience working in a SAFe Agile environment
Understanding of GIS concepts (ESRI tools)
CompTIA Security+ Certification
Security Clearance Level
TS/SCI with an adjudicated CI polygraph or ability to obtain a CI polygraph
Certification
None
Work Schedule
Full-time onsite - Hybrid schedule with accommodating team environment.
Pay Rate
The projected compensation range for this position is $160,000.00 - $215,000.00. Please note that the salary information is a general guideline only. Criterion Systems considers factors such as (but not limited to) scope and responsibilities of the position, candidate's work experience, education/ training, key skills as well as market and business considerations when extending an offer.
Benefits Offered
Medical, Dental, Vision, Life Insurance, Short-Term Disability, Long-Term Disability, 401(k) match, Tuition/Training Assistance, Parental Leave, Paid Time Off, and Holidays.

Criterion Systems, LLC. and its subsidiaries are committed to equal employment opportunity and non-discrimination at all levels of our organization. We believe in treating all applicants and employees fairly and make employment decisions without regard to any individual’s protected status: race, ethnicity, color, national origin, ancestry, religion, creed, sex/gender, gender identity/gender expression, sexual orientation, physical and mental disability, marital/parental status, pregnancy (including childbirth, lactation, and related medical conditions), age, genetic information (including characteristics and testing), military and veteran status, or any other characteristic protected by law. For our complete EEO/AA and Pay Transparency statement, please visit https://careers-criterion-sys.icims.com/."
