Job Title,Company Name,Location,Salary,Job Type,Job Description
"Middle Data Scientist
- job post",PT Neural Technologies Indonesia,Jakarta,None,None,"Informasi Lowongan
Tipe Pekerjaan

Remote/On-site

Fungsi Pekerjaan
Data Scientist
Jenjang Karir
Pemula / Staf
Job Deskripsi
Selecting features, building and optimizing classifiers using machine learning techniques
Data mining using state-of-the-art methods
Extending the company’s data with third-party sources of information when needed
Enhancing data collection procedures to include information that is relevant for building analytic systems
Processing, cleansing, and verifying the integrity of data used for analysis
Doing ad-hoc analysis and presenting results in a clear manner
Solving use cases related to the Telecommunication Industry
Job Description
We are looking for a data scientist that will help us discover the information hidden in vast amounts of data, and help us make smarter decisions to deliver even better solutions in the Telecommunications Industry. Your primary focus will be on applying data mining techniques, doing statistical analysis, building high-quality prediction systems integrated with our products, and solving use cases from our clients.

Please apply here : https://nti.co.id/jobs
Persyaratan
Tingkat Pendidikan
S1
Jurusan Pendidikan
Matematika, Statistika
Minimal Pengalaman
1 tahun
Deskripsi Persyaratan
Minimum 1-2 years experience as a data scientist
Min. D3 in Machine Learning, Statistics, Applied Math, or related field
Excellent understanding of machine learning techniques and algorithms, such as k-NN, Naive Bayes, SVM, Decision Forests, etc.
Experience with common data science toolkits, such as R, Weka, NumPy, MatLab, etc. Excellence in at least one of these is highly desirable
Great communication skills
Experience with data visualization tools, such as Tableau, Power BI, D3.js, GGplot, etc.
Proficiency in using query languages such as SQL.
Good applied statistics skills, such as distributions, statistical testing, regression, etc.
Good scripting and programming skills such as Python.
Data-oriented personality.
Having knowledge of Telecommunication Industry is an advantage.

Please apply here : https://nti.co.id/jobs

Skill yang Dibutuhkan
Lokasi
Kota
Prov. DKI-Jakarta
Alamat
SOHO Pancoran - Splendor 1503 Jl. MT. Haryono Kav. 2-3 Jakarta Selatan

Tentang Perusahaan
PT Neural Technologies Indonesia

Industri
Telekomunikasi
Benefit
Deskripsi Perusahaan
PT. Neural Technologies Indonesia atau disingkat dengan PT. NTI merupakan perusahaan di bidang Sistem Informasi Rumah sakit (SIRS) dan Alat-alat Kesehatan yang berdiri pada tahun 2007.</div>"
"Data Engineer
- job post",Devoteam G Cloud APAC,Jakarta,None,None,"Company Description

Devoteam is a leading consulting firm focused on digital strategy, tech platforms, and cybersecurity.
By combining creativity, tech, and data insights, we empower our customers to transform their business and unlock the future.
With 25 years’ of experience and 8,000 employees across Europe and the Middle East, Devoteam promotes responsible tech for people and works to create better change.
#Creative Tech for Better Change
Devoteam has launched in January 2021 its new strategic plan, Infinite 2024, with the ambition to become the #1 EMEA partner of the leading Cloud-based platform companies (AWS, Google Cloud, Microsoft, Salesforce, ServiceNow), further reinforced by deep expertise in digital strategy, cybersecurity, and data.

Job Description

The Data Engineer will be responsible for the following activities:
Work closely with data architects and other stakeholders to design scalable and robust data architectures that meet the organization's requirements
Develop and maintain data pipelines, which involve the extraction of data from various sources, data transformation to ensure quality and consistency, and loading the processed data into data warehouses or other storage systems
Responsible for managing data warehouses and data lakes, ensuring their performance, scalability, and security
Integrate data from different sources, such as databases, APIs, and external systems, to create unified and comprehensive datasets.
Perform data transformations and implement Extract, Transform, Load (ETL) processes to convert raw data into formats suitable for analysis and reporting
Collaborate with data scientists, analysts, and other stakeholders to establish data quality standards and implement data governance practices
Optimise data processing and storage systems for performance and scalability
Collaborate with cross-functional teams, including data scientists, analysts, and business stakeholders, to understand data requirements and deliver solutions

Qualifications
Programming Skills: Proficiency in programming languages such as Python, Java, Scala, or SQL is essential for data engineering roles. Data engineers should have experience in writing efficient and optimized code for data processing, transformation, and integration.

Database Knowledge: Strong knowledge of relational databases (e.g., SQL) and experience with database management systems (DBMS) is crucial. Familiarity with data modeling, schema design, and query optimization is important for building efficient data storage and retrieval systems.

Big Data Technologies: Understanding and experience with big data technologies such as Apache Hadoop, Apache Spark, or Apache Kafka is highly beneficial. Knowledge of distributed computing and parallel processing frameworks is valuable for handling large-scale data processing.

ETL and Data Integration: Proficiency in Extract, Transform, Load (ETL) processes and experience with data integration tools like Apache NiFi, Talend, or Informatica is desirable. Knowledge of data transformation techniques and data quality principles is important for ensuring accurate and reliable data.

Data Warehousing: Familiarity with data warehousing concepts and experience with popular data warehousing platforms like Amazon Redshift, Google BigQuery, or Snowflake is advantageous. Understanding dimensional modeling and experience in designing and optimizing data warehouses is beneficial.

Cloud Platforms: Knowledge of cloud computing platforms such as Amazon Web Services (AWS), Microsoft Azure, or Google Cloud Platform (GCP) is increasingly important. Experience in deploying data engineering solutions in the cloud and utilizing cloud-based data services is valuable.

Data Pipelines and Workflow Tools: Experience with data pipeline and workflow management tools such as Apache Airflow, Luigi, or Apache Oozie is beneficial. Understanding how to design, schedule, and monitor data workflows is essential for efficient data processing.

Problem-Solving and Analytical Skills: Data engineers should have strong problem-solving abilities and analytical thinking to identify data-related issues, troubleshoot problems, and optimize data processing workflows.

Communication and Collaboration: Effective communication and collaboration skills are crucial for working with cross-functional teams, including data scientists, analysts, and business stakeholders. Data engineers should be able to translate technical concepts into clear and understandable terms.

Additional Information

Education and Experience
Bachelor’s degree in Engineering required.
Minimum Two years of related experience is highly preferred.
Two certifications in GCP (within 3 months after joining).
Status: Full-Time
Duration: -
Beginning date: December 2024
The Devoteam Group is committed to equal opportunities, promoting its employees on the basis of merit and actively fighting against all forms of discrimination. We believe that diversity contributes to the creativity, dynamism, and excellence of our organization. All our positions are open to people with disabilities."
"Data Engineer
- job post",Bibit.id,Jakarta,None,None,"Company Description

Bibit.id is a platform to help you to start your investment in mutual fund in a very simple way.

Job Description

We are looking for a Data Engineer to develop, construct, test and maintain architectures, such as databases and large-scale processing systems. The data engineers will need to recommend and sometimes implement ways to improve data reliability, efficiency, and quality. This position will need to ensure that the architecture that is in place supports the requirements of the data scientists and the stakeholders, the business.
Responsibilities:
Construct and maintain efficient data pipelines + warehouses for data collection
Develop necessary scripts/mini-apps to run data analysis
Conduct tests on large scale data platforms.
Provide recommendations to improve data quality.
Ensure and support the data architecture utilized by data scientists and analysts.
Development of data processes for data modeling, mining, and data production.

Qualifications

Requirements:
Working experience of at least 2 years with exposure to Big Data, Real-time data pipelines, ETL processes and supporting tools/framework such as Airflow etc
Experienced in Cloud Service environment, especially GCP + BigQuery. Skill in other Cloud Services is a big plus.
Experienced third party behaviour analytics tools such as Firebase / Moengage / CleverTap etc
Experienced in working with RDBMS & Non-RDBMS datastores.
In conjunction with the requirement above, excellent skills in writing efficient querying language especially SQL
Experienced in utilizing popular Visualization Tools such as Tableau / Holistics / Metabase etc
Skilled in Python programming
Skilled in Pig Latin is a plus
Understand how to analyze & utilize data in order to provide value/insights for company decision making.
Good Teamwork & Communication skill"
"Data Engineer
- job post",Devoteam,Jakarta,None,None,"Devoteam is a leading consulting firm focused on digital strategy, tech platforms, and cybersecurity.
By combining creativity, tech, and data insights, we empower our customers to transform their business and unlock the future.
With 25 years’ of experience and 8,000 employees across Europe and the Middle East, Devoteam promotes responsible tech for people and works to create better change.
#Creative Tech for Better Change
Devoteam has launched in January 2021 its new strategic plan, Infinite 2024, with the ambition to become the #1 EMEA partner of the leading Cloud-based platform companies (AWS, Google Cloud, Microsoft, Salesforce, ServiceNow), further reinforced by deep expertise in digital strategy, cybersecurity, and data.

The Data Engineer will be responsible for the following activities:
Work closely with data architects and other stakeholders to design scalable and robust data architectures that meet the organization's requirements
Develop and maintain data pipelines, which involve the extraction of data from various sources, data transformation to ensure quality and consistency, and loading the processed data into data warehouses or other storage systems
Responsible for managing data warehouses and data lakes, ensuring their performance, scalability, and security
Integrate data from different sources, such as databases, APIs, and external systems, to create unified and comprehensive datasets.
Perform data transformations and implement Extract, Transform, Load (ETL) processes to convert raw data into formats suitable for analysis and reporting
Collaborate with data scientists, analysts, and other stakeholders to establish data quality standards and implement data governance practices
Optimise data processing and storage systems for performance and scalability
Collaborate with cross-functional teams, including data scientists, analysts, and business stakeholders, to understand data requirements and deliver solutions

Programming Skills: Proficiency in programming languages such as Python, Java, Scala, or SQL is essential for data engineering roles. Data engineers should have experience in writing efficient and optimized code for data processing, transformation, and integration.
Database Knowledge: Strong knowledge of relational databases (e.g., SQL) and experience with database management systems (DBMS) is crucial. Familiarity with data modeling, schema design, and query optimization is important for building efficient data storage and retrieval systems.
Big Data Technologies: Understanding and experience with big data technologies such as Apache Hadoop, Apache Spark, or Apache Kafka is highly beneficial. Knowledge of distributed computing and parallel processing frameworks is valuable for handling large-scale data processing.
ETL and Data Integration: Proficiency in Extract, Transform, Load (ETL) processes and experience with data integration tools like Apache NiFi, Talend, or Informatica is desirable. Knowledge of data transformation techniques and data quality principles is important for ensuring accurate and reliable data.
Data Warehousing: Familiarity with data warehousing concepts and experience with popular data warehousing platforms like Amazon Redshift, Google BigQuery, or Snowflake is advantageous. Understanding dimensional modeling and experience in designing and optimizing data warehouses is beneficial.
Cloud Platforms: Knowledge of cloud computing platforms such as Amazon Web Services (AWS), Microsoft Azure, or Google Cloud Platform (GCP) is increasingly important. Experience in deploying data engineering solutions in the cloud and utilizing cloud-based data services is valuable.
Data Pipelines and Workflow Tools: Experience with data pipeline and workflow management tools such as Apache Airflow, Luigi, or Apache Oozie is beneficial. Understanding how to design, schedule, and monitor data workflows is essential for efficient data processing.
Problem-Solving and Analytical Skills: Data engineers should have strong problem-solving abilities and analytical thinking to identify data-related issues, troubleshoot problems, and optimize data processing workflows.
Communication and Collaboration: Effective communication and collaboration skills are crucial for working with cross-functional teams, including data scientists, analysts, and business stakeholders. Data engineers should be able to translate technical concepts into clear and understandable terms.

Education and Experience
Bachelor’s degree in Engineering required.
Minimum Two years of related experience is highly preferred.
Two certifications in GCP (within 3 months after joining).
Status: Full-Time
Duration: -
Beginning date: December 2024
The Devoteam Group is committed to equal opportunities, promoting its employees on the basis of merit and actively fighting against all forms of discrimination. We believe that diversity contributes to the creativity, dynamism, and excellence of our organization. All our positions are open to people with disabilities."
"Data scientist
- job post",Kartu Prakerja,Jakarta,None,None,"We are looking for a passionate Data Scientist. As a Data Scientist at Prakerja, you will develop data science solutions that can help solve some of the challenges related to workforce development, productivity and competitiveness. What you will do:
Design, develop and implement NLP and other AI/Machine Learning models to generate insights, improve user experience and maximize project outcomes
Analyze large volume of data using statistical and machine learning techniques to drive optimization and improvement of product development and business strategies
Work with stakeholders to identify business objectives and opportunities
Requirements
Bachelor's Degree In Statistic/Mathematics/Computer Science/Data Science or another quantitative field
Minimum 2 years of experience working as a Data Scientist
Have strong analytical thinking skills
Expertise in SQL and Python/R
Expertise in Machine Learning and AI techniques, including supervised and unsupervised learning models
Experience working in NLP projects, especially in Bahasa Indonesia
Experience in A/B testing is desirable
Good business acumen and communication skills
Benefits
Working with the biggest Innovation Public Services in Indonesia
Working on the product used by 100 Millions of people in Indonesia from 514 city and district
Working hybrid (WHF and WFO)

For more about our output, outcome, and impact of Kartu Prakerja here"
"Junior Data Analyst
- job post",Amar Bank,Jakarta,None,None,"Who are we?

Amar Bank is one of the most technologically advanced digital banks in Indonesia. Our leading
digital lending product, Tunaiku has the distinction of being the first FinTech product in
Indonesia. We are also the first digital bank on the cloud. As the first profitable digital bank, we
managed to get listed on the Indonesian Stock Exchange.

How did we manage to do that?

We are changing people’s perception of a bank. We believe we are the innovators who combine
customer focus principles with creating technology-based impact. We incorporate freedom and
flexibility as part of our startup working culture DNA to encourage innovation in creating better
financial solutions for the banking industry. We think of ourselves as, ‘A technology company
with a banking license’. For this reason, we ‘Act like a FinTech, and think like a Bank.’

How did it all start?

Founded on March 15, 1991, in Surabaya as PT Anglomas International Bank (Amin Bank), the
bank was acquired by Tolaram Group and transformed to PT Bank Amar Indonesia (Amar Bank)
in 2014. It has then undergone a significant digital transformation to become one of the
country's forerunning fintech institutions through its award-winning digital lending platform,
Tunaiku.

Our philosophy, mission, and vision

Technology must impact lives, must improve lives. We exist to provide banking to those who
‘need’ and not only to those who ‘want’. Services when provided to those who need at the time
of their need brings smiles. Our vision is to bring 200 million smiles.

More about the bank with startup culture environment

Consist of 1000+ people, you will meet people who love to grow, dream big, and actually have
fun at the workplace! We provide a great working environment that pushes people to grow
outside their comfort zone. People with high drive and ambition find us a very attractive place to
work as their career growth matches their own drive and not any staid policies. Thus we hold
the honor of being awarded “Best Place to Work in Indonesia”.

Recently Amar Bank was awarded as Inspirational Brand from APEA (Asia Pacific Enterprise
Awards) 2022. Of course, our innovation won't stop here. So if you would love to be a part of it,
have a growth mindset, and are constantly hungry for challenges, we invite you to join us in our
journey to ‘Impact Lives’.

Join us today and create #unlimitedinnovations!

About the Position:

As a part of the Data Analyst team, you will collaborate with our Stakeholders to solve the problems with providing data & analytics solutions. You will play an essential role in the success of creating a data culture in the company by ensuring our Stakeholders can produce data-based decisions. If you are detail oriented and love to work with millions of data, this role can give you the chance to fully develop not only in technical aspects, but business & product acumen as well.
What Will You Do:
Create new & manage automated report/dashboard based on requirement defined by Stakeholders to ensure Stakeholders consume correct and latest data
Support and provide ad hoc data & analysis by pulling data from various sources
Understanding business & product flow in the company as requested to make work easier
Ensure correctness of data by collaborate with Data Engineer to maintain data quality aspect
Aware of beside high accuracy, speed delivery of task as important as well
Stay up-to-date with data and analytics trend
What You Need To Have:
Have experience related with data (Data Analyst, Data Scientist, Business Intelligence, Business Analyst, Product Analyst, etc) at least 2 years
Can create user friendly and insightful dashboard/report using one of various BI Tools (Eg : Tableau, Power BI, Google Data Studio, etc)
Mastering SQL to collecting & manipulating data
Can take conclusion of task that he/she done and have sense to interpret it
Have knowledge regarding end-to-end data analytics process
Comfortable working with million rows of data
Good intrapersonal skills to collaborate within/across function
Self driven, high curiosity, problem solving mindset and very detail oriented
Plus Point If You Have:
Have experience using Google Big Query
Have experience to explore data from 3rd party platforms (eg : Web & Mobile Analytics Platform, Marketing Attribution Platform, API logging platform, etc)
Have best practices to build Data Mart
We exist to innovate and maintain the architecture of Amar Bank's products. As part of our main focus to create through technology we ensure the process and technology we use helps maintain and build human connection at scale.

It’s our job to plan, monitor, and control the technology growth so we can provide a faster, more convenient, and more efficient way of performing business transactions."
"Senior Data Engineer
- job post",DKatalis,Jakarta,None,None,"About DKatalis

DKatalis is a financial technology company with multiple offices in the APAC region. In our quest to build a better financial world, one of our key goals is to create an ecosystem linked financial services business.

DKatalis is built and backed by experienced and successful entrepreneurs, bankers, and investors in Singapore and Indonesia who have more than 30 years of financial domain experience and are from top-tier schools like Stanford, Cambridge London Business School, JNU with more than 30 years of building financial services/banking experience from Bank BTPN, Danamon, Citibank, McKinsey & Co, Northstar, Farallon Capital, and HSBC.

About the Role
We are seeking a hands-on Senior Data Engineer to help us build out and manage our data infrastructure, which will need to operate reliably at scale using a high degree of automation in setup and maintenance. The role will involve setting up and managing the data infrastructure plus building new systems where required. Responsibilities will extend to building and optimizing key ETL pipelines on both batch and streaming data. The ability to work with the teams from product, engineering, BI/analytics and data science is essential. Ownership needs to be taken of data model design and data quality. The individual will also play active roles in ensuring data governance tooling is implemented and policies thereby adhered to.
The individual will also need to be able to work with technical leadership to make well informed architectural choices when required. A high degree of empathy is required for the needs of the downstream consumers of the data artefacts produced by the data engineering team, i.e. the software engineers, data scientists, business intelligence analysts, etc and the individual needs to be able to produce transparent and easily navigable data pipelines. Value should be assigned to consistently producing high quality metadata to support discoverability and consistency of calculation and interpretation.
Candidates should have a wide set of experience across the following platforms, systems, languages and capabilities:
Ideally GCP, but strong experience in another platform such as AWS or Azure will suffice
Event streaming platforms such as Kafka
Stream analytics frameworks such as Spark, GCP Dataflow, etc
Workflow scheduler such as Apache Airflow
Cloud data warehouses such as BigQuery, Redshift or Snowflake
Fluency in using Kubernetes, Python.
Comfortable writing detailed design documents"
"IT Data Analyst Manager
- job post",Orang Tua Group,Jakarta,None,None,"Kualifikasi:
Minimal S1 dengan IPK 3.00, dengan jurusan Teknik informasi
Memiliki pengalaman 2 tahun data scientist / big data
Memahami bahasa Phyton, R
Dapat menggunakan data visualization tools akan menjadi poin plus.
Memiliki kemampuan dan keinginan untuk mempelajari hal baru
Mampu memanage team dan koordinasi dengan team lainnya
Dapat bekerja secara efisien dan memberikan pengarahan technical ke team.

Deskripsi pekerjaan:
Melakukan analisa dan pengaturan data yang ada.
Mengolah data untuk dijadikan insight
Membuat desain arsitektur manajemen data
Memelihara infrastruktur data perusahaan
Membuat visualisasi data
Daftar Sekarang
Kembali Keatas"
