Company Name,Job Description
Ford Motor Company,"The Back End Developer candidate will be working to build a cloud-based platform to drive the development of Ford’s global Release & Update capability across millions of vehicles
The candidate for this role must be able to adapt in a rapidly changing environment and drive consistency of purpose for a complex organization. Prior experience in driving cross functional teams in multifaceted technical and regulatory constrained environments is essential. The candidate will have demonstrated strong collaboration in delivering technical initiatives, quickly turning concepts into functioning code. Prior experience in cloud software engineering or embedded systems in associated industries is an advantage.

You'll have…
Bachelor’s degree in Electronics, Computer Science or Software Engineering or a combination of equivalent experience and education
3+ years developing APIs using back-end technologies such Go or Python
3+ working with relational and/or NoSql databases, database design, and SQL Queries
Even better, you may have…
Masters degree
Worked with cloud platforms such as AWS , Azure , Google Cloud Platform
Experience with embedded build
CI experience with GitHub Actions or Jenkins
Knowledge of containerization and orchestration technologies. Docker, Kubernetes
Understanding of security best practices in web development
SaaS development experience
Demonstrated time in role working in a multi-disciplined organization focused on delivering development efficiency
Excellent communication skills both up and down the organization to achieve the desired results.
Critical Thinking: Demonstrated examples of applying systemic thinking, logic and reasoning skills to be able to identify opportunities, alternative solutions or approaches to problems.
Organizational skill: Strong collaboration skills, clear and concise direction coupled with an ability to move within the organization to complete work and balance tradeoffs.
Experience with SBOM

You may not check every box, or your experience may look a little different from what we've outlined, but if you think you can bring value to Ford Motor Company, we encourage you to apply!
As an established global company, we offer the benefit of choice. You can choose what your Ford future will look like: will your story span the globe, or keep you close to home? Will your career be a deep dive into what you love, or a series of new teams and new skills? Will you be a leader, a changemaker, a technical expert, a culture builder…or all of the above? No matter what you choose, we offer a work life that works for you, including:

Immediate medical, dental, and prescription drug coverage
Flexible family care, parental leave, new parent ramp-up programs, subsidized back-up child care and more
Vehicle discount program for employees and family members, and management leases
Tuition assistance
Established and active employee resource groups
Paid time off for individual and team community service
A generous schedule of paid holidays, including the week between Christmas and New Year’s Day
Paid time off and the option to purchase additional vacation time.

For a detailed look at our benefits, click here:
https://fordcareers.co/GSR-HTHD
https://fordcareers.co/GSRHTHDPaloAlto
This position is a range of salary grades 6-8.
Compensation will be determined according to experience and location.

Visa sponsorship is not available for this position.
Candidates for positions with Ford Motor Company must be legally authorized to work in the United States. Verification of employment eligibility will be required at the time of hire.

We are an Equal Opportunity Employer committed to a culturally diverse workforce. All qualified applicants will receive consideration for employment without regard to race, religion, color, age, sex, national origin, sexual orientation, gender identity, disability status or protected veteran status. In the United States, if you need a reasonable accommodation for the online application process due to a disability, please call 1-888-336-0660.
#LI-Hybrid

What you'll do...
Partner to deliver against the technical vision, technical strategy, and KPIs for this function – time from code to deploy.
Develop world-class systems – that include security and safety critical systems.
Drive data discipline and best practices through the organization.
Ensure projects and roadmaps are progressed appropriately."
Human Interest,"Human Interest is on a mission to ensure that people in all lines of work have access to retirement benefits.
Nearly half of all working Americans are not saving enough for their future. Too often it's because they are employed by a company that doesn't offer a retirement plan. Human Interest is changing that by making it affordable and accessible for small and medium-sized businesses to offer employees a path to financial independence through retirement savings.
We're a high-growth tech company changing the retirement industry. We've raised $500M and are backed by leading investors. Most recently, by funding from BlackRock as well as many other top investors: TPG (The Rise Fund) with SoftBank led our Series D, Glynn Capital, NewView Capital, USV
Are you ready to join our amazing engineering team?
As an engineering organization, we seek to redefine the retirement services space with software that drives toward an effortless, efficient, scalable and highly reliable cloud based experience. Joining our team requires passion for ownership - after all, this is what enables our users' success.
How we do it:
We value continuous improvement - we care about documentation, security, durability, not just throwing features over the wall. We help each other be better engineers - we leave things better than we found it. We aspire to collaborate seamlessly - we ensure our software is improving the customer experience.
About the Money In Financial Engines team
The Financial Engines Engineering Teams at Human Interest strive to deliver a cloud based platform that operates at the highest level of precision, auditability, performance, efficiency and interoperability. We do this through building and enhancing clean domain driven distributed services that together comprise all core workflows of a fully automated retirement solution. We build reusable software components and services that are highly efficient and leverage cloud services and open source technologies. The Money In Financial Engine team delivers some of the most highly utilized workflows in the company including owning the end to end processing of an employer's 401k contributions, processing of roll-ins and conversion of assets from former 401k plans.
About You
You are passionate about designing and delivering highly scalable and reliable service oriented architectures. You're comfortable with the lifecycle of feature and service development including data modeling, component design, sizing, building prototypes and gaining buy-in from technical and business stakeholders. You are a mentor for senior engineers in your organization and enjoy coaching them toward improving effectiveness and technical capabilities. You are knowledgeable in the areas of transaction processing, automation engines, reporting, integrations and cloud based technologies. You have conducted detailed performance analysis of systems and have designed scalable databases(both SQL and Nosql). You are a highly collaborative team player who is willing to both learn from as well as coach your teammates. You are committed to continuous learning and improvement.
About the role
This is a highly impactful, hands-on, senior level technical leadership role where the successful candidate will drive the technical direction for our organization of over 20 engineers across 4 agile teams. This includes providing technical guidance and mentorship to our senior engineers and technical leads. The role involves defining and refining our architecture, processes and best practices across our organization. As this is a hands-on role, the successful candidate will collaborate with domain experts, technical leads and engineers to design, build, test, and own systems and processes for servicing 401(k) plans and making our customers happy. As reliability and performance are key to earning our customers' trust, the role includes owning the overall robustness of our area and extending our system's reliability, scalability, observability and maintainability.
What you get to do every day
Define forward looking architectures through creation of designs, establishing tradeoffs in cost vs value and gaining buy in from key technical, product and business stakeholders.
Drive the delivery of prototypes, technical standards, project plans and roadmaps that align with the product vision of our organization and in conjunction with technical leads.
Coach and mentor senior level engineers in our organization to help raise the bar in innovation, efficiency and technical capability.
Deliver features and enhancements that improve complex processes and systems to make them more robust, higher performance and require less human intervention
Collaborate with other engineers and stakeholders to share knowledge and build expertise
Raise the bar of our team's standards resulting in cleaner, well documented and higher quality code.
Model and teach key behaviors for owning and delivering systems that are fast, horizontally scalable and reliable.
Speak up and advocate for forward looking architectures and designs that minimize human intervention while keeping development costs incremental.
What you bring to the role
Minimum 10 years of professional experience designing, building and maintaining large scale backend software products and systems.
Expert at designing and building modular distributed applications to support an extremely rapidly growing customer base(100x)
Solid understanding of the current landscape of auto-scaling cloud technologies and efficient usage of compute, storage, network and virtualization technologies. (preferably AWS)
You enjoy influencing cross-team standards, practices, and tools by modeling behaviors and demonstrating outcomes.
You can clearly articulate the business benefits that result from technical decisions.
You enjoy mentoring other engineers and helping them grow technically. You often have become a key go-to person in your company, even on projects outside your project area.
You have delivered large scale backend systems including ingesting and processing data at significant scale, managed elastic workloads using queue/worker and streaming architectures.
You have experience migrating to modern scalable technologies from monolithic systems and databases while maintaining high reliability and availability.
Strong desire to learn, exchange feedback and grow - from our internal legacy and futuristic technical designs, to retirement domains and workflows that are critical for our business.
Why you will love working at Human Interest
Mission - Highly collaborative startup dedicated to supporting employee engagement and growth. It's an opportunity to help solve one of the biggest unsolved problems in America: saving for retirement.
Culture - Our operating principles define how we come together as a team to do our work. They reflect Human Interest's unique view on what's important and what's right. Documenting this core aspect of our culture helps employees make good decisions on their own. It also helps candidates considering career opportunities critically evaluate whether they will thrive at Human Interest.
Customer obsession
Long-term orientation
Autonomous and accountable teams
An escalating bar for talent and performance
Fundamental optimism
Compensation - At Human Interest, there are a number of factors that are used to determine the appropriate pay range for each position. We take into account the cost of labor for each position in various markets across the US. The base salary for this position spans $245,000 - $275,000 and represents the minimum in our lowest geographic region to a maximum in our highest geographic region. The salary that we offer to a new employee within this range is based on their location within the US, their relevant job-related skills, and experience. At Human Interest, base salary is one component of the overall Total Rewards package. Depending on the position, additional compensation components such as bonus, commission, and equity may be offered. All of our employees are offered a robust suite of physical, financial and mental wellness benefits.
Benefits -
A great 401(k) plan: Our own! Our 401(k) includes a dollar-for-dollar employer match up to 4% of compensation (immediately vested) and $0 plan fees
Top-of-the-line health plans, as well as dental and vision insurance
Generous PTO and parental leave policies
Addition Wealth - Unlimited access to digital tools, financial professionals, and a knowledge center to help you understand your equity and support your financial wellness
Lyra - Enhanced Mental Health Support for Employees and dependents
Carrot - Fertility healthcare and family forming benefits
Candidly - Student loan resource to help you and your family plan, borrow, and repay student debt
Monthly work-from-home stipend; quarterly lifestyle stipend
Employee Resource Groups including Veterans, Lift Ev'ry Voice, Pride, LatinX, Families, and Women in Tech
Fun online and regional events and celebrations and department and company offsites
The vast majority of our positions can be 100% remote
We're a great place to work (but don't take our word for it)
Here's a list of our awards and accolades:
Certified as a Great Place To Work® (2023-2024)
Fortune Best Place to Work in the Bay Area (2024)
Best Places to Work by Built In (2023-2024)
America's Best Startup Employers by Forbes (2020-2022, 2024)
A Top Company by Y Combinator (2020-2023)
Inc. Fastest Growing Companies (2021)

Human Interest is an equal opportunity employer. All applicants will receive consideration for employment without regard to race, color, religion, sex, gender, gender identity or expression, sexual orientation, national origin, genetics, disability, age, veteran or military status, pregnancy, or any other characteristics protected under federal, state, or local laws.
We are committed to making every stage of our application process fully accessible to all individuals. If you need a reasonable accommodation at any point in the process, please let us know at applicantaccommodations@humaninterest.com.
Please note Human Interest does not accept unsolicited resumes from any source other than directly from candidates. We will not consider resumes from vendors including and without limitation search firms, staffing agencies, fee-based referral services, and recruiting agencies.
Pursuant to the San Francisco Fair Chance Ordinance, we will consider employment-qualified applicants with arrest and conviction records. We comply with CCPA guidelines.
See more: https://humaninterest.com/disclosures"
Loft Orbital Solutions,"Wanna join the adventure?

Loft Orbital are looking for a Backend Engineer to join our international Ground Software team. We currently have satellites in orbit, with multiple client payloads on each, and more launches happening in the near future. This role will focus on keeping our satellites safe, which is pretty important - so this is a key hire for us!
On a day to day basis you'll be in charge of analysing the performance of our satellites and constellations in orbit, designing manoeuvres and carrying out simulations using both first-party and third-party toolkits. You'll develop new, cutting-edge libraries, modeling satellite and attitude manoeuvres. You will also get to execute all of these concepts on-orbit, thereby iterating quickly and improving operations for all our satellites.

Research shows that while men apply to jobs where they meet an average of 60% of the criteria, women and other marginalized people tend to only apply when they meet 100% of the qualifications. At Loft, we value respectful debate and people who aren’t afraid to challenge assumptions. We strongly encourage you to apply, even if you don’t ‘check all the boxes.

About This Role:
Design the flight dynamics tools for our mission control and planning system
Writing scalable code - developing our flight dynamics services
Develop flight dynamics features in both open-source and proprietary libraries
Provide support with using cockpit internally
Propagate and Determine Orbits
Plan Orbital Maneuvers
Maintain and Manage our Satellites and Constellation from an orbital perspective
Participate in Spacecraft Ops - everybody is involved
Must Haves:
Python
C++
Orbit Propagation and Orbit Determination
State Estimation/Filtering Techniques
Orbital Maneuvering Techniques
Some Web development backend frameworks experience
API design
Nice to Haves:
Django
GraphQL
Database interactions
Kubernetes
Influx/Timescale DB
Attitude Dynamics
Spacecraft Constellation Management
Conjunction Assessment
Some of Our Awesome Benefits (US):
100% company-paid medical, dental, and vision insurance option for employees and dependents
Flexible Spending (FSA) and Health Savings (HSA) Accounts offered with an employer contribution to the HSA
100% employer paid Life, AD&D, Short-Term, and Long-Term Disability insurance
Flexible Time Off policy for vacation and sick leave, and 12 paid holidays
401(k) plan and equity options
Daily catered lunches and snacks
International exposure to our team in France
Fully paid parental leave; 14 weeks for primary caregiver and 10 weeks for secondary caregiver
Carrot Fertility provides comprehensive, inclusive fertility healthcare and family-forming benefits with financial support
Off-sites and many social events and celebrations
Relocation assistance when applicable
$119,000 - $175,000 a year
State law requires us to tell you the base compensation range for this role, which is $119,000-$175,000 per year, determined by your education, experience, knowledge, skills, and abilities. The salary range for this role is intentionally wide as we evaluate individuals based on their unique experience and abilities to fit our needs. Most importantly, we are excited to meet you, and see if you are a great fit for our team. What we can’t quantify for you are the exciting challenges, supportive team, and amazing culture we enjoy.
Who We Are

Loft Orbital builds “shareable” satellites, providing a fast & simple path to orbit for organizations that require access to space. Powered by our hardware & software products, we operate satellites, fly customer payloads onboard, and handle entire missions from end to end - significantly reducing the lead-time and risk of a traditional space mission.

Our standard interface enables us to fly multiple customer payloads on the same satellite, with capabilities such as earth imagery, weather & climate /science data collection, IoT connectivity, in-orbit demonstrations, and national security missions. Our customers trust us to manage their space infrastructure, so they can focus on what matters most to them: operating their mission and collecting their data.

At Loft, you’ll be given the autonomy and ownership to solve significant challenges, but with a close-knit and supportive team at your back. We believe that diversity and community are the foundation of an open culture. We are committed to hiring the best people regardless of background and make their time at Loft the most fulfilling period of their career.

We value kind, supportive and team-oriented collaborators. It is also crucial for us that you are a problem solver and a great communicator. As our team is international, you will need strong English skills to better collaborate, easily communicate complex ideas and convey important messages.

With 4 satellites on-orbit and a wave of exciting missions launching soon, we are scaling up quickly across our offices in San Francisco, CA | Golden, CO | and Toulouse, France.

As an international company your resume will be reviewed by people across our offices so please attach a copy in English."
Apple,"Summary

Posted: Aug 3, 2024

Weekly Hours: 40

Role Number:200561203

At Apple, new ideas have a way of becoming excellent products, services, and customer experiences very quickly. Bring passion and dedication to your job and there's no telling what you could accomplish! Claris, an Apple company, is a place where extraordinary people gather to do their best work. Just be ready to dream big. The workplace today is flooded by applications, but organizations struggle to integrate and automate processes that run across them. At Claris, we are building a better way for the world’s 500 million knowledge workers to do their jobs better. We accomplish this by empowering them to automate their processes and integrate data across all their applications in a matter of days thanks to a browser-based, easy-to-use visual platform. If you're passionate about testing scalable cloud-based applications, love APIs, want to be part of a group that works on a brand-new product, have the opportunity to shape it, and enjoy crafting robust, scalable, and maintainable services, we are the team for you!

Description

We are looking for a professional, experienced QA engineer who has a passion for using Go to test powerful, efficient microservices that change how Claris products operate. This is an opportunity to join a diverse team that focuses on creating high-quality services and solutions. It will require a deep understanding of Cloud concepts as well as building highly scalable microservice based solutions. To be successful, you will need to focus your creative energy on collaboration, communication and producing high quality deliverables. We are looking for a highly motivated and proactive thinker who can think strategically and stay connected to our customers. The ideal candidate will possess a high level of integrity, creativity, initiative, accountability, communication and interpersonal skills, with a commitment to teamwork and excellence.
Computer Science-Software Engineering Degree or equivalent software engineering experience
Hands-on experience with testing by using Behavior Driven Development (BDD) or Test-driven development (TDD) methodology, along with analytical thinking to build clear, concise, and comprehensive test scenarios.

Preferred Qualifications
Strong problem-solving and analytics skills, with the ability to investigate, debug and triage issues in complex distributed systems independently and cooperatively.
Practical experience with Go programming language and testing tools/frameworks (e.g. Postman, Ginkgo, Testify). Familiar with containerization environment (Docker, Kubernetes) and cloud environment (AWS or GCP).
Experience with testing modern, scalable and fault-tolerant SaaS application, microservice. Strong understanding of RESTful API, CLI design, NoSQL databases, and testing techniques.
Experience testing solutions utilizing WebSockets, web hook is desired. Familiar with Open API specification, OAuth, Single-Sign on.
Experience in Agile software development methodologies/Scrum and rapid releases.
Strong communication and cross-functional collaboration skills.

Pay & Benefits
At Apple, base pay is one part of our total compensation package and is determined within a range. This provides the opportunity to progress as you grow and develop within a role. The base pay range for this role is between $143,100 and $214,500, and your base pay will depend on your skills, qualifications, experience, and location. Apple employees also have the opportunity to become an Apple shareholder through participation in Apple’s discretionary employee stock programs. Apple employees are eligible for discretionary restricted stock unit awards, and can purchase Apple stock at a discount if voluntarily participating in Apple’s Employee Stock Purchase Plan. You’ll also receive benefits including: Comprehensive medical and dental coverage, retirement benefits, a range of discounted products and free services, and for formal education related to advancing your career at Apple, reimbursement for certain educational expenses - including tuition. Additionally, this role might be eligible for discretionary bonuses or commission payments as well as relocation. Learn more about Apple Benefits. Note: Apple benefit, compensation and employee stock programs are subject to eligibility requirements and other terms of the applicable plan or program.

More
Apple is an equal opportunity employer that is committed to inclusion and diversity. We take affirmative action to ensure equal opportunity for all applicants without regard to race, color, religion, sex, sexual orientation, gender identity, national origin, disability, Veteran status, or other legally protected characteristics. Learn more about your EEO rights as an applicant."
