Company Name,Job Description
Moveworks.ai,"Machine Learning Mountain View, CA Full Time

Who We Are
Moveworks is the universal AI copilot for search and automation across all your business applications. We give employees one place to go to find information and get support while reducing costs for your business. The Moveworks Copilot is powered by an industry-leading Reasoning Engine that uses a combination of public and proprietary language models to understand employee queries, then build and execute multi-step plans that achieve them. It does this by linking into systems (like ITSM, HRIS, ERP, identity management, and more) with native and custom-built integrations that turn natural language into powerful automations for employees.
The world’s most innovative brands like Databricks, Broadcom, Hearst, and Palo Alto Networks trust Moveworks to eliminate repetitive support issues, deliver instant knowledge, and empower employees to work faster across applications.
Founded in 2016, Moveworks has raised $315 million in funding, at a valuation of $2.1 billion, thanks to our award-winning product and team. In 2023, we were included in the Forbes Cloud 100 list as well as the Forbes AI 50 for the fifth consecutive year. We were also recognized by the 2023 Edison Awards for AI Optimized Productivity, and were included on Fast Company's Most Innovative Companies list for 2024!
Moveworks has over 500 employees in six offices around the world, and is backed by some of the world's most prominent investors, including Kleiner Perkins, Lightspeed, Bain Capital Ventures, Sapphire Ventures, Iconiq, and more.
Come join one of the most innovative teams on the planet!
What You Will Do
As a Senior Full Stack Engineer on the web team, you will play a lead role in creating the next generation of the Moveworks Enterprise Copilot ecosystem. The ability to leverage ML and Generative AI intelligence for the full stack makes it innovative and fun! Join us, and you'll find yourself in a unique playground, working on web applications that directly impact every Moveworks customer. In other words, we needed you here yesterday!
We're crafting an enterprise-focused GAI ecosystem. You'll shape diverse functionalities, cater to various user personas, and forge a solution that meets enterprise needs. Your role spans designing hybrid conversational experiences and creating robust UI frameworks with scalable, reliable building blocks.
Design and implement stakeholder and end-user product features using cutting-edge technical approaches to deliver business value.
Expand the product's reach to more customers, domains, and global markets, ensuring high quality engineering implementation.
Architect and build out Moveworks web technology stacks such as authentication, event tracking, application platform, and design systems.
Promote best practices and standards to build modular and scalable web apps and APIs between backend services.
Work closely with the product, ML and engineering teams to augment end-user experience, find creative solutions to fill in gaps in technology, and increase customer adoption.
Work at a startup pace in a small company with a high degree of ownership
What You Bring To The Table
BS or higher degree in computer science or a related field, or equivalent relevant experience
5+ years of professional development experience in building complex web applications
Experience with a major modern Web UI framework (e.g. ReactJS) and experience building UI at scale
Strong product sense and a passion for building scalable web or conversational UI products
Excellent cross-functional collaboration skills
A constant thirst for learning and a willingness to get out of your comfort zone
Nice To Have
Experience working with Machine Learning products
Compensation Range: $150,000 - $249,000
Our compensation package includes a market competitive salary, equity for all full time roles, exceptional benefits, and, for applicable roles, commissions or bonus plans.
Ultimately, in determining pay, final offers may vary from the amount listed based on geography, the role’s scope and complexity, the candidate’s experience and expertise, and other factors.
Moveworks Is An Equal Opportunity Employer
Moveworks is proud to be an equal opportunity employer. We provide employment opportunities without regard to age, race, color, ancestry, national origin, religion, disability, sex, gender identity or expression, sexual orientation, veteran status, or any other characteristics protected by law."
Ford Motor Company,"At Ford Motor Company, we believe freedom of movement drives human progress. We also believe in providing you with the freedom to define and realize your dreams. With our incredible plans for the future of mobility, we have a wide variety of opportunities for you to accelerate your career potential as you help us define tomorrow’s transportation.
Creating the future of smart mobility requires the highly intelligent use of data, metrics, and analytics. That’s where you can make an impact as part of our Global Data Insight & Analytics team. We are the trusted advisers that enable Ford to clearly see business conditions, customer needs, and the competitive landscape. With our support, key decision-makers can act in meaningful, positive ways. Join us and use your data expertise and analytical skills to drive evidence-based, timely decision-making.
Industrial Systems Analytics (ISA)is a product group that develops on-premises and cloud analytic solutions. This Software Engineer position is ideal for the technically oriented individual who has experience designing, building, deploying, and supporting cloud applications and is interested in working with a portfolio of strategic analytic solutions.
In this role, you will collaborate with multiple organizations (Business Customers, Product Owners, Data Tech, IT) to convert business goals into analytic solutions. This role will work in small, cross-functional teams and embrace lean and agile practices, software best practices, software quality scanning, automated testing, and CI/CD.

You'll have...
Bachelor’s degree in computer science, computer engineering or related quantitative field.
5+ years of overall experience in Software Engineering.
3+ years of experience with frontend frameworks (Angular, React, or Vue)
3+ years of experience with backend frameworks (Python, Flask, Django, FastAPI)
2+ years of experience with Python and Java programming languages
1+ years of experience with developing for and deploying to cloud platforms (e.g. GCP, PCF, Azure)
Even better, you may have...
Master’s degree in computer science, computer engineering or related quantitative field.
Proven experience understanding, practicing, and advocating for software engineering disciplines including eXtreme Programming (XP), Clean Code principles, Software Craftsmanship, Lean methodologies, Paired / Mob / Ensemble programming, Test-first/Test Driven Development (TDD), etc.
Comfortable with Continuous Integration/Continuous Delivery tools and pipelines e.g., Tekton, Terraform Jenkins, Cloud Build, etc.
Highly effective in working with other technical experts, Product Managers, UI/UX Designers and business stakeholders
Experience with CA Agile Central (Rally), backlogs, iterations, user stories, or similar Agile Tools
Experience in the development of microservices
Understanding of fundamental data modeling
Strong analytical and problem-solving skills
Willingness to collaborate daily with team members.
A strong curiosity around how to best use technology to amaze and delight our customers
You may not check every box, or your experience may look a little different from what we've outlined, but if you think you can bring value to Ford Motor Company, we encourage you to apply!

As an established global company, we offer the benefit of choice. You can choose what your Ford future will look like: will your story span the globe, or keep you close to home? Will your career be a deep dive into what you love, or a series of new teams and new skills? Will you be a leader, a changemaker, a technical expert, a culture builder…or all of the above? No matter what you choose, we offer a work life that works for you, including:
Immediate medical, dental, vision and prescription drug coverage
Flexible family care days, paid parental leave, new parent ramp-up programs, subsidized back-up childcare and more
Family building benefits including adoption and surrogacy expense reimbursement, fertility treatments, and more
Vehicle discount program for employees and family members and management leases
Tuition assistance
Established and active employee resource groups
Paid time off for individual and team community service
A generous schedule of paid holidays, including the week between Christmas and New Year’s Day
Paid time off and the option to purchase additional vacation time.

For a detailed look at our benefits, click here:
https://corporate.ford.com/content/dam/corporate/us/en-us/documents/careers/2024-benefits-and-comp-GSR-sal-plan-2.pdf
Visa sponsorship is available for this position.

Candidates for positions with Ford Motor Company must be legally authorized to work in the United States. Verification of employment eligibility will be required at the time of hire.

We are an Equal Opportunity Employer committed to a culturally diverse workforce. All qualified applicants will receive consideration for employment without regard to race, religion, color, age, sex, national origin, sexual orientation, gender identity, disability status or protected veteran status. In the United States, if you need a reasonable accommodation for the online application process due to a disability, please call 1-888-336-0660.

#LI-Hybrid

What you'll do...
The Software Engineer will work on a Balanced Product Team and collaborate with the Product Manager, Product Designer, and other Software Engineers to deliver analytic solutions. The Software Engineer will be responsible for the development and ongoing support/maintenance of the analytic solutions.
Product And Requirements Management: Participate in and/or lead the development of requirements, features, user stories, use cases, and test cases. Participate in stand-up operations meetings.
Author: Process and Design Documents
Design/Develop/Test/Deploy: Work with the Business Customer, Product Owner, Architects, Product Designer, Software Engineers, and Security Controls Champion on solution design, development, and deployment.
Operations: Generate Metrics, Perform User Access Authorization, Perform Password Maintenance, and Build Deployment Pipelines.
Incident, Problem, And Change/Service Requests: Participate and/or lead incident, problem, change and service request-related activities. Includes root cause analysis (RCA). Includes proactive problem management/defect prevention activities."
Wealthfront,"This role supports US-based remote work, or Palo Alto, CA based hybrid in-office.

We’re looking for iOS Engineers to join our team. As part of a cross-functional scrum team you will design and develop new investment account and cash account features within our iOS app. In addition to development on the app itself, you will write automated tests and integrate with our in-house design systems and our backend API. Come help our clients and prospective clients build wealth on their own terms!

As a core member of the team, you will:
Build a premier native iOS application
Collaborate with other engineers and designers to build new features and enhance existing features for our world-class app
Work with frontend and backend engineers to design, build and test reusable REST APIs
Design and build high-quality infrastructure; making the right tradeoffs for risk and long-term maintainability
Collaborate with design and product to define a delightful iOS experience
Get an opportunity to work with leadership to define the team's priorities and initiatives
Work independently, use available resources to get unblocked, and complete tasks on schedule by exercising strong judgment and problem-solving skills
Provide technical guidance and mentorship to peers
Ensure our iOS app and iOS CI systems operate smoothly in production by triaging and resolving operational issues as part of a team of on-call engineers
This role could be a fit if you have:
2 - 6 years of professional iOS development experience
Proficiency with Swift - knowledge of Objective-C is a plus but not required
Experience creating complex and performant user interfaces with UIKit and/or SwiftUI
Experience writing unit tests and testable code
Excellent problem solving, critical thinking and communication skills
You enjoy working in a fast-paced, cross-functional environment
BS or MS in computer science, related field, or equivalent professional experience
Once you join, Wealthfront will:
Pair you with a mentor who will guide you through our structured onboarding program
Encourage you to work on projects that match your professional goals
Support your professional development by providing feedback during weekly 1:1s and our semi-annual reviews
Provide you autonomy so you can be a happy and successful member of our team
Estimated annual salary range: $140,000 - $185,000 USD plus equity and a discretionary bonus.

Benefits include medical, vision, dental, 401K plan, generous time off, parental leave, wellness reimbursements, professional development, employee investing discount, and more!

About Wealthfront

Wealthfront started with the ambition to transform the investment advisory business, with the goal to unlock access to high quality investment advice for millions who were underserved by the traditional institutions. We built one of the first automated investment products that allows you to invest in a personalized portfolio of thousands of companies in seconds for a remarkably low fee. We then expanded. We now work with partner banks to offer exceptional banking features through a Wealthfront Brokerage Cash Account, which makes it remarkably easy for people to automate their finances end-to-end and eliminated the hassle of money management, all of which resulted in attracting more than $70 billion of our client’s hard earned money, pioneering the robo-advisor category and transforming the broader industry. And yet, we have a long way to go to achieve our mission to build a financial system that favors people, not institutions.

Wealthfront’s vision is to make it delightfully easy to build long-term wealth on your own terms. This vision is more relevant than ever because millions more people are getting into the market early and investing their hard earned savings in a handful of stocks. While this is a great way to start, it is inconsistent with building long-term wealth. We want to empower young investors to expand their horizon, and easily explore and execute on a wider range of investing strategies, make informed investment decisions that are consistent with their values and beliefs while also making it effortless to grow and compound their savings exponentially in a way that’s transformational to their lives and their long-term future.

For more information please visit www.wealthfront.com.

We are an equal opportunity employer and value diversity at our company. We do not discriminate on the basis of race, religion, color, national origin, gender, sexual orientation, age, marital status, veteran status, or disability status.

Please review our candidate privacy notice."
Pennymac,"PENNYMAC:
Pennymac (NYSE: PFSI) is a specialty financial services firm with a comprehensive mortgage platform and integrated business focused on the production and servicing of U.S. mortgage loans and the management of investments related to the U.S. mortgage market.

At Pennymac, our people are the foundation of our success and at the heart of our dynamic work culture. Together, we work towards a unified goal of helping millions of Americans achieve aspirations of homeownership through the complete mortgage journey.
A Typical Day:
The Pennymac technology team is seeking a technically proficient and driven Senior Backend Engineer to join our Master Data Management (MDM) team. You'll be integral in architecting and maintaining the critical data infrastructure that provides a single, trusted source of customer data for our sales and marketing teams. This role involves working with Reltio, a leading MDM platform, integrating it seamlessly with our systems using AWS serverless technologies, and collaborating with enterprise customer preference platforms like OneTrust or PossibleNow.
Key Responsibilities:
Reltio Expertise: Become a subject matter expert on Reltio, understanding its data modeling capabilities, workflows, and APIs.
Data Integration: Design, develop, and maintain integrations between Reltio, various source systems, and customer preference platforms (OneTrust, PossibleNow, etc.) using AWS Glue, Lambda, Kinesis, and SQS.
Data Quality: Implement data quality rules, matching algorithms, and cleansing routines to ensure the accuracy and completeness of customer data in Reltio, including preference and consent data.
Data Governance: Collaborate with data stewards and business users to define and enforce data governance policies within the MDM platform, particularly around customer preferences and consent management.
Performance Optimization: Monitor and optimize the performance of Reltio and its integrations to ensure efficient data processing and access, especially in relation to real-time preference updates.
Collaboration: Work closely with data engineers, architects, business stakeholders, and teams managing customer preference platforms to gather requirements, design solutions, and troubleshoot issues.
Innovation: Stay abreast of emerging trends and technologies in MDM, data integration, and customer preference management, evaluating their potential for improving our data management practices.
What You’ll Bring:
Education: Bachelor's degree in Computer Science, Engineering, or a related field.
Experience: 5+ years of hands-on experience in backend engineering or data integration, with at least 2 years of experience working with an MDM platform (Reltio experience is a plus) and experience integrating with enterprise customer preference platforms (OneTrust, PossibleNow or similar).

Technical Skills:
Proficiency in Python or another relevant programming language.
Expertise in AWS serverless technologies (Glue, Lambda, Kinesis, SQS).
Strong SQL skills and experience with Snowflake or a similar data warehouse.
Experience with data modeling, data cleansing, and data quality management, particularly as it relates to customer preferences and consent.
Understanding of REST APIs and web services.
Soft Skills:
Strong analytical and problem-solving abilities.
Excellent communication and collaboration skills, with the ability to effectively interact with both technical and non-technical stakeholders.
Attention to detail and a commitment to data accuracy.

Bonus Points:
Reltio certification or equivalent experience.
Experience with other MDM platforms.
Knowledge of data privacy and security regulations (e.g., GDPR, CCPA).
Familiarity with data visualization tools.
What We Offer:
Competitive compensation and benefits package.
Opportunities for professional growth and advancement in the field of MDM.
A collaborative and supportive work environment.
The chance to make a significant impact on a growing organization by ensuring the quality and reliability of our customer data.
Why You Should Join:
As one of the top mortgage lenders in the country, Pennymac has helped over 4 million lifetime homeowners achieve and sustain their aspirations of home. Our vision is to be the most trusted partner for home. Together, 4,000 Pennymac team members across the country are guided by our core values: to be Accountable, Reliable and Ethical in all that we do.
Pennymac is committed to conducting a business that makes positive contributions and promotes long-term sustainable growth and to fostering an equitable and inclusive environment, where all employees and customers feel valued, respected and supported.

Benefits That Bring It Home: Whether you're looking for flexible benefits for today, setting up short-term goals for tomorrow, or planning for long-term success and retirement, Pennymac's benefits have you covered. Some key benefits include:
Comprehensive Medical, Dental, and Vision
Paid Time Off Programs including vacation, holidays, illness, and parental leave
Wellness Programs, Employee Recognition Programs, and onsite gyms and cafe style dining (select locations)
Retirement benefits, life insurance, 401k match, and tuition reimbursement
Philanthropy Programs including matching gifts, volunteer grants, charitable grants and corporate sponsorships

To learn more about our benefits visit: https://pennymacnews.page.link/benefits

Compensation: Individual salary may vary based on multiple factors including specific role, geographic location / market data, and skills and experience as defined below:
Lower in range - Building skills and experience in the role
Mid-range - Experience and skills align with proficiency in the role
Higher in range - Experience and skills add value above typical requirements of the role

Some roles may be eligible for performance-based compensation and/or stock-based incentives awarded to employees based on company and individual performance.

Salary: $90,000 - $150,000 Work Model: OFFICE"
Hewlett Packard,"Does Big Data, AI and Cloud Native Data Lakes/DW get you excited? Does the thought of working as a backend engineer on sustainable Big Data customer engagement solutions interest you? How about working with leading edge technologies like Databricks on AWS? Can you see yourself integrating AI solutions with the best data tools in the world? Do you want to build CRM solutions at enterprise scale?
Do you enjoy playing the role of DevOps engineer? Are you excited to provide the best customer data privacy available and build on HP’s legacy as one of the most trusted brands in the world?
The Backend Engineer role will implement and architect a modern customer engagement solution for HP’s consumer subscription business. This role will develop data driven solutions to support the business.
This position will apply developed subject matter knowledge to solve common and complex business issues and implement those solutions in code. The daily work will consist of solving problems that are of diverse complexity and scope, while exercising judgment within generally defined policies and practices.
Key Responsibilities
Analyze design and determine coding, programming, and integration activities required based on specific objectives and established guidelines.
Create and manage RESTful APIs to support functionality and ensure seamless integration between different services.
Design limited enhancements, updates, and programming changes for portions and subsystems while identifying opportunities for performance improvements.
Design and optimize database schemas, write complex queries, identify, and resolve performance bottlenecks, ensuring the application is efficient and scalable.
Implement security and data protection measures in the role of a security champion.
Provides ongoing maintenance, updates, and bug fixes to ensure applications remain functional and up to date.
Collaborate and communicate with project team regarding project progress and issue resolution.
Maintain clear and comprehensive documentation for the codebase, APIs, and database schemas.
Education:
Bachelor’s degree in computer science, Software Engineering, or a related field.
Experience
8 years of backend specific programming,
Working with Big Data Distributed systems such as Databricks, AWS EMR, AWS Glue etc. and multiple Big Data file formats such as Parquet, Delta Lake etc.
Proficiency with cloud native technologies like AWS, Azure etc. and coding languages like Python, Java, Node.js, etc.
Strong experience with database technologies like MySQL, MongoDB, PostgreSQL etc.
Experience using No-SQL databases such as DynamoDB etc.
Experience with container management frameworks such as Docker, Kubernetes, ECR etc.
Experience working on CI/CD processes such as Jenkins, Azure pipelines etc.
Familiarity with version control tools such as GitHub, etc.
Familiarity in leveraging monitoring tools/frameworks, like Splunk, CloudWatch etc.
Knowledge & Skills
Strong analytical and critical thinking skills with ability to represent complex algorithms in software.
Database architecture testing methodology, including execution of test plans, debugging, and testing scripts and tools.
Effective communication skills (with team members, the business, and in code)
Ability to effectively communicate product architectures, design proposals and negotiate options at management levels.
Has a passion for data solutions and willing to pick up new programming languages, technologies, and frameworks
The base pay range for this role is $102,500 to $157,850 annually with additional opportunities for pay in the form of bonus and/or equity (applies to US candidates only). Pay varies by work location, job-related knowledge, skills, and experience.
Benefits:
HP offers a comprehensive benefits package for this position, including:
Health insurance
Dental insurance
Vision insurance
Long term/short term disability insurance
Employee assistance program
Flexible spending account
Life insurance
Generous time off policies, including;
4-12 weeks fully paid parental leave based on tenure
11 paid holidays
Additional flexible paid vacation and sick leave (US benefits overview)
The compensation and benefits information is accurate as of the date of this posting. The Company reserves the right to modify this information at any time, with or without notice, subject to applicable law."
