Job Title,Company Name,Location,Salary,Job Type,Job Description
"MOBILE DEVELOPER
- job post",PT. Kwadran Lima Mitra Kaya Solusi,Jakarta,"From Rp. 5,000,000 a month",Full-time,"Education minimum: Bachelor Degree in Computer Science or Information Technology
Understand Java and Kotlin programming language
Minimum 1 year experience as Developer Android Native (Java) or use Kotlin programming language
Mastering MVVM architecture/pattern
Fluent with tools such as Github and Jira
Experienced in using Android Development Tools (Android Studio, API, Android SDK, GIT)
Understand the concept of OOP (Object Oriented Programming)
Have analytical/problem solving skills and able to work in a team
Added value if you know SQL Query/Database
Jenis Pekerjaan: Penuh Waktu"
"MOBILE DEVELOPER
- job post",PT. Kwadran Lima Mitra Kaya Solusi,Jakarta,"From Rp. 5,000,000 a month",Full-time,"Education minimum: Bachelor Degree in Computer Science or Information Technology
Understand Java and Kotlin programming language
Minimum 1 year experience as Developer Android Native (Java) or use Kotlin programming language
Mastering MVVM architecture/pattern
Fluent with tools such as Github and Jira
Experienced in using Android Development Tools (Android Studio, API, Android SDK, GIT)
Understand the concept of OOP (Object Oriented Programming)
Have analytical/problem solving skills and able to work in a team
Added value if you know SQL Query/Database
Jenis Pekerjaan: Penuh Waktu"
"Mobile Developer
- job post",PT Ogya Tekno Nusantara,Tangerang,"From Rp. 11,000,000 a month",None,"Job Qualifications :
Bachelor's Degree in Computer Science, Information Technology or related field
Minimum 4 years of experience as Mobile Developer
Proficiency in React Native, Reactjs, Typescript, Javascript, PostgreSQL, HTML, CSS
Proficiency in API & Networking : REST API
Proficiency in code version tools, such as Git
Experienced on mobile native development Java/Kotlin for Android and Swift/Objective-C for iOS
Strong attention to detail, analytical and problem solving skill
Experienced working in teams
Good communication and interpersonal skill
Work Placement : Bintaro or Alam Sutera, Tangerang
Job Responsibilities :
Developing new features and user interfaces from wireframe models
Ensuring the best performance and user experience of the application
Fixing bugs and performance problems
Writing clean, readable, and testable code
Cooperating with back-end developers, designers, and the rest of the team to deliver well-architected and high-quality solutions
Job Types: Full-time, Contract
Contract length: 12 months
Application Deadline: 12/08/2023"
"Mobile Developer - Flutter
- job post",Techtiera Services Indonesia,Bekasi,"Rp. 7,000,000 - Rp. 8,000,000 a month",None,"Job Description:
The Mobile Developer will be responsible for creating multiple modules for an existing mobile application. This role requires following the existing application’s state management and structure while being innovative and taking the initiative to improve without depending solely on UI designs. The developer should be able to work effectively with the Flutter framework, applying the BLoC pattern for state management with a single state class pattern. They must be adept at following the established codebase’s folder structure, design patterns, and conventions, ensuring seamless integration with the current application. The ideal candidate will have the creativity to design and implement features without explicit UI designs from tools like Figma, relying on their understanding of design principles and user experience. They should also be capable of interpreting and executing tasks based on Business Requirements Documents (BRD), translating business needs into functional, user-friendly application features. Efficiency and the ability to work under tight deadlines are crucial, as the developer will need to deliver high-quality modules swiftly and contribute to the overall project’s success.
Requirements:
Framework Proficiency: Must be skilled in using the Flutter framework for mobile development.
State Management Expertise: Should be proficient in state management using the BLoC pattern with a single state class.
Codebase Familiarity: Able to follow and adapt to the existing codebase, including folder structure, design patterns, and conventions.
Creative Independence: Can work creatively without relying on UI designs from tools like Figma.
Business Requirements Understanding: Able to work based on Business Requirements Documents (BRD).
Speed and Efficiency: Capable of working quickly and efficiently to meet deadlines without compromising quality.
Experience: Minimum 2 years of experience in mobile development with specific framework (points 1-5).
Additional Details:
Work Type: Full WFO
Work Location: Cibitung, Cikarang Barat
Job Types: Full-time, Contract
Contract length: 12 months
Ability to commute/relocate:
Cibitung: Reliably commute or planning to relocate before starting work (Preferred)
Application Question(s):
How much is your expected monthly salary with us? (in gross)
How long will your notice period be from your current employer if required?
How much is your current monthly salary?
What is your last GPA? (IPK)
Education:
D1-D4 (Preferred)
Experience:
Flutter: 2 years (Preferred)
Language:
English (Preferred)"
"MOBILE DEVELOPER
- job post",Aero Systems Indonesia,Jakarta,None,None,"Requirements:
Bachelor's Degree in Computer Science/Information Technology or equivalent
At least 1 years of experience as Mobile Developer or related position
Has a good personality, teamwork, and eagerness to learn new knowledge
Familiarity with mobile app development environments like Xcode (iOS) and Android Studio (Android)
Knowledge of RESTful APIs to connect mobile applications to back-end services
Has experience with other object-oriented languages are advantageous
Understand the state of the art software development technology
Preferably can join immediately (ASAP) and willing to be placed onsite at ASYST Office (Soekarno-Hatta Airport Area)"
"Junior Mobile Developer
- job post",Techtiera Services Indonesia,Bekasi,None,None,"Role Description
The Mobile Developer will be responsible for creating multiple modules for an existing mobile application. This role requires following the existing application's state management and structure while being innovative and taking the initiative to improve without depending solely on UI designs. The developer should be able to work effectively with the Flutter framework, applying the BLoC pattern for state management with a single state class pattern. They must be adept at following the established codebase's folder structure, design patterns, and conventions, ensuring seamless integration with the current application.
The ideal candidate will have the creativity to design and implement features without explicit UI designs from tools like Figma, relying on their understanding of design principles and user experience. They should also be capable of interpreting and executing tasks based on Business Requirements Documents (BRD), translating business needs into functional, user-friendly application features. Efficiency and the ability to work under tight deadlines are crucial, as the developer will need to deliver high-quality modules swiftly and contribute to the overall project's success.
Qualifications
Min. Bachelor's degree in Computer Science or related field
Min. 1-2 years experiences in the same field
Mobile Application Development and iOS Development skills
Experience in Flutter Framework for mobile developer
PKWT (6 Months Contract)
Willing to WFO at Cibitung - Cikarang Barat
Benefit
BPJS TK & Kesehatan (Mandatory)
Private Insurance
THR
Bonus Akhir Kontrak (Menyesuaikan dengan UU Cipta Kerja)
Job Type: Contract
Contract length: 6 months
Ability to commute/relocate:
Cibitung: Reliably commute or planning to relocate before starting work (Required)
Application Question(s):
Bersedia untuk dikontrak selama 6 bulan? (Jawab: Bersedia/Tidak)
Bersedia untuk WFO di Cibitung - Cikarang Barat? (Jawab: Bersedia/Tidak)
Berapa current salary (gross) Anda saat ini? (Notes: Cantumkan dalam bentuk gross, bukan nett)
Berapa expected salary (gross) yang Anda harapkan? (Notes: Wajib mencantumkan dalam bentuk gross dan bukan nett)
Education:
S1 (Required)
Experience:
Mobile App Development: 1 year (Required)
Flutter: 1 year (Required)"
"Mobile Developer (Fluter)
- job post",Fresh Factory,Jakarta,None,None,"As an Associate Mobile Developer with experience in Flutter, you will play a crucial role in developing, maintaining, and enhancing mobile applications for both Android and iOS platforms. You will work closely with our UI/UX designers to translate design concepts into functional and visually appealing mobile applications. Your expertise will also help in managing existing codebases, debugging issues, and integrating custom APIs to ensure a seamless user experience.
Job Description:
App Development: Develop high-quality, maintainable, and efficient mobile applications using Flutter for both Android and iOS platforms.
UI/UX Implementation: Translate UI/UX designs into functional app features, ensuring that the final product is consistent with the design specifications and user experience guidelines.
Custom APIs: Understand and integrate custom APIs, ensuring smooth data exchange between mobile applications and backend services.
Code Maintenance: Maintain and enhance existing codebases, implement bug fixes, and optimize performance to improve application reliability and user experience.
Troubleshooting and Debugging: Identify, troubleshoot, and resolve issues reported by users or testers. Provide timely solutions to ensure high application stability and performance.
Collaboration: Work closely with cross-functional teams, including designers, backend developers, and project managers, to ensure seamless integration of features and adherence to project timelines.
Code Quality: Write clean, maintainable, and efficient code while adhering to best practices and coding standards.
Documentation: Create and maintain documentation for code, APIs, and development processes to support knowledge sharing and future maintenance.
Qualification:
Experience: Minimum of 2 years of professional experience in mobile development with a strong focus on Flutter.
Technical Skills: Proficiency in Flutter; experience with custom API integration; knowledge of Android and iOS development principles.
Technologies: Familiarity with MySQL, PostgreSQL, and Laravel is a plus.
Code Quality: Demonstrated ability to write clean, maintainable, and efficient code.
Troubleshooting: Strong debugging and problem-solving skills.
Communication: Excellent communication skills with the ability to work effectively in a team environment.
Attention to Detail: Strong attention to detail with a commitment to delivering high-quality software.
Job Type: Full-time"
"Immediate Opening for Mobile Developer
- job post",PAN ASIA SOFTWARE SOLUTIONS SDN BHD,Jakarta,None,None,"Greetings!!!
We have an Immediate Openings for Mobile App Developer (Flutter, React Native, Ionic) with our reputed Client.
Work Location: Subang Jaya, Malaysia.
Exp: 3+ years. Added Advantage Insurance Domain
Job Responsibilities:
Responsibilities for Mobile Developer
Identify and plan for new features
Develop application programming interfaces (APIs) to support mobile functionality
Suggest and implement new mobile products, applications and protocols
Remain up to date with the terminology, concepts and best practices for coding mobile apps
Work closely with colleagues to constantly innovate app functionality and design
Use and adapt existing web applications for apps
Write unit and UI tests to identify malfunctions
Communicate with users to understand their needs and experiences
Qualifications for Mobile Developer
4+ years of demonstrable experience
Demonstrable portfolio of released applications on the App store or the Android and iOS market
Extensive knowledge of Flutter, React Native & Ionic
Familiarity with OOP design principles
Experience with third-party libraries and APIs
Superior analytical skills with a good problem-solving attitude
Ability to perform in a team environment
Strong oral and written communication skills
Ability to interpret and follow technical plans
Interested Share your updated resume with Photo to or Watsapp: +60 165720562 along with below details
Current Salary:
Expected Salary:
Notice Period:
Total Exp:
Relevant Exp:
{Note: if it doesn't suit you, please refer your matching friends or kindly ignore it}
Senior IT Talent Acquisition Specialist
HP : +6016 572 0562
Job Type: Contract
Contract length: 6 months"
"IT Mobile Apps (Android Developer)
- job post",Farmers Market 99 Indonesia,Jakarta,None,None,"Job Requirements
Min. height NULL cm
Min. weight NULL kg
Min experience 2 tahun
Job Description and Responsibility
Responsibilities :
Developing new features and user interfaces from wireframe models
Ensuring the best performance and user experience of the application
Fixing bugs and performance problems
Cooperating with back-end developers, designers, and the rest of the team to deliver well-architected and high-quality solutions


Requirement Skill:
Minimum Bachelor degree in Information Technology / Information System, Minimum GPA 3.0
Experience 1-2 years in job positions
Develop mobile App & Web in ReactNative
Proficiency with HTML,CSS,JavaScript, ReactNative
Ability to write clean, understandable, well-documented code
Able to work independently as well as in team.
Good analytical and problem solving skills.


Placement: Head Office, Kembangan, Jakarta Barat
Additional Information

Informasi Umum
Departement
IT
Employee Type
Full Time
Location
Jakarta Barat, DKI Jakarta
Job Posted On
04 Oktober 2024 (a week ago)
Salary
Negotiable"
"Fullstack Developer - Freshgraduate
- job post",Alodokter,Jakarta,None,None,"Company Description

Alodokter is the #1 digital health company in Indonesia. Launched in 2014, Alodokter brings high-quality medical services to its 27+ million Monthly Active Users by providing an integrated mobile solution for patients and doctors. We empower patients and doctors with better knowledge to help them take better decisions: - More than 550K monthly teleconsultations between doctors & patients with 800+ doctors in our mobile app - Largest online booking of doctors and hospitals platform in Indonesia - Most complete medical content database for patients and doctors in Indonesia We believe that medical knowledge can help people take better decision for their personal and family health. Here at Alodokter, we are dedicated to help Indonesian finding the finest health services. We hire people who are passionate, engaging and genuinely dedicated to help others. We train our team to be knowledgeable and highly skilled and reward the value they bring to Alodokter.

Job Description
Developing scalable and robust front-end and back-end systems for back-end process
Developing APIs integration between product and back-end process
Working alongside with system analyst to developer the system
Maintain quality and responsiveness of back-end system
Maintain code integration and versioning
Act as level 1 support if there are system issues

Qualifications
Degree in Informatics or Computer Science
Graduated from reputable tech university with minimal GPA 3.00
Good in English
Strong in logic and problem-solving skill
Has knowledge in OOP
Has web fullstack programming experience
Has database skills
Has experience with API (Rest&SOAP) is a plus
Has experience with third party library is a plus
Has knowledge of Git(version control system) is a plus
Passion in software engineering
Passion to learn new things, solve challenging problems"
"Mobile App Developer
- job post",INTERSYS OPTIMA NUSANTARA,Jakarta,None,None,"Responsibilities:
Develop mobile application in the assigned platform based on specification documents.
Research the given requirement, report any difficulties and suggest better approach to implement the required features.
Fix bugs and implement enhancements to existing features.
Perform testing to ensure the quality of the project and/or patches.
Requirements:
Candidate must posses at least a Computer Science/Information Technology degree or equivalent with minimum GPA of 2.8.
At least 1 year of working experience in the related field is required for this position.
Strong knowledge of the Android and/or iOS platform.
Strong understanding of OOP concept, data structures, and algorithm.
Able to translate designs into perfect UI with detailed user experience native for the platform.
Familiar with web service implementation.
Required portfolio: Android/iOS apps that are published in Google Play Store/Apple App Store.
Good attitude, fast learner, and team player.
Fresh graduates with good logic and analytic thinking are encouraged to . Training will be provided upon hiring."
"Fullstack Developer
- job post",BCA SYARIAH,Jakarta,"Rp. 8,000,000 - Rp. 12,000,000 a month",None,"Kualifikasi :
Laki laki dan Wanita, usia 25-35
Pendidikan minimal S1 Teknik Informatika/Sistem Informasi/Teknik Komputer
Memiliki pengalaman minimal 3 tahun di posisi yang sama
Terbiasa dan memahami sistem pemrograman Web-Based/JavaScript/PHP/Visual Basic/Visual Foxpro/C/C++/Delphi/Web Design/Wordpress/Joomla, Database Concepts (Oracle / SQL / MySql / Bahasa Python
Deskripsi Pekerjaan :
- Mengembangkan aplikasi web (traditional dan reactive) dan mobile
- Membantu user bisnis dalam mendefinisikan kebutuhan bisnis ke spesifikasi fungsional dan teknis. Serta bertanggung jawab dalam full software development life cycle mulai dari technical design, development, testing, deployment dan maintenance secara Agile
- Menentukan dan mengelola arsitektur aplikasi
- Memastikan ketersediaan dan performa aplikasi yang baik
- Merencanakan dan mengeksekusi unit testing dan integration testing
- Melakukan identifikasi, troubleshooting dan resolving defect pada aplikasi yang dikembangkan baik di area development dan production
- Menjalankan tugas operasional untuk memastikan aplikasi yang telah dideploy ke production berjalan dengan baik
- Berkolaborasi dengan tim pengembang untuk memastikan integrasi antara antarmuka pengguna dan sisi server berjalan dengan lancar
- Mengetahui cara dan proses dalam menentukan dan mengelola proses Countinous Integration/Continous Deployment (CI/CD)
Job Type: Full-time"
"FULLSTACK DEVELOPER
- job post",PT. Kwadran Lima Mitra Kaya Solusi,Jakarta,"Up to Rp. 9,000,000 a month",None,"Requirements:
Education minimum: Bachelor Degree in Computer Science or Information Technology
3+ years of experience in software development experience
Strong software development fundamentals (data structures, algorithms, problem-solving, OO design, and systems architecture)
Strong understanding of object-oriented software development
Understanding of large and complex code bases, including API design techniques to help keep them clean and maintainable
Proficiency in Java and good knowledge of frameworks like CodeIgniter, Laravel, etc
Knowledge in process of multithreading, asynchronous and memory management specific to mobile devices and caching mechanisms
Willing to work on-site in Bekasi
Jenis Pekerjaan: Penuh Waktu"
"Mobile Developer
- job post",Treessolutions,Jakarta,None,None,"Mobile Developer
Job Requirements

Minimum a Bachelor Degree (S1) majoring in Industrial Engineering / Information Technology or equivalent.
Minimum 1 year of experience in a relevant professional discipline, but fresh graduates are welcome to apply.
Experience / familiar working on modern frontend and client technologies such as JavaScript, CSS3, HTML5, JSON, React.
Have a good knowledge, understanding, and experience in React Native.
Good understanding of UX design principles and best practices.
Experience working with RESTful APIs.
A team player, fast learner, and creative.
Having good interpersonal, communication, and presentation skills.
Strong in problem-solving, analytical skills, and logical approach.
English proficiency is a must.
Job Descriptions

We are looking for a Mobile Developer in our team who will be responsible for:

Supporting all aspects of the software development lifecycle includes design, development, testing, and deployment
Maintaining mobile applications and proactively improve the solution based on user requirements
Maintaining all project documentation
Reporting all activity support to Project Manager

E-mail Subject: (YOUR NAME-POSITION APPLIED)
Example: Fahri-Technical Consultant"
"MOBILE DEVELOPER
- job post",Astronacci International,Jakarta,None,None,"Tanggung Jawab Pekerjaan :
Mengembangkan mobile apps yang telah dirancang.
Melakukan maintainance & update aplikasi.
Ikut aktif berperan dalam memberikan solusi terbaik dalam pengembangan sistem.
Syarat Pengalaman :
Pendidikan minimal S1.
Pengalaman kerja minimal 2 tahun.
Kualifikasi :
Berpengalaman dalam bahasa pemrograman Java, Dart, Framework Flutter, Android Studio, dan Android Development.
Memiliki pemahaman yang baik tentang pemrograman berorientasi objek.
Terbiasa dengan RESTful API untuk menghubungkan Aplikasi Android dengan back-end service
Terbiasa dengan native development.
Terbiasa dengan android library retrofit, glide, firebase, rxjava atau setara.
Terbiasa dengan proses deployment aplikasi mobile (Playstore dan AppStore).
Memiliki pemahaman tentang Android Lifecycle.
Memiliki pengetahuan tentang fitur native mobile.
Bersemangat untuk mempelajari hal-hal baru.
Memiliki semangat untuk memecahkan masalah yang menantang.
Tunjangan :
Asuransi baik rawat inap & rawat jalan
Makan siang disediakan
Tunjangan komunikasi (internet)
Insentif :
Bonus kehadiran dan kedisiplinan
Bonus tahunan
Bonus jalan-jalan / outing baik dalam maupun luar negeri
Waktu Bekerja :
Senin (07.45 - 16.45 WIB) dan Selasa - Jumat (08.45 - 17.45 WIB)"
"IT Web and Mobile Developer
- job post",Surya Citra Media,Jakarta,None,None,"Jenis Pekerjaan :
Merancang dan membangun aplikasi seluler hybrid untuk Android dan iOS Apple.
Berkolaborasi dengan tim proyek/produk untuk menentukan fitur aplikasi.
Memastikan kualitas dan kinerja aplikasi sesuai spesifikasi.
Persyaratan
S1 dengan IPK minimal 3,00
Minimal 2 tahun pengalaman
Familiar dengan Android SDK, Android Studio dan XCode
Familiar dengan Flutter/Dart Framework
Familiar dengan PHP Frameworks (CI, YII, atau Laravel)
Terbiasa menggunakan MSSQL atau ORACLE adalah nilai tambah
Akrab dengan Javascript, EXTJS atau VueJS nilai tambah
Pengalaman dalam mengembangkan aplikasi Android dan iOS
Tetap up to date dengan terminologi, konsep dan praktik terbaik untuk pengkodean aplikasi seluler
Bergabunglah bersama kami dengan mengirimkan resume Anda melalui email ke:
career@scm.co.id"
"IT Web and Mobile Developer
- job post",Surya Citra Media,Jakarta,None,None,"Jenis Pekerjaan :
Merancang dan membangun aplikasi seluler hybrid untuk Android dan iOS Apple.
Berkolaborasi dengan tim proyek/produk untuk menentukan fitur aplikasi.
Memastikan kualitas dan kinerja aplikasi sesuai spesifikasi.
Persyaratan
S1 dengan IPK minimal 3,00
Minimal 2 tahun pengalaman
Familiar dengan Android SDK, Android Studio dan XCode
Familiar dengan Flutter/Dart Framework
Familiar dengan PHP Frameworks (CI, YII, atau Laravel)
Terbiasa menggunakan MSSQL atau ORACLE adalah nilai tambah
Akrab dengan Javascript, EXTJS atau VueJS nilai tambah
Pengalaman dalam mengembangkan aplikasi Android dan iOS
Tetap up to date dengan terminologi, konsep dan praktik terbaik untuk pengkodean aplikasi seluler
Bergabunglah bersama kami dengan mengirimkan resume Anda melalui email ke:
career@scm.co.id"
"IT Web and Mobile Developer
- job post",Surya Citra Media,Jakarta,None,None,"Jenis Pekerjaan :
Merancang dan membangun aplikasi seluler hybrid untuk Android dan iOS Apple.
Berkolaborasi dengan tim proyek/produk untuk menentukan fitur aplikasi.
Memastikan kualitas dan kinerja aplikasi sesuai spesifikasi.
Persyaratan
S1 dengan IPK minimal 3,00
Minimal 2 tahun pengalaman
Familiar dengan Android SDK, Android Studio dan XCode
Familiar dengan Flutter/Dart Framework
Familiar dengan PHP Frameworks (CI, YII, atau Laravel)
Terbiasa menggunakan MSSQL atau ORACLE adalah nilai tambah
Akrab dengan Javascript, EXTJS atau VueJS nilai tambah
Pengalaman dalam mengembangkan aplikasi Android dan iOS
Tetap up to date dengan terminologi, konsep dan praktik terbaik untuk pengkodean aplikasi seluler
Bergabunglah bersama kami dengan mengirimkan resume Anda melalui email ke:
career@scm.co.id"
"IT Web and Mobile Developer
- job post",Surya Citra Media,Jakarta,None,None,"Jenis Pekerjaan :
Merancang dan membangun aplikasi seluler hybrid untuk Android dan iOS Apple.
Berkolaborasi dengan tim proyek/produk untuk menentukan fitur aplikasi.
Memastikan kualitas dan kinerja aplikasi sesuai spesifikasi.
Persyaratan
S1 dengan IPK minimal 3,00
Minimal 2 tahun pengalaman
Familiar dengan Android SDK, Android Studio dan XCode
Familiar dengan Flutter/Dart Framework
Familiar dengan PHP Frameworks (CI, YII, atau Laravel)
Terbiasa menggunakan MSSQL atau ORACLE adalah nilai tambah
Akrab dengan Javascript, EXTJS atau VueJS nilai tambah
Pengalaman dalam mengembangkan aplikasi Android dan iOS
Tetap up to date dengan terminologi, konsep dan praktik terbaik untuk pengkodean aplikasi seluler
Bergabunglah bersama kami dengan mengirimkan resume Anda melalui email ke:
career@scm.co.id"
