Job Title,Company Name,Location,Salary,Job Type,Job Description,Date
Software Engineer - Web,PT Trinusa Travelindo,Jakarta,None,Full time,"It's fun to work in a company where people truly BELIEVE in what they're doing!
    Job Description
As a Software Engineer in the Financing Web Engineering Team, you will play a pivotal role in shaping Financing web-related products in Traveloka. You will work with a dynamic team of engineers, product managers, designers, data analysts, and QA engineers to deliver exceptional web experiences in our customer-facing web application and operational tools.
Some of your responsibilities if you choose to join:
Translating product and design requirements to high-performance and scalable user interfaces using the latest web standards and frameworks.
Performing technical assessment and impact analysis for product and technical initiatives.
Maintaining reliability and implementing incremental improvements to our web application and operational tools.
Producing high-quality front-end code while developing, testing, and debugging our web products.
Delivering web products independently while working closely with all relevant stakeholders.
In Traveloka, we believe technology is there to solve business problems. If you are a motivated and strategic professional passionate about driving engineering excellence, we invite you to join our team and contribute to our continued success.
  Requirements
Bachelor's degree in Computer Science or equivalent from a reputable university.
3+ years of professional web development experience.
Proficiency in HTML, CSS, JavaScript, TypeScript, and React is mandatory.
Strong comprehension of JavaScript promises and asynchronous programming.
Excellent problem-solving skills and a proactive attitude.
Ability to collaborate effectively with cross-functional teams.
Strong communication skills and the ability to explain technical concepts to non-technical stakeholders.
A passion for keeping up-to-date with the latest industry trends and technologies.
Having experience in React Native or other hybrid mobile apps development is a plus.
Having experience with Node.js and building automation solutions is a plus.
  If you like wild growth and working with happy, enthusiastic over-achievers, you'll enjoy your career with us!",None
Junior .NET/Core Developer,PT Intrias Mandiri Sejati,"Central Jakarta, Jakarta",None,Full time,"Job Description:
We are seeking a motivated and detail-oriented Junior .NET/Core Developer to join our growing development team. The ideal candidate will have a passion for coding and a desire to learn and grow in a fast-paced, dynamic environment. As a Junior .NET/Core Developer, you will work closely with senior developers to design, develop, and maintain web applications and APIs using the latest technologies within the Microsoft .NET ecosystem.

Key Responsibilities:
Assist in designing, developing, and maintaining web applications using .NET Core and ASP.NET technologies.
Write clean, scalable, and efficient code following best practices.
Collaborate with cross-functional teams including front-end developers, UI/UX designers, and product managers.
Participate in code reviews and contribute to team development standards and guidelines.
Debug and troubleshoot software issues and bugs.
Assist in the integration of APIs and third-party services.
Write unit tests and participate in the overall testing process.
Stay updated with the latest trends and technologies in software development, particularly in the
.NET space.
Job Requirements:
Bachelor's degree in Computer Science, Engineering, or related field (or equivalent practical experience).
Experience or familiarity with C# and the .NET Core framework.
Basic understanding of object-oriented programming (OOP) principles.
Experience or exposure to SQL and relational databases (e.g., SQL Server, MySQL).
Familiarity with HTML, CSS, JavaScript, and front-end frameworks is a plus.
Understanding of RESTful API development and integration.
Knowledge of version control tools such as Git.

Additional Skills:
Strong analytical and problem-solving skills.
Willingness to learn new technologies and tools.
Ability to work independently and in a team environment.
Good communication and interpersonal skills.",None
PYTHON DEVELOPER,AlphaPhilindo Solution Inc,Jakarta,"Rp 11,000,000 – Rp 16,000,000 per month",Full time,"Job Requirements:
1. Bachelor’s degree in computer programming, computer science, or a related field.
2. Solid experience as a Python programmer with a minimum of 2 years experience
3. Experience with Python framework (e.g., Django, Flask)
4. Knowledge of Docker, Server less, and/or working with cloud environment is a plus
5. Strong understanding of OOP, software development life cycle, and programming techniques and tools.
6. Fast learner, team player, and can work independently
7. Strong problem solving as well as verbal and written communication skills
8. Passionate in working with big data and building scalable system
9. Experience with Advance SQL Query and Optimization
10. Job placement in the Philippines & must be willing to work in the Philippines
 EXPECTATIONS:
- should be able to work with little supervision.
- should be adept at problem-solving.
- will work well within a team of fellow software engineers in an Agile/Scrum flow.",None
Automation Programmer,PT Weiss Tech,"Sidoarjo, East Java",None,Full time,"Perusahaan kami sedang mencari tenaga profesional untuk mengisi posisi sebagai Automation Programmer dengan kriteria sebagai berikut:
Lulusan S1 T. Otomasi/Mekatronika
Mampu membuat konsep/desain elektrikal mesin
Mampu membuat program sequence mesin
Menguasai bahasa pemrograman PLC & HMI
Pernah bekerja di bidang Automation & Robotics minimal 2 tahun",None
Fullstack Engineer Applications,PT Eka Bogainti,"Ciracas, Jakarta","Rp 9,000,000 – Rp 11,000,000 per month",Full time,"Job Description : 
Build and Develope Mobile and Web Apps
Build and Develope Restfull Api
Solving and Improve Applications
Support Apps and Web Operation
 Qualification :
Diploma/Bachelor's degree in Information Systems, Informatics Engineering
Minimum 3 years experience in the same field
Skill required : Mobile ( React Native ), Web ( CI4 dan Laravel ), Backend ( Java Spring Boot ), knowledge about git and ci-cd",None
ODOO DEVELOPER,PT Knitto Tekstil Indonesia,"Majalaya, West Java",None,Full time,"Job Description :
Merancang dan mengembangkan modul Odoo (pengembangan modul baru, penyesuaian, dan lain-lain).
Menangani permintaan perubahan modul aplikasi sesuai dengan kebutuhan user.
Mengelola database backend.
Berperan sebagai super-admin untuk solusi ERP dan aplikasi Android.
Requirements :
Pendidikan minimal D3/S1 Teknik Informatika, Sistem Informasi, dan bidang IT lain yang relevan.
Memahami program Odoo ERP (Accounting, Purchasing, Manufacturing, Inventory).
Memiliki pengalaman dalam mengembangkan modul Odoo.
Menguasai bahasa pemgrogaman Python, Javascript.
Memiliki pemahaman yang baik tentang bisnis & ERP.
Berpengalaman dengan Git, Linux, XML, PostgreSQL, dan QWeb.
Bersedia ditempatkan di Kabupaten Bandung (Majalaya).
 ",None
Software Engineer (Web) - Accommodation,PT Trinusa Travelindo,Jakarta,None,Full time,"It's fun to work in a company where people truly BELIEVE in what they're doing!
    Job Description
Develop Accommodation web platform using React.
Translate designs and wireframes into fully functioning and high-quality code.
Write well-designed, testable, and efficient code by using best practices.
Write tests for every assigned task.
Work closely with multiple stakeholders (Product, Design, QA, etc) on planning and execution
  Requirements
Bachelor's degree in Computer Science or a related field (or equivalent experience).
3+ years of professional web development experience.
Proficiency in HTML, CSS, JavaScript, TypeScript, React, and Next.js.
Proficiency in React Native is a plus.
Strong comprehension of JavaScript promises and asynchronous programming.
Experience with Node.js and building automation solutions is a plus.
Excellent problem-solving skills and a proactive attitude.
Ability to collaborate effectively with cross-functional teams.
Strong communication skills and the ability to explain technical concepts to non-technical stakeholders.
A passion for keeping up-to-date with the latest industry trends and technologies.
  If you like wild growth and working with happy, enthusiastic over-achievers, you'll enjoy your career with us!",None
Junior .NET Developer,PT Perangkat Lunak Indonesia,"North Jakarta, Jakarta","Rp 5,500,000 – Rp 7,000,000 per month",Full time,"AGILIS Solutions, a software development service company, is looking for candidates for Junior .NET Developer position, who meet the following requirements:
Candidate must possess at least one of the following: SMK, Diploma, or Bachelor's Degree in Computer Science/Information Technology or equivalent fields.
Required language(s): Bahasa Indonesia, English
1 year working experience in the related field for this position (fresh graduates are welcomed).
Good communication skill.
Open to learn new software development technologies and platforms.
 Responsibilities:
Write clean and readable code based on business requirements and coding standard.
Participating in technical discussion and meetings.
Ensuring the technological watch in your area of knowledge.
 Technical qualifications:
Experienced in web development using ASP.NET MVC (C#) or .NET Core (C#)
Experienced in Database Operations (SQL Queries, Stored Procedures, Views, etc.)
Experienced in front-end web technologies (HTML, CSS, JavaScript)
 ",None
.Net Developer,PT Phincon,Jakarta,Rp 8.000.000 – Rp 11.500.000 per month,Contract/Temp,"Requirements:
- Min. Lulusan S1 jurusan Teknik Infomartika/Ilmu Komputer
- IPK minimal 3.00
- Memiliki pengalaman sebagai developer selama 1 - 2 tahun
- Memiliki minat dibidang programming dan software engineering
- Penempatan di Jakarta Barat
- Memiliki pengalaman di industry Banking atau Financial
- Menguasai .NET CORE
- Memahami konsep pemograman/application Front-end & Back-end
- Menguasai basic SQL Statement
- Memahami konsep dan teknik design database dan mampu membuat ERD documentation
- Familiar dengan framework Angular menjadi nilai plus

Jobdescription: 
- Berpartisipasi dalam analisis kebutuhan
- Menulis kode yang bersih dan dapat diskalakan menggunakan bahasa pemrograman .NET
- Menguji dan menerapkan aplikasi dan sistem
- Merevisi, memperbarui, memperbaiki, dan men-debug kode
- Meningkatkan perangkat lunak yang ada
- Mengembangkan dokumentasi di seluruh siklus hidup pengembangan perangkat lunak (SDLC)",None
Backend Developer,PT. Fidac Inovasi Technology,Jakarta,None,Full time,"Kualifikasi:
Pendidikan min. D3 jurusan IT/Sistem Informasi.
Memiliki pengalaman setidaknya 2 Tahun di bidang yang sama.
Pemahaman yang kuat tentang siklus pengembangan web dan teknik serta alat pemrograman.
Memiliki pengetahuan yang baik tentang aplikasi web & seluler, database (mySQL, MongoDB) dan sistem terdistribusi (penerapan).
Memiliki pengalaman membuat API RESTful dan Mock.
Keterampilan yang dibutuhkan : Java, PHP, Python atau Laravel, NodeJS atau Golang, MySQL, MariaDB, Git, Codeigniter/express, Scrum Agile.
Lancar di Docker / Kubernetes.
Memiliki inisiatif, motivasi diri, perhatian terhadap detail, dan baik dalam kerja tim.
Keterampilan komunikasi verbal yang sangat baik.
Keterampilan pemecahan masalah yang baik.
 Tugas & Tanggung Jawab:
Berkontribusi ke seluruh siklus hidup aplikasi, dengan fokus pada pengkodean dan debugging.
Integrasikan elemen yang menghadap pengguna yang dikembangkan oleh pengembang front-end dengan logika sisi server.
Optimalkan aplikasi untuk kecepatan dan skalabilitas maksimum.
Menerapkan keamanan dan perlindungan data.
Merancang dan mengimplementasikan solusi penyimpanan data (ERD).
Mengintegrasikan, mengelola, dan optimasi database.
Bekerja dengan framework back end (Laravel, Nodejs, Flask dll).
Menggunakan bahasa pemrograman server-side.
Integrasi API.
Keamanan dan pencegahan peretasan.
Teknologi server web.
Menyiapkan data dari DB sesuai kriteria yang di inginkan FE.
Menjembatani FE dan Database, jembatan disini berupa API/service.
Tingkatkan, dan Terapkan layanan backend dan API berkualitas tinggi.
Mendiagnosis masalah, dan membantu menciptakan solusi.",None
SOFTWARE DEVELOPER,PT Sentral Mitra Informatika,"South Jakarta, Jakarta",Rp 12.000.000 – Rp 16.000.000 per month,Full time,"We are looking is a Software Developer . 
The person should have a few years of end-to-end implementation experience. 
Experience working with C#, and particularly modern, cross-platform .NET, .NET Core
Knowledge and experience working with AWS technologies such as Lambda, S3, RDS, EC2, Fargate
A strong understanding of advanced C# language features, such as async/await, dependency injection, etc.
Good knowledge of Transact SQL and Entity Framework Core
Knowledge of a modern web frontend stack
Excellent troubleshooting skills
Proficient in SQL for SQL Server and/or PostgreSQL
Knowledgeable in Object-oriented design (OOD) techniques",None
Java Developer,PT Nusantara Duta Solusindo (NDS),Jakarta,None,Full time,"PT. Nusantara Duta Solusindo is looking for a skilled Java Developer to join our dynamic team. The ideal candidate is passionate about technology, eager to learn and grow, and has a strong background in developing high-quality software solutions.
Levels:
Junior: 0-2 years of experience is a plus.
Middle: 2-4 years of experience is a plus.
Senior: More than 4 years of experience is a plus.
Requirements:
Bachelor’s degree in Computer Science, Information Technology, or a related field.
Proficiency in Java, with a good understanding of its ecosystems.
Experience with popular Java frameworks and libraries (e.g., Spring, Hibernate).
Familiarity with front-end technologies (e.g., HTML, CSS, JavaScript, Angular, React) is a plus.
Knowledge of databases (e.g., MySQL, PostgreSQL, Oracle) and SQL.
Experience with RESTful APIs and web services.
Familiarity with version control systems (e.g., Git).
Understanding of Agile methodologies and DevOps is a plus.
Experience in the banking or finance industry is a plus.",None
Senior Frontend Engineer,PT Amartha Mikro Fintek (Jakarta),"Kebayoran Lama, Jakarta",None,Full time,"Description
Developing stunning user-facing features.
Ensuring the technical feasibility of UI/UX designs.
Optimizing application for maximum speed and scalability.
Continuously improve code quality, product execution, and learning experience.
Coordinate across teams (Mobile, Backend, DevOps, Data, Product, QA etc.) on planning and execution.
Solve challenging financial access problems in Indonesia by using cutting-edge technology.
Requirements
Has minimum 5 years of experience in the related field
Fast learner & good analytical thinking.
Advanced knowledge in NextJS or ReactJS.
Used to with secure engineering
Strong understanding and experiences in HTML, CSS, Javascript.
Strong understanding of the latest UX/UI design trend.
Strong understanding of user-friendly experience and interface, cross-browser compatibility, responsive design, general web functions and standards
Have a systematic problem-solving approach and knowledge of algorithms, data structures, and complexity analysis.
Good communication skill, team player and comfortable working with a cross-functional team.
Have a passion for learning, improving and contributing to projects with a strong sense of ownership.
 ",None
Software Engineer - Web,PT Trinusa Travelindo,Jakarta,None,Full time,"It's fun to work in a company where people truly BELIEVE in what they're doing!
    Job Description
As a Software Engineer on our Web Engineering team, you will play a pivotal role in shaping the future of transportation technology. You will work with a dynamic team of engineers, product managers, designers, data analysts, and QA engineers to deliver exceptional web experiences and automation solutions.
In this role, you’ll get to:
Write well formatted modular code, complete programming, and perform testing and debugging using relevant tech stacks (HTML, CSS, JavaScript, TypeScript, React, Next.js, and Node.js) and technologies
Build large scale, Robust and scalable applications 
Do high level design with guidance, do incremental changes to architecture and analyze impact of the same 
Produce high quality software that is unit tested, code reviewed, and checked in regularly for continuous integration. 
Do performance tuning and improvements in large scale distributed systems 
Cross team/geographies collaboration with product and engineering teams
  Requirements
Bachelor's degree in Computer Science or a related field (or equivalent experience).
5+ years of professional web development experience.
Proficiency in HTML, CSS, JavaScript, TypeScript, React, and Next.js.
Strong comprehension in JavaScript promises and asynchronous programming.
Experience with Node.js and building automation solutions is a plus.
Excellent problem-solving skills and a proactive attitude.
Ability to collaborate effectively with cross-functional teams.
Strong communication skills and the ability to explain technical concepts to non-technical stakeholders.
A passion for keeping up-to-date with the latest industry trends and technologies.
  If you like wild growth and working with happy, enthusiastic over-achievers, you'll enjoy your career with us!",None
PHP Developer,PT Esha Parama Teknologi,Jakarta,None,Full time,"MANDATORY: S1
EXPERIENCE AS LEADER
Job Description:
- At least 1-3 years working experience in delivery of technology solution and/or large-scale enterprise system 
- Bachelor’s degree in computer science or a similar field.
- Knowledge of PHP web frameworks including Yii, Laravel, and CodeIgniter.
- Knowledge of front-end technologies including CSS3, JavaScript, and HTML5.
- Understanding of object-oriented PHP programming.
- Preferably someone who experience in managing team using agile principles and has knowledge of insurance 
- Previous experience creating scalable applications.
- Proficient with code versioning tools including Git, Mercurial, CVS, and SVN.
- Familiarity with SQL/NoSQL databases.
- Ability to project manage.
- Good problem-solving skills.
- Willing to work WFO
 ",None
Technical Lead (Fullstack),PT Akar Inti Teknologi,"Central Jakarta, Jakarta",None,Full time," About the Company: 
 
Akar Inti Teknologi (AIT) is a full-service software house headquartered in Jakarta that focuses on helping companies excel in their digital transformation. We pride ourselves on building solutions that go beyond mere functionality, aiming for reliability and scalability that exceed expectations. With a portfolio of successful projects for renowned brands in diverse industries, our track record speaks for itself.  
 
From our roots in banking and financial institutions, we've expanded our reach to help drive digitalization in diverse industries such as financial services, loyalty programs, healthcare, lifestyle brands, and beyond. 
 
Our journey has traveled remarkable distances, propelled not solely by our innovative solutions, but by the dedication and brilliance of our exceptional #AITteam. They embody our vision, drive, and unwavering commitment, driving us forward into boundless achievement. On top of this, we foster a culture of #TeamLIT (Teamwork, Learning, Innovation and Transparency). Through our culture, we ensure all of our #AITteam can perform and thrive to their fullest potential. 
 
About the People: 
We believe in putting our people first, which is why we've created an environment where great work is not only recognized but encouraged and celebrated. With a strong emphasis on teamwork, learning, innovation, and transparency, our #TeamLIT culture empowers every team member to reach their full potential. We offer unparalleled learning opportunities and benefits designed to support our employees in both their personal and professional growth. From comprehensive training programs to flexible work arrangements, we strive to create an environment where everyone can thrive.  
 
Our team members are not just employees; they are valued collaborators, each bringing their unique talents and perspectives to the table. There's a spirit of camaraderie that permeates every aspect of our organization, where egos are left at the door, and the focus remains on collective progress. Whether you're a seasoned professional or a newcomer to the industry, you'll find that our team is welcoming, supportive, and eager to help you thrive. Together, we work towards common goals, pushing boundaries and breaking barriers, because we understand that our success is intertwined. 
 
Become part of our journey, where together, we will innovate our way to success. Don’t worry, you are in good hands. 
About the Role: As the Technical Lead, you will be responsible to guide the development team in delivering high-quality software solutions. Your role will involve mentoring developers, making key architectural decisions, and closely collaborating with stakeholders to align technical direction with business goals. Expertise in Node.js (NestJS), Postgres, and Microservices architecture is essential for this role. 
Responsibilities: 
Lead and manage a team of developers, offering technical guidance, mentorship, and fostering a collaborative environment. 
Architect, design, and implement scalable, high-performance software solutions using Node.js (NestJS), Postgres, and Microservices architecture. 
Perform comprehensive code reviews, ensuring adherence to best practices, coding standards, and robust security protocols. 
Continuously monitor, optimize, and enhance application performance, ensuring system reliability, scalability, and efficiency. 
Proactively troubleshoot and resolve complex technical issues, providing hands-on support to the development team as needed. 
Collaborate closely with product managers and stakeholders to ensure alignment between technical solutions and business objectives. 
Stay updated on emerging technologies and industry trends, driving innovation and the adoption of best practices within the development team. 
Requirements: 
A Bachelor's degree in Computer Science, or equivalent work experience or certifications/courses, is required.  
Must have at least 3 years of managerial experience engineering role . 
Experience in leading cross-functional teams within a fast-paced environment. 
Demonstrated experience as a Technical Lead or Senior Developer with a robust background in software development. 
Strong communication and leadership skills, with a proven ability to collaborate effectively across teams. 
Expertise in Node.js, with significant experience in the NestJS framework. 
Experience in other programming language such as Java, Golang, PHP and others would be an advantageous skill set. 
Strong proficiency in relational databases, particularly PostgreSQL. 
In-depth understanding of Microservices architecture and best practices. 
Experience with cloud platforms (e.g., AWS, Azure, GCP) and containerization technologies (e.g., Docker, Kubernetes). (Bonus) 
Excellent problem-solving skills with the ability to address complex technical issues. 
Knowledge of front-end technologies (e.g., React) and their integration with backend services. 
Familiarity with security best practices and application security principles. ",None
Backend Developer,"PT. Metrodata Electronics, Tbk",Jakarta,None,Contract/Temp,"We are looking for an experienced Backend Developer to join our team. If you have excellent programming skills and a passion for developing applications or improving existing ones, we would like to meet you. As a Backend Developer, you’ll work closely with our engineers to ensure system consistency and improve user experience. 
Backend Developer roles and responsibilities include:  
Design, Develop, Analyze, troubleshooting related Backend Development.
Collaborate with Frontend Developer
Involved in all aspects of the development lifecycle, including development, Testing, UAT, deployment, warranty and post-warranty bug fixes.
Conduct analysis and problem solving of application accuracy, application dependency, reporting and technical function.
PT Metrodata Electronics, Tbk (Digital Solution Provider & Technology Innovator) would like to invite you to be part of the company to develop yourself and your skills. If you are: 
Bachelor's Degree Computer Science/Information Technology 
At least 2 year(s) of working experience as Backend Developer
Proficient knowledge of a backend programming language and an in depth understanding of web development
Experienced in NodeJs or JavaScript programming language 
Understand the concept of MVC
If you meet the requirement we needed, let’s apply for the following open positions. Metrodata not just offer for the job, we offer you for brighter career future. 
  ",None
