Job Title,Company Name,Location,Salary,Job Type,Job Description,Date
IT DEVELOPER MICROSOFT DYNAMICS,PT The Master Steel MFc,"Menteng, Jakarta",Rp 5.000.000 – Rp 6.000.000 per month,Part time,"Developer/Technical Consultant, Microsoft Dynamics
 Job Requirements:
 Bachelor’s degree in Computer science, Information Technology, or related field.
Minimum of 1 year of experience as a developer.
Understanding the fundamentals of Microsoft Dynamics products. This includes Dynamics 365, Dynamics CRM, and other related tools. Microsoft provides extensive documentation and online training resources.
Familiar with Journal entry, AP, AR and Account reconciliation
Proficiency in programming languages such as AX X++, C#, and .NET.
Knowledgeable in SQL Server database operations.
Strong understanding of system integration techniques and tools.
Have an understanding of reporting services 
Excellent problem-solving and analytical skills.
Strong communication and interpersonal skills.
Ability to work effectively in a team-oriented environment.",None
Senior IT Developer,PT Bhinneka Life Indonesia,"West Jakarta, Jakarta",None,Full time,"Job Description:
Bertanggungjawab atas pengembangan sistem yang berjalan.
Review dan debug existing code.
Memahami dan menganalisis proses bisnis dengan proses sistem IT yang ada dan melakukan pemantauan, pemeliharaan serta perbaikan.
Memberikan respon kepada User atas permintaan pengembangan sistem.
Mentoring dan membimbing anggota tim junior, mendorong pertumbuhan profesional mereka serta mendorong penerapan standarisasi kualitas pengembangan sistem.
 Job Requirement:
Memiliki pengalaman sebagai developer minimal 3 tahun.
Memiliki pengalaman dalam manage team dan lead team developer.
Menguasai bahasa pemograman PHP, HTML, CSS Javascript dan NodeJs.
Menguasai penggunaan database (Oracle, SQL, Server dan MySQL).
Memahami Git, Docker dan sistem operasi (Linux & Windows server).
Memiliki kemampuan untuk bekerja secara mandiri dan kelompok.
Mengenal istilah-istilah dalam dunia perasuransian menjadi nilai plus.",None
IT Developer,PT Asuransi Central Asia,"West Jakarta, Jakarta",None,Full time,"Job Desc:
Melakukan development aplikasi
Melakukan analisa atas Requirement
Merencanakan pemasangan pada system baru atau existing
Membuat laporan kepada atasan
 Kualifikasi :
Minimum education Bachelor majoring in Information Engineering / Information Systems. minimum GPA of 3.00 (scale 4)
Fresh Graduate welcome to apply
Highly skilled in VB.Net and SQL
Prefer to understand CGISS / CHISS
Interest in coding and programming
Able to analyze business process and system functionality
Good Analytical Thinking
Good Documentation
Having good attitude, responsible can work multiple project and excellent team player
Good time management, self descipline and strong interpersonal communication
Proses recruitment dilaksanakan Offline
Penempatan di Jakarta Barat
 ",None
IT Application Developer,Ciputra Hospital (Kalideres),"West Jakarta, Jakarta",None,Full time,"Bertanggung jawab untuk membuat, meningkatkan, dan memelihara aplikasi perangkat lunak yang mendukung proses dan tujuan bisnis organisasi dan bekerja sama dengan analis bisnis, manajer proyek, dan pemangku kepentingan lainnya untuk memahami persyaratan dan menerjemahkannya ke dalam solusi perangkat lunak yang fungsional dan efisien.

Kualifikasi:
Menguasai bahasa pemrograman/kerangka kerja berikut ini: HTML5, AngularJS, Ionic, PHP, Codeigniter, Laravel, dan Javascript
Memiliki pengalaman dalam pemrograman mobile/web / Aplikasi Web Progresif (PWA) merupakan nilai tambah
Memiliki pengetahuan yang baik tentang sistem basis data relasional dan tidak memiliki Konsep SQL
Pemahaman yang baik tentang Query
Memiliki pengetahuan yang baik untuk siklus pengembangan.
Memiliki pengalaman dengan alat debugging untuk pemrograman seluler / web
Pengalaman dalam integrasi layanan web (SOAP, REST API, JSON)
Pengalaman membangun aplikasi mobile/web minimal 3 tahun
Pengalaman pengembangan dengan framework Progressive Web Application minimal 2 proyek
Pengalaman menggunakan kontrol versi GIT
Memiliki kemampuan analitik dan pemecahan masalah yang baik dan kreatif",None
IT PROGRAMMER / DEVELOPER (Odoo Developer),PT Haeng Nam Sejahtera Indonesia,"Bogor, West Java",None,Full time,"Requirements 
Bachelor's degree preferably in Computer Science, Information Systems, or Engineering, but any other field is welcomed.
Minimum of 2 years of experience in Odoo development.
Strong knowledge of Odoo, Python, ORM, SQL, JS, CSS, and programming concepts.
Attention to detail and problem-solving skills.
Integration and Unit Testing Knowledge.
Interest in enterprise application development.
Strong organizational skills with the ability to multi-task.
Responsibilities
Develop and Improve Odoo apps.
Maintaining existing modules.
Complete and clear documentation for any task/work done.
Delivering and producing the detailed design of Odoo Code & Unit test plans.
Cooperate with internal and external parties to complete the development tasks.
Troubleshooting and Debugging of code-related issues.
Focus mainly on various ODOO solutions development and support.",None
IT Backend Developer,FamilyMart Indonesia,"Setiabudi, Jakarta",None,Full time,"Job Desription:
Create new program to fulfill company’s needs
Maintain program troubleshooting (bugs fix)
Coordinate with another team for IT Support
Develop the program according to technical specification and make technical documentation
 Job Requirements:
Graduated from reputable university with a degree of Informatics Engineering/Computer Science or equivalent
2 year experiences as Developer/Programmer/Software.
Required Skills: GO, Laravel, .NETCORE, Phyton, SQL Server, MySQL, Postgresql, MongoDB, BigQuery
Have done application implementation based on MVC Framework
Have another knowledge such as Containerize, GKE, Message Broker, Redis, Machine Learning is highly preferable.
Good knowledge in algorithm and software design concept.
Placement : Jakarta Selatan",None
Project Manager IT/Senior Developer,PT Solusi Prima Packaging,"Tangerang, Banten",None,Full time,"Responsibilities:
 Project Management:
• Plan, oversee, and manage IT projects from start to finish.
• Identify risks and take necessary preventive actions.
• Ensure projects are completed according to the established schedule and resources.
• Collaborate with cross-functional teams, including business users, technical partners, etc.
• Ensure effective communication between team members.
 Software Development:
• Lead the development team in designing, developing, and testing software.
• Use .NET programming languages (C# or VB.NET) to develop applications and systems.
 Business Analysis:
• Understand business needs and articulate technical solutions.
• Analyze business processes and identify improvements.
 Qualifications:
• Diploma (D3) or Bachelor’s degree (S1) in Information Technology.
• Minimum 5 years of experience as a software developer with in-depth knowledge of .NET.
• Experience in IT project management.
• Strong communication skills and leadership qualities.
• Familiar with tools used in IT project management.",None
IT DEVELOPER,SEYVEN INOVASI TEKNOLOGI,Jakarta,Rp 5.000.000 – Rp 7.500.000 per month,Contract/Temp,"Kualifikasi :
 Pendidikan terakhir S1/ D4 atau mahasiswa akhir di IT
Minimal 1 tahun bekerja dibidang Database Operation
Menguasai proses administrasi database server SQL server 2012++ / Postgre / MySQL
Menguasai PHP, Laravel
Menguasai Windows dan Linux
Menguasai konsep RDBMS
Memiliki skill leadership
Pernah Membuat Web Developer/Website
Mengerti dan Mempunyai skill coding
 DESKRIPSI
Melakukan instalasi / uninstall, konfigurasi, dan tuning database
Melakukan patching, upgrade maupun downgrade database sesuai kebutuhan dan keputusan manajemen
Melakukan backup dan restore database
Melakukan troubleshooting untuk menyelesaikan permasalahan yang berkaitan dengan database
Mengadministrasikan dan mengontrol akses user ke database sesuai dengan peran / wewenang masing-masing
Melakukan konfigurasi high availability dan disaster recovery (replication) untuk SQL Server
Memonitor kapasitas dan performance server database secara berkala dan membuat monthly report

 ",None
IT Developer (Ho),PT DIAN GRAHA ELEKTRIKA,Jakarta,None,Full time,"Tanggung Jawab :
Merencanakan desain database dan pemrograman sistem, sesuai dengan kebutuhan aplikasi bisnis agar dapat diaplikasikan
Merencanakan dan menangani spesifikasi fungsional, pengembangan sistem, instalasi, integrasi sistem, dan pelaksanaan tes, agar seluruh aktivitas tersebut berjalan dengan baik
Menangani proyek-proyek yang terkait dengan IT Business Analyst untuk memastikan proyek tersebut sesuai target
Merancang, dan menulis program komputer, dokumen rancangan program, coding program, dan pemeliharaan untuk menangani kebutuhan bisnis tertentu serta memungkinkan perubahan di masa depan
Melakukan konsultasi untuk menentukan kebutuhan dan analisa kebutuhan internal IT agar dapat memberikan solusi secara tepat waktu dan akurat pada hasilnya
 Kualifikasi:
S1 dengan latar belakang pendidikan Sistem Informatika/ Teknik Informatika
Pengalaman kerja minimal 2-3 tahun di bidang IT System Development atau AI
Kompetensi teknis (Hard Skills)
Pengetahuan mengenai bisnis ERP secara umum
Pengetahuan dasar teknologi pemrograman (C/C++, Java,JavaScript, atau Node.js,
Pengalaman dalam desain dan pengembangan perangkat IoT (sensor, aktuator, dan protokol komunikasi)
Pengalaman dengan platform IoT seperti AWS IoT, Google Cloud IoT, atau Microsoft Azure IoT, Pemahaman tentang machine learning, deep learning, dan teknik AI-based automation.
Pengalaman dengan framework TensorFlow, PyTorch, atau scikit-learn.
Pemahaman mengenai keamanan siber terkait perangkat IoT, enkripsi data, dan pengelolaan identitas.
 Jika memiliki sertifikasi khusus bidang IoT / AI akan menjadi nilai tambah.
Kompetensi non teknis (Soft Skills)
Kemampuan konseptual
Pengaturan dan pengorganisasian
Perhatian terhadap hal detail",None
IT JAVA Programmer (Senior),PT Hitachi eBworx Indonesia,"Central Jakarta, Jakarta",None,Full time,"Participate in requirement, design, implementation, testing and support of custom banking solutions, which include features enhancements, new functionalities, and back-end systems integration.
Collaboration with customers to prepare technical specifications.
Interact with subject matter experts (functional & technical) to understand business requirements and technology architecture of the applications accordingly.
Contribute to code reviews for quality assurance and conformance to standards / guidelines.
Provide technical guidance and lead/develop team members.
Assist in infrastructure & system software setup for development and testing environments.
Ensure timely completion of tasks delegated.
Requirements:
Degree in Computer Sciences / Software Engineering / Information Technology.
·Have professional experience with PL/SQL, Oracle Weblogic, Hibernate
At least 3 years of working experience in Java EE development (preferably in financial industry).
Individual that is optimistic, proactive, good initiative, passionate, strives to achieve more as a team, and able to motivate others.
Understand design documentation standards such as Unified Modeling Language.
Experience in various Java EE frameworks and design patterns.
Exposure in Java EE MVC frameworks such as Apache Struts / Apache Struts 2.
Involved in implementing applications leverages on various Java EE services including but not limited to Enterprise Java Bean, Java Database Connectivity, and Java Messaging Services.
Experience in IBM WebSphere Application Server / Oracle WebLogic / Oracle Database Server with SQL/PL-SQL programming.
Good verbal and written communication in English, technical, analytical, troubleshooting and consultative skills. Proficiency in National Language will be an added advantage.
Ability to cope with tight deadlines and adhere to the delivery plan.
Hybrid (3 days WFO in a week)
Ability and willingness to travel within the region.",None
Associate/D3 Degree Fresh graduates on IT/Programmer,PT Accenture,"Semarang, Central Java",None,Full time,"Planning, monitoring, and managing all development tasks.
Create development standards and checklists.
Liase with functional team and business users to define development requirements.
Developing technical specifications for SAP custom report / interface / enhancement / form to solve complex business problems based on end-user functional requirements.
Developing programs that conform to the functional and technical specification.
Planning and executing unit testing, string testing, and integration testing.
Support all levels of testing, problem solving and bug fixing.
Performance tuning of programs.
 Qualifications:
Open for fresh graduates
Associate/D3 degree in Information Technology, Computer Science, Information System or relevant field.
Based in Semarang or willing to relocate to Semarang.
Good understanding and customization of SAP business processes in Sales, Service, and Financials.
Good Knowledge on SAP Tables, Fields, Domains and on creating Search Helps.
Good English communication skills.",None
IT Developer,Yayasan Syiar Bangsa,"Tangerang Regency, Banten",None,Full time,"Qualifications:
Usia 27 - 30 tahun
Pengalaman kerja minimal 3 tahun 
Menguasai programming PHP/Javascript dan Menguasai Framework JQuery, Bootstrap, Laravel dan ReactJS / VueJS.
Memahami database menggunakan MySql/MongoDB, termasuk perencanaan dan pengembangan struktur database relasional.
Memahami konsep RESTful API
Familiar dengan versioning control (Gitlab / GitHub)
Berpengalaman menggunakan Layanan Cloud (VPS/Domain Hosting)
 Job Descriptions:
Mengembangkan aplikasi baru atau yang sudah ada
Mendesain & mengembangkan solusi yang mudah digunakan (baik di back-end maupun front-end)
Mengembangkan API web dan mendesain model data
Mengoperasikan, memelihara, dan meningkatkan aplikasi/produk yang ada
Berkolaborasi dengan tim dalam membangun dan meningkatkan aplikasi
Melakukan analisis perangkat lunak, pemrograman, pengujian, dan debugging",None
IT DEVELOPER,PT Bumi Arta Sedayu,"East Bekasi, West Java",None,Full time,"Pendidikan min. S1 atau setara, jurusan Teknik Informatika / Ilmu Komputer / Sistem Informasi 
Berpengalaman 2 tahun
Menguasai kemampuan: .Net Core 5, MVC, Bootstrap, Javascript, JQuery (sejenis), MySQL, Microsoft SQL Server, API
Memiliki kemampuan analisa
Mampu bekerja secara individu maupun dalam tim
Penempatan Bekasi Timur",None
Smart Factory IT,PT. FASHION STITCH JOSHUA (Kuningan),"Kuningan, West Java",None,Contract/Temp,"About us
PT. Fashion Stitch Joshua is a company operating in the apparel/garment industry. This company was founded in 2022 and located in Cidahu, Kuningan, West Java.
Qualifications & experience
Experiences with web-based ERP Systems
Degree in Computer Science or Related Fields
Experience in the Garment Manufacturing Process
Proficiency in English
Tasks & responsibilities
Manage Smart Factory Systems on-site at the subsidiary
Analyze Issuses that arise in the field
Address simple issues directly
Report complex or critical issues to the Korean Headquarters, coordinate developer resources, and adjust schedules accordingly",None
IT Manager,PT Sri Tanaya Megatama,"Semarang, Central Java",None,Full time,"Kualifikasi :
 S-1 di Teknologi Informasi/Ilmu Komputer/Sistim Informasi/ Teknik Komputer, atau bidang terkait
 Pengalaman di posisi yang sama minimal 5 tahun
Pengalaman dalam mengelola infrastruktur IT, termasuk jaringan, sistem server, database, dan keamanan siber.
Memiliki pengetahuan mendalam tentang infrastruktur jaringan, termasuk konfigurasi dan pemeliharaan                  LAN/WAN, sistem keamanan jaringan, serta protokol keamanan seperti firewall dan VPN.
Memiliki keterampilan dalam pengelolaan server, cloud computing, dan sistem penyimpanan (on-premise              maupun cloud-based seperti AWS, Microsoft Azure, atau Google Cloud).
Memiliki pemahaman tentang keamanan siber, termasuk protokol keamanan, enkripsi, perlindungan data, dan        pemulihan bencana (disaster recovery).
Memiliki keterampilan dalam pengembangan dan integrasi perangkat lunak, memahami database management    systems (DBMS) seperti SQL Server, MySQL, atau Oracle.
Familiar dengan tools kolaborasi modern seperti Jira, Confluence, atau Microsoft Teams, serta tools manajemen    proyek seperti Asana, Trello, atau Microsoft Project.
Menguasai Python, Java script, C++, PHP, Java, C Sharp, Ruby, Swift, Golang, Koltin, laravel, haskell, lisp, Erland,  F#, Perl, Shell, bash, Zzh, Lua, Smalltalk, Objective-C, R, SAS, Matlab, Solidity, Rust, ostgreSQL, SQLite,                   MongoDB, Cassandra, Redis, CouchDB, Neo4j, ynamoDB, Google Spanner, CockroachDB, VoltDB,  InfluxDB,     Prometheus, TimescaleDB,Apache HBase, Google Bigtable, ClickHouse, Neptune, ArangoDB, db4o, OrientDB
Memiliki kemampuan memimpin tim IT dengan efektif, Keterampilan komunikasi yang baik untuk berinteraksi        dengan tim lintas departemen dan manajemen eksekutif, termasuk kemampuan menjelaskan konsep teknis        kepada audiens non-teknis.",None
IT Project Manager (Hardware & Software),PT Valortek Ratanika Utama,Jakarta,Rp 15.000.000 – Rp 21.000.000 per month,Full time,"Job Description:
Create project plan, framework and delivering projects on time, on quality and on budget.
Monitoring and managing all resources in projects to ensure the projects delivered.
Give new idea to improve image, quality and performance of the products/services of the company in order to improve customer satisfaction.
Follow project management procedure and checklist guideline.
Maintain project scope and change request.
Communicate with customer about how our solution that currently designed will support in achieve the project’s goals.
 Qualification:
Preference will be given to those with experience in the government sector.
Preference will be given to those who already have a PMP, Python, Linux Certificate.
Experience in handling cybersecurity, intelligent systems, and surveillance system projects will be a plus.
Minimum Bachelor degree in any major and preferable from Information Technology.
Maximum age of 35 years old is preferable.
Have minimum 3 years experiences as IT Project Manager.
Having experiences as software developer or system analyst is very strong advantage.
Strong in end to end Project Management.
Understanding Software Development Life Cycle (SDLC) is mandatory.
Able to conduct planning, developing and implementing projects.
Commitment with integrity, problem solving, analytical and leadership.",None
IT Developer,PT Ameliore Solusi Analitika,Jakarta,None,Contract/Temp,"About us
PT. Ameliore Solusi Analitika (ASA) is an IT consulting company established in 2012. The company aims to provide a better development approach for building or improving IT systems. We have extensive experience in IT consulting. ASA has successfully implemented effective and efficient IT solutions by a team of skilled consultants who can provide the right IT solutions and services, including IT strategic planning consulting, IT governance implementation, internal company system development, data warehouse, business intelligence solutions, and various other technology services.
Qualifications & experience
Bachelor’s degree in Computer Science, Information Technology, or a related field.
Proficiency in ERP software (e.g., SAP, Oracle) and development tools is preferred.
Strong programming skills in languages such as SQL, Java, C#, or Python.
Strong understanding in database management systems (e.g., MySQL, Oracle, SQL Server).
Knowledge of business processes and best practices related to ERP systems.
Familiarity with Windows and Linux operating systems.
Excellent problem-solving and analytical skills.
Strong communication and interpersonal skills.
Fresh Graduates who have a strong interest in ERP are welcome to apply.
Tasks & responsibilities
Develop, customize, and maintain ERP applications to meet business needs.
Integrate ERP solutions with other business applications and systems.
Conduct system testing and validation to ensure quality and performance.
Troubleshoot and resolve issues within the ERP system.
Provide complete, detailed and comprehensive work documentation.
Provide training and support to end-users as needed.
Benefits
Opportunities for professional development and career growth.
A collaborative and inclusive work environment.
Competitive salary.",None
IT Application Developer,PT Buana Finance Tbk,"South Jakarta, Jakarta",None,Full time,"Fungsi
Melakukan proyek perbaikan, pembaharuan dan/atau pengembangan baru aplikasi/sistem teknologi yang lebih memadai sesuai dengan kebutuhan User dan/atau Perusahaan.
 Tugas, dan Tanggung jawab:
Melakukan analisa kebutuhan User dan/atau Perusahaan atas perbaikan, pembaharuan dan/atau pengembangan aplikasi/sistem teknologi guna menunjang operasional bisnis Perusahaan.
Membuat desain dan membangun aplikasi/sistem sesuai dengan kesepakatan analisa kebutuhan dari User dan/atau Perusahaan.
Melakukan uji coba aplikasi/sistem sebelum dilakukan implementasi aplikasi/system.
Melakukan implementasi dan sosialisasi user guide untuk pemakaian aplikasi/sistem kepada User.
Mengajukan usulan proyek pembaharuan dan pengembangan sistem teknologi yang diajukan dan dianggarkan pada awal tahun.
Spesifikasi:
S1 Fakultas Ilmu Komputer, dengan IPK 3.00
Pengalaman Minimal 2 tahun
Penguasaan konsep Relational Database Management System
Menguasai dan memahami konsep web application, MVC, API
Memahami pembuatan dan penggunaan konsep REST API
Menguasai Bahasa C#, VB. NET, PHP/Ms. SQL ( is must)
Memahami Bahasa Android/java ( nilai tambah)
Kemampuan kemandirian dalam melakukan pekerjaannya
Kemampuan berkoordinasi dan bersosialisasi
Penempatan : Jakarta - HO
  ",None
Application Developer,PT Multipolar Technology Tbk,"Tangerang, Banten",None,Full time,"Job Description:
Analyses and design software’s requirement and specification.
Develop, test and evaluate new/existing system
To produce system application which can accommodate customer’s requirement in the medium scale project.
Requirements:
Minimum S1 Degree from Informatics Engineering, Computer Science or any related discipline.
Fresh graduate are welcome with minimum GPA 3.00 from reputable university.
Possessing skill in one or more of the following programming languages: Java, Javascript, Bahasa C, Python, C++, .Net, or AS RPG 400
Having knowledge in OS.(AIX, LINUX, Windows)
Have passion in application development.
Having good communication and team work player.
Able to work under pressure and tight deadline.
Excellent spoken and written English language skills.
Placement at Tangerang or South Jakarta",None
IT.NET,PT Hero Retail Nusantara,"South Tangerang, Banten",None,Full time,"Job Responsibilities:
• Setting up and maintaining .NET environments, including servers and databases
• Designing applications using programming languages compatible with the .NET framework
• Troubleshooting technical issues and ensuring optimal performance of .NET applications
• Working together to understand and resolve application problems
• Responding quickly to incidents and service requests
 Job Qualifications:
• Bachelor’s degree in Information Technology, Computer Science, or a related field (or equivalent experience)
• Prior experience in IT support or software development, particularly with .NET applications
• Proficiency in .NET framework and related technologies
• Experience with database management or familiarity with web services
• Experience working collaboratively with development and IT teams
• Strong analytical and troubleshooting abilities to address technical issues effectively",None
