Job Title,Company Name,Location,Salary,Job Type,Job Description,Date
Internship Wordpress Developer,Vascomm,Jakarta,None,Full time,"Internship Wordpress Developer
1.⁠ ⁠Membantu tim pengembangan dalam membangun dan memelihara website berbasis WordPress.
2.⁠ ⁠Mengembangkan tema dan plugin WordPress sesuai dengan kebutuhan proyek.
3.⁠ ⁠Melakukan debugging dan optimasi plug in untuk performa website.
4.⁠ ⁠Berkolaborasi dengan tim desain untuk mengimplementasikan desain UI/UX ke dalam Wordpress.
5.⁠ ⁠Memastikan website yang dibangun responsif dan user-friendly.
Requirement
1.⁠ ⁠Mahasiswa/i atau SMK atau lulusan baru dari jurusan Teknik Informatika, Sistem Informasi, atau bidang terkait.
2.⁠ ⁠Memiliki pengetahuan dasar tentang HTML, CSS, JavaScript, dan PHP.
3.⁠ ⁠Berpengalaman dengan WordPress, termasuk mengembangkan tema dan plugin.
4.⁠ ⁠Mampu bekerja secara mandiri dengan bimbingan minimal.
5.⁠ ⁠Memiliki keterampilan komunikasi yang baik dan mampu bekerja dalam tim.
6.⁠ ⁠Pengalaman sebelumnya dalam proyek WordPress akan menjadi nilai tambah.",None
Web Developer (Programmer),PT Propan Raya Industrial Coating Chemicals (HCBP ),"Tangerang District, Banten",None,Full time,"Bachelor degree in Information Technology/Information System/Computer Engineering
Must have experienced as IT Programmer or Web Developer for at least 2 years
Required Skill : MySQL, C++, SQL server, PHP, Java & HTML, Ms. office (Excel)
Willing to work in Head Office -Tangerang (WFO)",None
WEB DESIGN,PT Kreatif Media Pariwara,"Cengkareng, Jakarta",None,Full time,"Deskripsi Pekerjaan:
Melakukan segala aktivitas SEO: Content Strategy, Link Building Strategy, Keyword Strategy untuk meningkatkan Search Engine secara organik, memastikan keyword-keyword yang diinginkan berada di page 1 Google Search, serta memberikan report SEO setiap bulannya.
Merencanakan dan mengembangkan konten website, email marketing, SEO, dan iklan online untuk meningkatkan ranking Search Engine Result Page (SERP).
Mengoptimalkan struktur website, meliputi pembuatan sitemap, mengatur struktur URL yang SEO friendly, penggunaan tag heading, dan pengorganisasian konten.
Membuat dan mendesain layout website dari awal.
Persyaratan:
Pendidikan minimal D3 Komputer/Teknik Informasi dan/atau sejenisnya.
Usia maksimal 35 tahun.
Memiliki pengalaman minimal 3 tahun sebagai SEO & Web Design.
Memiliki sertifikat SEO & pengalaman sebagai Digital Marketin.
Memiliki pengalaman Wordpress, SEO, SEM, Google Sites, Google Analytics, Google Ads, Meta For Business, Tik Tok Ads, Affiliate Channels, Google Search Console, dll.
Mempunyai pengalaman dalam penggunaan social media dan web analytics tools seperti : Google Analytics, Google Adwords, Facebook Marketing And Analytics, Instagram Marketing And Analytics, Youtube Marketing And Analytics, dan Web Metrics.
Memiliki kemampuan menulis artikel SEO friendly dengan menggunakan teknik-teknik on-page SEO.
Mengerti cara penggunaan dan pengoptimalan Google Sites/WordPress.
Memiliki pengalaman HTML, CSS, Bootstrap, PHP, Javascript, JQuery dan web design tools lainya.
Memiliki pengalaman dalam mengembangkan atau mendesain UI/UX aplikasi web.
Menguasai Adobe Illustrator, Photoshop, Figma, Dreamweaver, visual studio, untuk Desain Responsive Web Layout.
Menguasai Content Management Systems (CMS), terutama WordPress termasuk instalasi, konfigurasi, troubleshooting, dan penggunaan serta pembuatan berbagai plug-in nya.
Bersedia Di Tempatkan Di Cengkareng / Slipi Palmerah.

Persyaratan minimum:
Mencari kandidat untuk bekerja pada:
Senin: Pagi, Siang
Selasa: Pagi, Siang
Rabu: Pagi, Siang
Kamis: Pagi, Siang
Jum'at: Pagi, Siang
Diperlukan 2-3 tahun pengalaman kerja yang relevan untuk posisi ini
Kartu izin tinggal dapat diberikan untuk posisi ini
Tanggal mulai kerja: 20 July 2024
Gaji yang diinginkan: Rp4,500,000 - Rp6,000,000 per bulan",None
Full Stack Developer,CV. Sumber Rejeki sebagai rekruter Kenes Bakery & Resto,"Yogyakarta, Yogyakarta Special Region",None,Full time,"Pendidikan minimal D3 Informatika, Sistem Informasi atau sejenisnya
Memahami dasar pemrograman web PHP (cakephp & codeIgniter lebih diutamakan)
Memahami database MySql & Oracle
Paham Git dan memiliki Portofolio jadi nilai plus
Kemampuan analisa masalah yang baik
Dapat bekerjasama dalam tim dan komunikatif
Memiliki kreatifitas dan inisiatif yang tinggi
Mampu menyelesaikan proyek dari konsep hingga produk jadi
Mampu mendesain dan mengembangkan Application Programming Interface (API)
Mampu elakukan perubahan data atas permintaan  
Domisili DIY

Persyaratan minimum:
Tersedia jam fleksibel
Diperlukan 1 tahun pengalaman kerja yang relevan untuk posisi ini
Pelamar harus memiliki KTP
Tanggal mulai kerja: 10 September 2024",None
526 | FullStack Developer,Intetics,Jakarta,None,Full time,"Intetics Inc., a global technology company providing custom software application development, distributed professional teams, software product quality assessment, and “all-things-digital” solutions, is seeking a highly skilled and experienced  Full Stack Developer to join our dynamic team.
About the client:
Our client is building the future of healthcare.
We believe that by equipping people with the best tools to solve their own problems, we can tackle the whole world's problems better together. Transform healthcare technology with us and build systems that matter.
What You’ll Do:
Building in healthcare is an extraordinary technical and product undertaking. As a full-stack developer on our team, you will solve unique architectural and systems challenges. You'll design sleek and thoughtful solutions to complex problems. And you'll contribute to the world's next most influential software.
We're looking for someone with extensive experience in application development. In this role, you'll work closely with our Design and Membership teams to make product architecture decisions and implement core browser features.
Requirements
Extensive experience in modern development frameworks and design patterns, with a strong full-stack capability.
Proficiency in Node.js, React (including Contexts and Hooks), React Native, TypeScript, AWS, PostgreSQL, Prisma, Terraform, and Tailwind CSS.
Ability to deploy cloud-native applications for large user bases and scale systems effectively.
Familiarity with GitHub for version control in large, complex codebases.
Strong product focus and user-driven approach.
Strategic thinker with the ability to prioritize effectively.
Agile mindset, comfortable with iterative development in a startup environment.
Available to work until at least 2 PM PST to align with team schedules.",None
Application Developer,VIVERE GROUP,"Kalideres, Jakarta",None,Full time,"Application Developer
VIVERE Serpong South 78
Job Descriptions
Contribute in all phases of the development life cycle (concepts, design, test, release)
Responsible for developing & maintaining our System end to end process
Deliver products with standardized security, reliability, and stability
Understand customer needs and requirements
Ability to write clean and easily maintained code.
Job Requirements
Technical expertise : Minimum 1+ years experience of PHP-Laravel Experience
Experience with microservices Architecture
Good knowledge of Vue.Js / React.Js
Hands-on experience in REST API
Experience web server technologies (Apache, NGINX) and containerization (Docker, Kubernetes) is plus
Having interpersonal and communication skill
Apply",None
Programmer,Securindo Packatama,"Kemayoran, Jakarta",None,Full time,"Kualifikasi :
•   Usia maksimal 35 tahun
•   Pendidikan min D3 / S1 T. Informatika / Sistem Informasi dengan ipk min 2,75
•   Menguasai bahasa pemograman database SQL / MySQL / Oracle
•   Menguasai bahasa pemograman web PHP / ASP
•  Jujur, Disiplin dan bertanggung jawab dan kreatif
Lokasi : Pd. Indah, Puri Indah, Pik, Klp. Gading, Cakung, Dan Sudirman
Persyaratan:
Pria
Usia maksimum 40 tahun
Badan normal / proporsional
Sehat jasmani dan rohani
Memiliki mata yang sehat (tidak berkacamata)
Tidak bertato & bertindik
Mampu mengendarai kendaraan manual dan matic
Kelengkapan berkas:
Surat lamaran
Daftar riwayat hidup
Fotocopy KTP yang masih berlaku
Fotocopy Ijazah SMA/SMK/Paket C
Fotocopy SIM A atau SIM B1 yang masih berlaku
Pasfoto ukuran 3x4 (2 lembar)
Mencantumkan No. Telp/HP yg bisa dihubungi
Fotocopy kartu keluarga (KK)
Surat Keterangan Catatan Kepolisian (SKCK)
Penempatan Pd. Indah, Puri Indah, PIK, Klp. Gading, Cakung, Sudirman dan Cikini
Lokasi : Makassar
To execute and to ensure overall regional business development including operation activities to be effective and efficient
To lead continuous process productivity and quality improvement programs
Requirements:
Male / Female
Maximum age 35 years old
S1 / S2 Degree from reputable university majoring in Engineering, Business, or Management with minimum GPA 2.75 (Scale 4.0)
Minimum 3 years experiences in marketing preferably Industrial / Manufacturing and Service
Accustomed to overseeing many people
Excellent in leadership skill
Excellent in interpersonal and communication skill, both written and oral
Good in management skill
Able to speak Mandarin is an advantage",None
Programmer Support,Tjendana Resorts Management,"South Denpasar, Bali",None,Full time,"Requirements : 
1. Menguasai bahasa pemrogramman PHP atau salah satu Framework PHP (Codeigniter, Laravel, dll).
2. Menguasai salah satu DBMS (MySQL, MariaDB, PostgreSQL, dll).
3. Berpengalaman paling tidak sekali didalam membangun Sistem (pribadi atau tim tidak masalah).
4. Memahami GIT.
Nilai Plus (diutamakan) jika :
1. Memahami Google Analytics 4 (walaupun sedikit).
2. Memahami SEO (walaupun sedikit).
3. Diutamakan Domisili Balu 
4. Bisa bergabung secepatnya 

Persyaratan minimum:
Mencari kandidat untuk bekerja pada:
Senin: Pagi
Selasa: Pagi
Rabu: Pagi
Kamis: Pagi
Jum'at: Pagi
Diperlukan 2-3 tahun pengalaman kerja yang relevan untuk posisi ini
Pelamar harus memiliki KTP",None
STAFF IT,1880 Brawa,"North Kuta, Bali",None,Full time,"Sayarat dan ketentuan
1. Minimal lulusan D1 Informatika, atau sejenisnya
2. Freshgraduate dipersilahkan untuk melamar, namun yang diutamakan memiliki pengalaman min. 1 tahun di bagain yang terkait
2. ⁠memahami HTML, CSS, PHP dan Database
3. ⁠Paham framework Laravel minmal versi 9
4. ⁠Memahami API
5. ⁠Mampu berbahasa inggris

Persyaratan minimum:
Tersedia jam fleksibel
Diperlukan 1 tahun pengalaman kerja yang relevan untuk posisi ini
Pelamar harus memiliki KTP",None
Flutter Developer,Wirehire,Jakarta,None,Full time,"Job Description:
We are lo﻿oking for a skilled Flutter Developer to join our dynamic team. The ideal candidate will be responsible for designing and building advanced applications for the Flutter platform. You will collaborate with cross-functional teams to define, design, and ship new features. The role involves maintaining code quality, implementing new features, and ensuring smooth performance of the application. Your expertise in Flutter and Dart, along with your ability to write efficient code, conduct thorough testing, and deliver a visually appealing product, will be crucial to the success of our projects.
Key Responsibilities:
Develop high-quality mobile applications using Flutter and Dart.
Utilize Flutter widgets to create responsive designs and implement features like Dark mode, Light mode, and multi-language support.
Conduct thorough testing and debugging, including unit tests, widget tests, and integration tests.
Manage state efficiently using Flutter state management techniques such as setState and Provider.
Integrate applications with REST APIs.
Utilize and manage Flutter packages, with the ability to create custom packages as needed.
Organize and manage files for large-scale projects.
Use IDEs like Android Studio and Visual Studio Code effectively.
Employ version control systems (Git) for project collaboration.
Convert Figma designs into functional Flutter layouts.
Deploy and maintain projects on Google Play Console, and optionally on Apple Dev Console.
Implement fundamental UI/UX principles to create visually appealing applications.
Job Requirements:
Proficient in using Flutter widgets and Dart programming language.
Strong understanding of state management in Flutter (setState, Provider).
Experience in testing and debugging (unit test, widget test, integration test).
Expertise in integrating Flutter applications with REST APIs.
Skilled in using Flutter packages and creating custom packages.
Knowledgeable in file management for large-scale projects.
Proficient in using IDEs such as Android Studio and Visual Studio Code.
Experienced in using version control systems (Git).
Understanding of basic UI/UX principles and visual design.
Ability to convert designs from Figma into Flutter layouts.
Capable of deploying and maintaining projects on Google Play Console.
Optional: Experience with deployment and maintenance on Apple Dev Console.
Optional: Basic understanding of Java or Kotlin programming languages.
Optional: Understanding of basic Entity-Relationship Diagrams (ERD).
Additional Points: Knowledge of Firebase and Google APIs (Oauth2, People API, FCM, etc.).
Education and Experience:
Bachelor's degree in Computer Science, Information Technology, or a related field (or equivalent practical experience).
Proven experience as a Flutter Developer or similar role.
Portfolio of released applications on the App Store or the Android market is a plus.",None
Flutter Developer,PT Talenta Navigator Alihdaya,"Cepiring, Central Java",None,Full time,"Scope of Work:
Build multi-platform applications for Android and iOS using the Flutter framework.
Writing clear and reader-friendly code. Documenting the entire usage process in detail for straightforward utilization and upgrading in the future.
Collaborating with other developers to create, deploy, and maintain Flutter-based applications for different platforms.
Writing and reviewing multi-application codes.
Overseeing and reviewing application design.
Building, implementing, and managing product modules along with their sub-systems.
Resolve any problems existing in the system and suggest and add new features in the complete system.
Requirements:
Degree in software engineering, computer science, or software development.
1 year of experience developing mobile apps in iOS and/or Android. Also, have experience developing and delivering Flutter-based apps.
Good understanding of state management, Flutter flavors, and app architecture.
Strong communication and consultative skills. Self-initiated and proactive.
Solid experience with commonly used 3rd party libraries and services
Should have experience with Firestore, such as Cloud Firestore, Push Notifications, Cloud Functions, and Analytics.
Should have experience with Git, to manage and collaborate in different projects with the rest of.

Persyaratan minimum:
Tersedia jam fleksibel
Diperlukan 1 tahun pengalaman kerja yang relevan untuk posisi ini
Kartu izin tinggal dapat diberikan untuk posisi ini",None
Senior Full-Stack Developer,B One Consulting,"Badung, Bali",Rp 10.000.000 – Rp 13.000.000 per month,Full time,"SENIOR FULL STACK DEVELOPER
 Employment type: Full time - on site
Location: Bali
 About B One Consulting
B One Consulting is a dynamic and innovative consulting company based in the vibrant city of Bali. We specialize in providing top-tier consulting services to a diverse range of clients, offering solutions that drive growth and success. As we continue to expand, we are seeking a dedicated Senior Full-Stack Developer to join our company.
 Job Description:
As a Senior Full-Stack Developer, you will be responsible for developing and maintaining both the front-end and back-end components of our web applications. You will work closely with our product and design teams to deliver high-quality, scalable, and maintainable solutions.
 Responsibilities:
• Collaborate with cross-functional teams to define, design, and ship new features.
• Develop and maintain the front end of our web applications using modern frameworks such as React, Angular, or Vue.js.
• Design, develop, and maintain the back end of our applications using server-side technologies like Node.js, Django, or Flask.
• Write clean, efficient, and well-documented code.
• Participate in code reviews to ensure code quality and share knowledge with the team.
• Troubleshoot, debug, and optimize application performance.
• Stay up-to-date with the latest industry trends and technologies to ensure our applications are using the best tools and practices.
 Qualifications:
• Proven experience as a Senior Full-Stack Developer or similar role.
• Strong proficiency in front-end technologies such as HTML, CSS, JavaScript, and modern frameworks (React, Angular, or Vue.js).
• Solid understanding of back-end technologies such as Node.js, Python, Ruby, or Java.
• Experience with database systems such as MySQL, PostgreSQL, or MongoDB.
• Familiarity with RESTful APIs and microservices architecture.
• Knowledge of version control systems (e.g., Git).
• Excellent problem-solving and communication skills.
• Ability to work both independently and collaboratively in a team environment.
• Bachelor’s degree in Computer Science, Engineering, or a related field.
 Preferred Skills:
• Experience with cloud platforms such as AWS, Azure, or Google Cloud.
• Knowledge of containerization and orchestration tools (e.g., Docker, Kubernetes).
• Familiarity with DevOps practices and tools.
 Kindly please provide your portfolio",None
529 | Senior PHP Developer (Austalian time zone),Intetics,Bali,None,Full time,"Intetics, a renowned global technology company specializing in custom software development, is searching for a talented Senior PHP Developer to join our dynamic team. This position requires an individual who can work effectively in the Australian time zone and contribute to the development of innovative software solutions.
Our client is a fast-growing cybersecurity startup that is paving the way forward for the way vulnerability management is run in organizations of all sizes. For our customers, vulnerability management has always been a game of catch-up, with limited asset coverage and manual processes. Nucleus’ core goal is to build a fast and scalable platform that solves these problems and many more so that vulnerability management isn't just possible, it's easy. We're looking for a passionate Senior PHP Engineer to join our growing team of engineers.  
Responsibilities
Design, develop, and maintain high-quality PHP applications to meet the needs of our clients.
Collaborate with product managers and other stakeholders to gather requirements and translate them into technical specifications.
Implement responsive and efficient user interfaces using modern front-end technologies.
Perform code reviews, mentor junior developers, and contribute to team knowledge sharing.
Troubleshoot, debug, and optimize existing applications to improve performance and user experience.
Stay current with industry trends in PHP development and emerging technologies.
This position entails starting work at 9 AM Australia time (UTC+10).
Requirements
Excellent knowledge of modern versions of PHP and Zend Framework 
Excellent knowledge across Frontend technologies, including HTML5, CSS, JavaScript 
Experience across different Frontend frameworks 
Experience working with relational databases (SingleStore/MEMSQL a bonus) 
Experience maintaining applications on Linux platforms in cloud environments.
Background following Agile/Scrum methodologies in a professional setting. 
Demonstrated experience with technical troubleshooting.
Ability to work independently and with a team, including with a team across different time zones.
Preferred Qualifications:
Experience working with vulnerability scanning technologies on any part of the tech stack (e.g., SCA, SAST, DAST, IAST, VM Scanning, Container, etc.) 
Experience with ExtJS 
Experience working in cloud environments, ideally AWS. 
Experience working with data analytics and/or data science.",None
Full Stack .NET Developer (remote),Loyalty Now,Bali,Rp 12.000.000 – Rp 17.000.000 per month,Full time,"Full-Stack .NET Developer

Loyaltynow.com

We are seeking a driven Full-Stack .NET Developer to help deliver our leading loyalty and payments platform to our ever-increasing global customer base.

The successful candidate will be part of our ambitious and fast-growing business with a strong focus on customers, technology, and innovation. You will work within our agile development team focused on expanding our market-leading loyalty and payments platform. You will build and deliver high-quality code into working software that is effective yet scalable, integrating the work and handling the server-side application logic, and implementing visual components that users view and interact with within a web application.

You will gain global loyalty and payments market experience, working with great peers, as we disrupt the loyalty industry by pioneering platform and ecosystem innovation.

We offer a fantastic working environment, mostly remote working with periodic catch-ups and hackathons. a unique opportunity for someone to rapidly expand their skillset in the loyalty, fintech, and payments space by working with the latest technology

Experience and skills sought after
Strong knowledge of .Net Core, APIs/microservices architectures, and React
Experience across an Azure environment (AzureSQL,(Azure SQL, Functions, Storage, Events, WebApps, Queues, CDN/KeyVault/etc) is a plus
Experience with secure software development practices
A go-getter attitude, clear and unambiguous communication skills (oral and written) – someone who is keen to deliver and show output, without compromising a quality customer experience
Knowledge of the payments or loyalty space is a plus but not required
Experienced working in an Agile environment, adopting a consultative and cooperative approach to your work
Bachelor's or Master's degree in Computer Science or other majors with relevant knowledge
Have solid experience in the entire software development lifecycle from requirements analysis to design, development, testing, and implementation
Experienced within continuous delivery and integration environments
Excellent and analytical problem-solving skills, with a proven ability to identify, define and prioritize business needs/problems/issues, then define/develop/influence feasible solutions

Attributes sought after:
Outcome-focused and process driven
Strong interpersonal skills
Attention to detail
Ability to work autonomously
Experience working to deadlines
Effective listener
Able to manage multiple priorities within a fast-paced environment, with excellent time-management skills
Lifelong learner

Role Requirements:
Development of new software products and components
Work in back-end (.Net Core) and front-end (React) spaces
Producing high-quality, tested, and maintainable code, using the best technologies for the problem at hand
Investigation and resolution of issues reported by internal and external customers
Conduct analysis and propose solutions to aid and guide the development and expansion of our software
Strong attention to detail and delivering high-quality code in a timely manner.
Ability to work remotely
Ability to work AEST business hours from time to time, e.g. when training, during customer investigations, and interactions with the broader team
Ability to travel occasionally if required
Full-time role - expected 40 hours per week
Employed under local contract conditions",None
Full Stack Developer - Java/Spring Boot/Angular,Qode,Jakarta,None,Full time,"Working alongside Tech & Product team to develop engaging & responsive user interfaces with HTML, CSS, and modern JavaScript frameworks
Experience in Java and Spring Boot Framework
Develop performance-oriented front end & back end binding
Work with back-end developers to design and interface REST APIs
Perform code reviews and basic troubleshooting
Build reusable code and libraries for future use
Requirements
Minimum 2 Year experience Experience in full stack development, whether in-house, for an agency, or as a freelancer.
Bachelor's Degree with Computer Science, Information Technology or equivalent
Managing multiple tasks and timelines in a fast-paced environment
Having Experience as Team Leader is a plus
Humility and excellent collaborative spirit. We are all here to learn and grow together as a team.",None
