Job Title,Company Name,Location,Salary,Job Type,Job Description,Date
Sales Manager Property,Paramount Enterprise,"Tangerang Regency, Banten",None,Full time,"Job Description:
Ensure sales of house units, shophouses, and lots throughout the project according to predetermined time and price targets.
Guide the day-to-day activities of the marketing & sales team.
Planned and executed marketing programs from start to finish, leveraging internal support and encouraging collaboration.
Recruit, train, motivate, and advise a team of sales representatives.
Monitor and report sales performance against targets, making necessary adjustments.
Collaborate with other departments, including marketing, product development, and customer support, to align sales efforts with overall business strategy.
 Job Requirements:
Bachelor's Degree in any major.
Minimum 5 years of experience in the same position. Preferably from the Developer/Property/Landed industry.
Expert in Social Media Sales, Google Marketing Platform, and influencer management.
Experience in managing and monitoring a team.
Target-oriented.
It will be handled and placed at Tangerang.",None
Senior Fullstack Web and Mobile Developer,PT Edubuild Pratama Indonesia,"Central Jakarta, Jakarta",None,Full time,"What will you do?
Lead the design, development, and maintenance of web and mobile applications using PHP Laravel and Flutter.
Provide technical leadership, mentorship, and guidance to a team of developers, ensuring adherence to best practices and coding standards.
Collaborate with cross-functional teams, including designers, product managers, and QA engineers, to define project requirements and deliverables.
Conduct code reviews to ensure code quality, performance, and scalability.
Stay updated with the latest industry trends, technologies, and best practices in web and mobile development.
Proactively identify and address technical debt, performance bottlenecks, and scalability issues.
Work closely with DevOps teams to optimize deployment processes and infrastructure.
 Requirements:
Bachelor's degree in Computer Science, Engineering, or a related field (or equivalent work experience).
Minimum of 5 years of professional experience in software development.
Proficiency in PHP Laravel with a strong understanding of its core principles and ecosystem.
Experience with Flutter or other cross-platform mobile development frameworks is a plus.
Proven experience in leading development teams, mentoring junior developers, and fostering a collaborative team environment.
Solid understanding of web technologies, including HTML5, CSS3, JavaScript and RESTful APIs.
Good understanding on async request handling, partial page update, AJAX
Experience with 3rd party libraries, APIs (JSON,XML, Restful).
Adequate knowledge of relational database systems (Postgres or MySQL)
Object Oriented Programming and web application development skill
Understanding in implementing automated testing(unit/function and integration testing)
Strong familiarity with Linux (uBuntu, CentOS, Etc..) and you feel very comfortable using the command line
Strong understanding of software design patterns, data structures, and algorithms.
Excellent communication and interpersonal skills, with the ability to effectively collaborate with cross-functional teams. 
Strong problem-solving skills and the ability to thrive in a fast-paced, dynamic environment.
Fluent in English",None
Backend Developer,PT. Fidac Inovasi Technology,Jakarta,None,Full time,"Kualifikasi:
Pendidikan min. D3 jurusan IT/Sistem Informasi.
Memiliki pengalaman setidaknya 2 Tahun di bidang yang sama.
Pemahaman yang kuat tentang siklus pengembangan web dan teknik serta alat pemrograman.
Memiliki pengetahuan yang baik tentang aplikasi web & seluler, database (mySQL, MongoDB) dan sistem terdistribusi (penerapan).
Memiliki pengalaman membuat API RESTful dan Mock.
Keterampilan yang dibutuhkan : Java, PHP, Python atau Laravel, NodeJS atau Golang, MySQL, MariaDB, Git, Codeigniter/express, Scrum Agile.
Lancar di Docker / Kubernetes.
Memiliki inisiatif, motivasi diri, perhatian terhadap detail, dan baik dalam kerja tim.
Keterampilan komunikasi verbal yang sangat baik.
Keterampilan pemecahan masalah yang baik.
 Tugas & Tanggung Jawab:
Berkontribusi ke seluruh siklus hidup aplikasi, dengan fokus pada pengkodean dan debugging.
Integrasikan elemen yang menghadap pengguna yang dikembangkan oleh pengembang front-end dengan logika sisi server.
Optimalkan aplikasi untuk kecepatan dan skalabilitas maksimum.
Menerapkan keamanan dan perlindungan data.
Merancang dan mengimplementasikan solusi penyimpanan data (ERD).
Mengintegrasikan, mengelola, dan optimasi database.
Bekerja dengan framework back end (Laravel, Nodejs, Flask dll).
Menggunakan bahasa pemrograman server-side.
Integrasi API.
Keamanan dan pencegahan peretasan.
Teknologi server web.
Menyiapkan data dari DB sesuai kriteria yang di inginkan FE.
Menjembatani FE dan Database, jembatan disini berupa API/service.
Tingkatkan, dan Terapkan layanan backend dan API berkualitas tinggi.
Mendiagnosis masalah, dan membantu menciptakan solusi.",None
Full-Stack Web Developer (Mid-Senior level),Busana Apparel Group,"South Jakarta, Jakarta",None,Full time,"Busana Apparel Group is one of the largest Garment Manufacturing company in Indonesia. We own several companies/factories in Indonesia and serve many popular brands worldwide.
 We are currently sourcing for Full-Stack Web Developers to join our Company.
Job Description:
Develop/Setup backend software platform capable of serving all business units in a centralized environment.
Develop/Extend application modules to support business requirements serving ALL Business Units.
Design/Develop integration API for existing system with various third-party solutions.
Maintain software application lifecycle.
 Job Requirements:
D3 from related majors.
Have a minimum of 5 years experience as a Backend Developer using Java, Python, NodeJS.
Have experience in building and maintaining REST API
Have experience using PostgreSQL, and IBM DB2 would be more appreciated.
Have knowledge or experience using Javascript, React is a plus.
Have experience using Linux.
Willing to work onsite.
Intermediate English skills.
 ",None
Lead Backend Developer,PT Akseleran Keuangan Inklusif Indonesia,Jakarta,None,Full time,"Responsibilities:
Architect and design backend services.
Write well-designed, testable, and efficient code using best software development practices.
Create and maintain software documentation.
Communicate and coordinate effectively with internal and external teams.
Quickly learn and adapt to new technologies as needed.
Mentor team members.
 Requirements:
Bachelor's degree in Computer Science or Information Technology from a reputable university.
Minimum 4 years of professional experience as a backend engineer.
Experience leading a team of developers.
Proficiency in:
Python and Python frameworks (Flask, Django)
RDBMS (PostgreSQL, MySQL)
NoSQL databases (Redis, MongoDB)
Unit testing, REST APIs, and Version Control Systems (GitLab, GitHub)
Linux OS
Experience with or knowledge of:
Microservices architecture
Test-Driven Development (TDD)
Message brokers (Kafka, RabbitMQ)
Understanding of Google Cloud Platform (GCP) is an added advantage.
 Working Arrangement: Hybrid/On-Site.",None
IT Programer specialist ODOO,PT FOKUS KENCANA,"Central Jakarta, Jakarta",None,Full time,"Spesifikasi :
Usia min 25 thn
Pendidikan Min D3 Ilmu Komputer
Pengalaman Min 3 tahun di bidang IT
Mahasiswa Kelas karyawan (welcome) 
 Memiliki Kemampuan sbb : 
- Mengelola Aplikasi Bisnis ODOO untuk Perusahaan.
- Instalasi, Implementasi & Maintenance ODOO ERP (Community & Enterprise)
- Memahami bahasa program PHP, Pyton, Java Dll
- Berpengalaman sabagai database administrator.
- Menguasai proses desain pengembangan dan pemeliharaan aplikasi ERP
- Berpengalaman pengembangan aplikasi ERP menggunakan Odoo (lebih di utamakan)
- Diutamakan yang memahami ODOO Enterprise 
 Job Desk : 
- Instalasi Odoo pada server atau VPS & dan Configurasi Server.
- Create New Module atau Customize Module sesuai Bisnis Proccess
- Configurasi Module
- Penambahan / Perubahan kolom pada menu existing
- 3 Modul baru dengan fungsi standar (Form / List / Pivot) 
- 1 Modul baru yg dapat berkorelasi dengan modul lain (Contoh PR -> PO -> Accounting) dst..
- Setting awal ERP
- Inherit Data
- Migrasi Data ke Odoo dari server lama.
- Input data master
- Implementasi Modul
- Change Funciont Python
- Configurasi Mail Perusahaan
- API Integrasi dengan website atau aplikasi lain
- Maintenance Odoo
- Kelola database
- Support terkait reporting
- Fixing bug
- Manual Book
- Custome sesuai perubahan kebutuhan Perusahaan.
 ",None
Junior Developer,PT Datacaraka Solusindo,"West Jakarta, Jakarta",Rp 5.000.000 – Rp 6.500.000 per month,Full time,"Job Highlights:
Flexible working hours and Flexible remote work from anywhere.
Health Insurance.
Training & Certification with benefits.
Yearly Performance Bonus.
 Responsibilities:
Produce Lines of Code using .NET + NodeJS framework.
Fast and adaptive with MVP development.
Learn new technology stack related to product development.
Understand the core principle of NoSQL and PostgeSQL.
Master NestJS with Express and NextJS with React.
Participate in requirement analysis & software design.
Support application deployment.
Analyze functional requirements and designing workflow for applications.
Participate in designing database structure for applications.
Develop SQL queries for data retrieval / updates for applications.
Develop documentation for code segments and workflows throughout application development life cycle. 
Doing Code Review for stability & performance improvement.
 Are You The Right Person We're Looking For?
Fast learner
Result Oriented with good process justification
Discipline, Hardworking, able to work under pressure
Communicative & socially aware
Highly Initiative and self-motivated
Good individual and team player
 Academic Requirements
Candidate must possess at least Diploma or Bachelor's Degree in Engineering (Computer/Telecommunication), Computer Science/Information Technology or equivalent.
Fresh graduates are always encouraged to apply.
 Technical Skills Requirements
At least 1 Year of working experience in .NET or NodeJS Programming.
Required languages: Bahasa Indonesia (active) & English (passive).
Having good logic & problem-solving skills.
Good knowledge in HTML / CSS.
Good knowledge in javascript/jquery.
High proficiency in using Typescript.
Having experience in database implementation using NoSQL and PostgreSQL.
Having a good exposure to at least one of the following tech stack is a plus: NodeJS, Netcore, Express, Flutter, React, Python.
Familiarity with architecture styles/APIs (eg. REST) is a plus.
Having .NET related certification (MCSA/MCSD) is a plus.
Having .SQL related certification (MCSA/MCSE) is a plus.
  ",None
Senior Programmer,PT PERFORMA OPTIMA KOMPUTINDO,"Surabaya, East Java",None,Full time,"Kualifikasi
Pendidikan minimal D3 Jurusan Teknik Informatika atau sejenis. Jurusan lain dipersilahkan jika memiliki kemampuan dan pengalaman yang sesuai.
Pengalaman minimal 3 Tahun dalam membuat Software aplikasi.
Menguasai aplikasi PHP Framework codeigniter, mysql, Android, dan iOS (optional).
Memahami ERP dan berpengalaman dalam pembuatan dan implementasinya.
Memahami proses bisnis khususnya perusahaan distribusi dan simple manufacturing.
Bersedia sewaktu-waktu ditugaskan di luar kota untuk keperluan project development dan implementasi.
Penempatan Surabaya, Jawa Timur.
 ",None
Frontend Developer,PT Karisma Zona Kreatifku,Jakarta,None,Contract/Temp,"Job description & responsibilities: 
Translate designs and wireframes into high-quality, responsive code. 
Optimize performance and scalability of the front-end stack to ensure smooth user experiences. 
Build and maintain automated UI test suites to ensure code quality and reliability. 
Identify and resolve bottlenecks, bugs, and performance issues in our products. 
Collaborate closely with the product team to understand user needs and deliver innovative solutions. 
Work alongside the tech lead and other developers to maintain code quality and ensure best development practices are followed.
Requirements:
Bachelor's Degree in Computer Science, Information Technology, or a related field. 
Minimum 3 years of experience in frontend development for mid-level positions and minimum 5 years of experience for senior-level positions.
Proficiency in HTML5, CSS3, and JavaScript, with strong experience in React.js and React Native. 
Familiarity with UI libraries such as ANTD, Tailwind CSS, etc. 
Experience with design platforms like Figma. 
Strong attention to detail, analytical skills, and problem-solving abilities. 
Proven experience working effectively in collaborative team environments. 
Excellent communication and interpersonal skills. 
Proficiency in UI testing frameworks is a plus. 
Additional proficiency in TypeScript, Next.js, Android Kotlin, and Swift is a plus. 
Knowledge of analytics tools for tracking user behavior and website performance. 
Understanding of SEO principles and best practices. 
Familiarity with React Hooks for state management and component lifecycle
Willing to remote system with contract status (3 month first, possible to extend)",None
Software Developer,"PT Indomobil Sukses Internasional, Tbk","East Jakarta, Jakarta",None,Full time,"Roles & Responsibility :
The primary function of Software Developer / Analyst position is to design, develop, and maintain business applications. The applications may be new or may be modification to existing applications.
This developer will work in a team environment to meet with business process experts to understand and document business requirements.
From these requirements the team will design and develop functional and technical specifications for custom built analytical and/or operational applications.
The team will then code, test, document, implement, and maintain the application. Training of the end users of the application may also be required.
 Requirements :
Candidate must possess at least Bachelor's Degree in Engineering (Computer/Telecommunication), Engineering (Electrical/Electronic), Engineering (Industrial), Engineering (Mechanical), Mathematics, Computer Science/Information Technology or equivalent.
At least 2 Year(s) of working experience in the related field is required for this position.
More than 2 year of experience working with VB.NET; VB script; Crystal Report, SQL Server Reporting Services (SSRS).
Strong skills in Microsoft .NET Core Concepts and Architecture; Internet Information Server (IIS); Microsoft Transaction Server(MTS); and HTML.
Having experience in web services concept (ex: REST) and JSON.
Deep knowledge of SQL and associated utilities and tools
Microsoft Operating Systems
MCAD - Microsoft Certified Application Developer preferred
Having experience MVC is a plus.",None
IT PROGRAMMER STAFF,PT Indomobil Finance Indonesia,Jakarta,None,Full time,"Deskripsi Pekerjaan
Melakukan pengembangan pengujian dan pemeliharaan sistem aplikasi dengan memenuhi requirement yang ditetapkan
Membuat dokumentasi teknis
Mengumpulkan dan mengevaluasi umpan balik pengguna
Berkontribusi pada perancangan sistem aplikasi baru
Kualifikasi
Pendidikan min. S1 atau setara, jurusan Teknik Informatika / Ilmu Komputer / Sistem Informasi / Komputer Akuntansi
IPK minimal 2.75 (dari skala 4.00)
Fresh graduate atau berpengalaman 1 tahun
Menguasai SQL Server, ASP.NET, Crystal Report, HTML, CSS, dll
Memiliki kemampuan analisa yang tinggi
Mampu bekerja secara individu maupun dalam tim
Pelamar yang tertarik dapat melamar secara online dengan mengklik tombol Apply this Job atau dapat mengirimkan Resume Anda dengan foto terbaru dan Transkrip Nilai ke :
Human Resource Department
PT. Indomobil Finance Indonesia
Indomobil Tower Lt.8
Jl. MT Haryono Kav.11
Jakarta 13330",None
IT Programmer (Dynamics AX),PT. Akasha Wira International Tbk,"South Jakarta, Jakarta",None,Full time,"Responsibility:
Manage team, develop, maintain and support Axapta and Poseidon to ensure ERP application according to company needs.
 Qualification:
Candidate must possess at least a Diploma, Bachelor's Degree, Computer Science/Information Technology or equivalent
At least 1 - 2 year of working experience as Programmer Dynamics AX 2012
Having experience in develop API in Dynamics AX is a plus
Having experiece in SQL server database
Good interpersonal skill and team work",None
Full Stack Developer,PT Cipta Adhyabusana,"West Jakarta, Jakarta",None,Full time,"Requirements:
Min. Diploma Degree in Computer Science, Information Technology or equivalent
Minimum 2 years of working experienced as IT Developer
Proficiency in RESTful API, Microservices, NoSQL/SQL, Node.js & Angular Program
Interest in enterprise application development
Attention to detail and strong analytical skills
Can work effectively in a team environment
Able to learn and adapt quickly to new technologies and tools
 Job Descriptions:
Operate, maintain, and improve existing applications/products
Design & develop easy-to-use solutions (both on back-end and front-end)
Perform debugging, troubleshooting, and contribute to system architecture design
Maintains historical records by documenting program development and revisions
Collaborate with teams on building and improving applications
Maintaining the confidentiality of client data",None
IT Programmer (Dynamics AX),PT. Akasha Wira International Tbk,"South Jakarta, Jakarta",None,Full time,"Responsibility:
Manage team, develop, maintain and support Axapta and Poseidon to ensure ERP application according to company needs.
 Qualification:
Candidate must possess at least a Diploma, Bachelor's Degree, Computer Science/Information Technology or equivalent
At least 1 - 2 year of working experience as Programmer Dynamics AX 2012
Having experience in develop API in Dynamics AX is a plus
Having experiece in SQL server database
Good interpersonal skill and team work",None
IT Division Team,PT Gudang Kripto Indonesia,"South Jakarta, Jakarta",None,Full time,"We  are looking for position :
Database Administrator 
Infrastructure and Support
Back and Developer 
Front and Developer 
Mobile Developer 
Requairment : 
Usia minimal 25 - 40 tahun 
Pendidikan (nomor 1-5) minimal D3 / S1 Sarjana Informatika
Domisili lebih diutamakan berdomisili Jakarta 
Pengalaman, No : 1,2,4,5 : dibutuhkan pengalaman 5 tahun dan nomor 3 dibutuhkan pengalaman min. 7 tahun 
Kualifikasi 
Database  Administrator: Memahami SQL Query (My SQL, PosgreSql, Sql Server dan Oracle
Infrastructur and Support : Memahami topologi jaringan, famiar Mikrosoft base, dan Infrastruktur server 
Back and Developer : Memahami bahasa pemograman C#, Framework ASP.net, dan metodologi MVC API
Front and Developer : Memahami kerangka kerja React, Vue.js, dan version control github
Mobile Developer : Memahami bahasa pemograman dart, dan frame workflutter, familiar slicing UI/UX ",None
Programmer,PT Fusion Dinamika,"West Jakarta, Jakarta",Rp 7.000.000 – Rp 9.000.000 per month,Full time,"Are you passionate about developing and enhancing cutting-edge solutions? 
Do you have a talent for customization and improving functionalities of high-level software products? We are looking for a skilled Programmer/Software Developer to join our dynamic team and help us take our technology offerings to the next level!
Key Responsibilities:
Customize and enhance our solutions' functionalities, including Cybersecurity, DevSecOps, Linux-based systems, and Enterprise applications.
Develop and implement features based on client requirements.
Work closely with cross-functional teams to integrate new features and ensure seamless system operations.
Troubleshoot, debug and optimize code for efficiency and scalability.
Requirements:
Bachelor's degree in Computer Science, Software Engineering, Information Technology, or a related field.
Relevant certifications in programming, cybersecurity, DevSecOps, or specific technologies (e.g., Linux, cloud platforms) are a plus.
Knowledge of software development methodologies and best practices.
It has a proven track record of internships, projects, or coursework that demonstrate proficiency in software development and system integration.
Proficiency in programming languages such as Python, PHP, Java, .NET, etc.
Strong understanding of databases like MySQL, PostgreSQL, or similar.
Experience working with APIs and third-party integrations.
Familiarity with version control systems (e.g., Git).
Knowledge of both front-end and back-end development is a plus.
Experience in customizing and enhancing functionalities for cybersecurity, DevSecOps, Linux-based systems, or enterprise applications is a plus.
Strong problem-solving skills for troubleshooting, debugging, and optimizing code.
Good communication skills and ability to collaborate with cross-functional teams.
Ability to work efficiently in a fast-paced, team-oriented environment.
Continuous learning and upskilling in relevant areas through online courses, certifications, or workshops will be considered an advantage.
If you're a programmer who loves solving challenges and improving software, we'd love to hear from you!
Apply now and be part of our innovative team!
 ",None
Odoo Developer Staff,PT Indal Aluminium Industry Tbk,East Java,Rp 7.500.000 – Rp 9.500.000 per month,Full time,"Job Description : 
Develop and customize Odoo applications and modules based on business requirements
Collaborate with clients and teams to gather and analyze project needs.
Design, implement, and maintain efficient and scalable code.
Configuration, installation, and maintenance of server and multi-database Odoo environments
Troubleshoot and resolve issues in Odoo applications promptly.
Integrate Odoo with other systems and create technical documentation and user guides.
 Candidate Requirements:
Bachelor's Degree in Information Technology, Computer Science, or related fields
Minimal Experience 3-4 years
Deep understanding of ERP (Odoo) and Python
Experience in implementing Odoo projects.
Previous experience in integrating between Odoo and third-party API.
Knowledge of PostgreSQL, Javascript, XML, SCSS, HTML, Java, Qweb
Able to operate Linux, Git
Ability to work and communicate with the whole company
Quick learner
 ",None
ETL Pentaho Developer,PT. BUSINESS ECLOUD INDONESIA INFORMATION TECHNOLOGY,"Central Jakarta, Jakarta",Rp 9.000.000 – Rp 12.000.000 per month,Full time,"About the role:
As a ETL Pentaho Engineer, you will be responsible for extracting and ingesting data from websites using web crawling tools. In this role you will own the creation process of these tools, services, and workflows to improve crawl/ scrape analysis, reports, and data management.
We will rely on you to test the data and the scrape to ensure accuracy and quality. You will own the process to identify and rectify any issues with breaks as well as scale scrapes as needed.
Job Responsibilities:
Should be able to perform data extraction, data loading solving the errors, checking filter criteria.
Understanding on the steps - input, output, and connection to database.
Understanding on job/transformation, inspecting the data.
Understanding on salesforce basics - fields, objects, and lookups.
Knowledge on schema, database, views.
Provide technical knowledge/expertise to support the requirements definition, design, and development of data warehouse components/subsystems, specifically Extract-Transform Load or Extract-Load-Transform technologies and implementations and/or Change Data Capture technologies and implementations.
Getting fallout report and analyzing the bugs and errors, should understand how to get output file.
Research, design, develop, and modify the ETL and related database functions, implementing changes/enhancements to the system.
Design ETL processes and develop source to target transformations, and load processes.
Requirements:
Bachelor’s degree in computer science or a related field or the equivalent demonstrated experience
Must have at least 2 years of experience in Pentaho
Experience running large scale web scrapes
Experience with Linux/UNIX, HTTP, HTML, JavaScript, and Networking
Experience with techniques and tools for crawling, extracting, and processing data.
Great communication skills (written and Spoken in English)
Good to have:
Familiarity with system monitoring/administration tools
Familiarity with version control, open-source practices, and code review
Familiarity with Python",None
