Job Title,Company Name,Location,Salary,Job Type,Job Description,Date
Web developer,PT. ELEVASI TEKNOLOGI CAKRAWALA (AMTISS),"South Tangerang, Banten",Rp 4.700.000 – Rp 6.500.000 per month,Full time,"Responsibilities:
Maintain software by developing improvements, revise scripts & developing new modules.
Innovate with new ideas to existing products & software infrastructure.
Working as a team in developing web applications.
 Requirements/ Qualifications:
Candidate must possess minimum Diploma in Computer Science/Information Technology or equivalent.
At least 1 Year(s) of working experience in the related field is required for this position.
Required skills: (one or more) PHP, Python, Odoo, Java, HTML, CSS
Have a minimum experience of developing web application for commercial projects
Knowledge in working with SQL based database
Good understanding of Linux operating system",None
Business Intelligence Developer,PT Delisari Nusantara,"North Jakarta, Jakarta",None,Full time,"Design, develop & maintaining Power BI Dashboard.
Develop all data warehouse models and prepare reports for all meta data integration into systems.
Supporting the data warehouse in identifying and revising reporting requirements and coordinate with business analysts and users to resolve all requirement issues and maintain quality for same.
Requirements :
Bachelor's Degree in Computer Science/Information Technology
Having work experience as Data Engineer/ETL Developer minimal. 2 years
Demonstrated experience with Power BI tools.
Experience with other Office 365 (Sharepoint, Power Apps, Active Directory) is advantageous.
Experience with SQL.
Good attention to detail.
Work placement: Sunter, North Jakarta",None
ERP Consultant,PT SME Solution,Jakarta,"Rp 5,000,000 – Rp 7,000,000 per month",Full time,"Establish in 2004, PT SME Solution (SMES) commit to development of a multi-discipline, dedicated professional team covering a broad range of expertise to help achieve customers’ implementation objectives. We have many successes story in implementing ERP system for various business industries, national & multi-national companies.
We would like to invite you to join our team as:
ERP APPLICATION CONSULTANT (EC) and ERP TECHNICAL CONSULTANT (TC)
General Requirements:
Fresh graduates are encouraged to apply.
Eager to learn new things and possess exceptional problem solving & analytical skills.
Proactive, good in time management, scheduling management, self-motivated & self-initiative
Computer literate.
Strong teamwork attitude, strong interpersonal skills
Fluent in English both spoken & written.
30 years old or younger.
 Application Consultant Requirements: 
CODE: AC-JKT 
Will be based on Jakarta 
Bachelor’s degree from reputable university with GPA > 3.0 majoring in Accounting / Industrial Engineering
 Technical Consultant Requirements:
CODE: TC-JKT
Will based on Jakarta
Bachelor’s degree from reputable university with GPA > 3.0 majoring in: Informatics Engineering / Information Technology (IT)- Computer Science
Having technical skills in Web Programming and JavaScript, also experience in developing Android and/or IOS Apps are preferable.",None
Fullstack Web Developer,Indonesia Equipment Centre,"Kelapa Gading, Jakarta",None,Full time,"Job Title: Web Developer (Full Stack Developer)
Job Summary: Motor Sights International is seeking a talented and motivated Web Developer (Full Stack Developer). The ideal candidate will have a strong understanding of web development principles, experience with modern web technologies, and a passion for creating engaging and user-friendly web experiences.
 Responsibilities:
Website Maintenance: Maintain and update the company’s landing page to ensure it is current and functioning properly.
Content Management: Upload and manage content on the landing page, including text, images, and multimedia elements.
Troubleshooting: Identify and resolve technical issues related to the website's performance, accessibility, and security.
Optimization: Optimize the landing page for speed, performance, and search engine visibility (SEO).
Collaboration: Work closely with the marketing and design teams to implement web projects and campaigns.
Analytics: Monitor and analyze website performance metrics, providing insights and improvement recommendations.
Documentation: Document web development processes, updates, and best practices.
 Qualifications:
Experience: 3-5 years of experience in web development.
Education: Bachelor’s degree in Computer Science, Information Technology, or a related field is preferred.
Language: Good communication in English is a must
Technical Skills:
Proficiency in HTML, CSS, JavaScript, and other web development languages.
Experience with content management systems (CMS) such as WordPress.
Familiarity with responsive design principles and mobile-first development.
Basic understanding of SEO best practices.
Communication: Strong communication and interpersonal skills.
Problem-Solving: Proactive problem solver with a keen eye for detail.
Team Player: Ability to work collaboratively within a team environment.
Adaptability: Flexibility and adaptability in a fast-paced environment.
 Preferred Qualifications:
Experience with front-end frameworks such as Bootstrap or Foundation.
Knowledge of version control systems such as Git.
Basic understanding of web hosting and domain management.",None
Sales Analytics Project Developer,PT. GARIS PERTAMA SOLUSI,"East Jakarta, Jakarta",Rp 8.500.000 – Rp 8.700.000 per month,Contract/Temp,"Key Responsibilities:
Power BI Development: Design, develop, and deploy Power BI reports and dashboards that meet business requirements, ensuring they are user-friendly and visually appealing. 
Data Modeling: Create and maintain data models, including relationships, hierarchies, and measures, to support effective data analysis and reporting. 
Data Integration: Integrate data from multiple sources, such as SQL databases, cloud services, and APIs, into Power BI, ensuring data accuracy and consistency. 
User Support and Training: Provide support to end-users, troubleshooting issues and ensuring they can effectively use Power BI tools. Conduct training sessions to enhance user adoption. 
Collaboration: Work closely with business analysts, data engineers, and other stakeholders to gather requirements and ensure Power BI solutions align with business goals. 
Documentation: Maintain detailed documentation of Power BI solutions, including data models, report structures, and deployment procedures. 
Continuous Improvement: Stay up-to-date with the latest Power BI features and best practices, continuously improving the quality and efficiency of Power BI solutions.
Qualifications:
Minimum of 2 years of experience in a Power BI engineering or development role. 
Education: Bachelor’s degree in Information Technology, Data Science, Computer Science, or a related field (or equivalent experience). 
Strong proficiency in Power BI, including Power Query, DAX, and data visualization techniques. 
Experience with data integration from various sources, Excel, and APIs. 
Strong understanding of data modeling principles and database management. 
Strong communication skills, with the ability to collaborate effectively with cross-functional teams. 
 ",None
System Analyst,"PT. Metrodata Electronics, Tbk","West Jakarta, Jakarta",None,Contract/Temp,"We are looking for an experienced System Analyst to join our team. If you have excellent programming skills and a passion for developing applications or improving existing ones, we would like to meet you. As a System Analyst, you’ll work closely with our engineers to ensure system consistency and improve user experience. System Analyst roles and responsibilities include:
Perform design an upgrades of information system to meet the business and client needs.
Provide documentation of all processes as needed.
Implement best practices for supportability
Coordinate and communicate effectively with the internal developer team.
 PT Metrodata Electronics, Tbk (Digital Solution Provider & Technology Innovator) would like to invite you to be part of the company to develop yourself and your skills. If you are:
Bachelor's Degree,Computer Science/Information Technology
At least 1 year of working experience as System Analyst
Have deep knowledge in the field of project development life cycle (Agile or Iterative)
Have experience in analyzing and designing business processes using data flow diagrams and UML
Have experience in making FSD, Use Case, ERD, ERPNext
Have deep knowledge in RDBMS but not limited to SQL Server.
This position will be located in Jakarta. If you meet the requirement we needed, let’s apply for the following open positions. Metrodata not just offer for the job, we offer you for brighter career future.",None
Javascript Developer,PT Intersolusi Teknologi Asia,"Bandung, West Java","Rp 5,000,000 – Rp 7,500,000 per month",Full time,"Responsibilities:
Your duties will include (but will not be limited to):
 Performing or directing website updates.
Developing, maintaining and optimizing database driven web applications.
Evaluating code to ensure it is valid, properly structured, meets standards and is compatible with browsers, devices or operating systems.
Working under an Agile development methodology.
Researching, learning and evaluating new software.
 Requirements:
Candidate at least a Diploma / Bachelor's Degree, Engineering (Computer), Computer Science/Information Technology or any related fields
Min. 1 years experience in Web development using Javascript Framekwork(s)
Proficiency in Backend Development using NodeJS/ExpressJS/NestJS is a must
Proficiency in Frontend Development using Angular/ReactJS/VueJS is a must
Experienced in using PostgreSQL and MongoDB
Strong in English both verbal and written
Must be able to work in a fast paced environment
Knowledgeable in REST protocol",None
Project Manager,PT EBconnection Indonesia,"South Jakarta, Jakarta",None,Contract/Temp,"Job Responsibilities:
Collect, analyze, and document client requirements to translate them into detailed system design documents (FSD, SRS, LLD).
Collaborate and coordinate with stakeholders, including clients and internal project teams, to define project scope, objectives, and deliverables.
Prioritize, organize, and structure requirement specifications, data mappings, diagrams, and flowcharts for development and Quality Assurance (QA) teams.
Oversee the creation and review of test scenarios in collaboration with the QA team to ensure quality and accuracy.
Facilitate communication between technical and non-technical stakeholders to ensure smooth project execution.
Monitor and track project progress, ensuring milestones and deadlines are met.
Identify and mitigate project risks, proposing effective solutions when necessary.
 Requirements:
Excellent communication skills, both verbal and written.
Ability to think critically, with strong analytical and problem-solving skills.
Non-smokers are preferred.
Motivated, creative, and willing to take ownership of projects.
Proven experience in project management within a software development environment (.NET, Java, or JavaScript is a plus).
Strong understanding of RDBMS (Relational Database Management Systems).
Experience working with Agile methodologies and project management tools.
Passion for learning new technologies and methodologies.
 Preferred Qualifications:
Bachelor's degree in Computer Science, Information Technology, or a related field.
Project Management certification (PMP, PRINCE2) is a plus.
Experience as a developer or software engineer is advantageous.",None
Python Developer,PT CIMB Niaga Tbk,"Tangerang, Banten",None,Contract/Temp,"Job Responsibilities:
Mengerjakan dan melakukan maintenance terhadap proses development aplikasi yang sangat kompleks, melakukan analisa kebutuhan, desain system, menentukan spesifikasi system dan program, dan melakukan pengujian aplikasi untuk memastikan aplikasi yang dibangun bisa berjalan dengan baik dan lancar sesuai dengan kebutuhan bisnis, dan mampu mendukung bisnis proses bank sesuai dengan SLA yang sudah disetujui sebelumnya terhadap aplikasi yang ditangani.
Job Requirements:
Minimal gelar S1 Universitas dalam Ilmu Teknik Komputer/Teknologi Informasi/System Informasi atau setara
Minimal 1 tahun bekerja sebagai Python Developer
System Development Life Cycle
Project Management
Application Maintenance
Complex Application System Analysis & Design
Application System Programming
Banking Applications & Operations
Banking Information & Technology for User
Banking Risk Operation",None
Management Assistant,PT EDPMEDIA Multimitra Primanusa,"West Jakarta, Jakarta",Rp 6.500.000 – Rp 8.000.000 per month,Casual/Vacation,"EDPMEDIA Consulting penyedia jasa Integrated Project Development & Delivery Service & Solution menggunakan Technology BIM (Building Information Modelling) dari Autodesk Architecture Engineering Construction , Technology Project Management Solution (PMS) dari  Oracle Primavera, serta Technology  Engineering Solution dari  Bentley (Staadpro,  Plaxis, Geostudio).
EDPMEDIA Consulting telah menyediakan Layanan bagi Developer / Project Owner, Contractor, Consultant mendukung perencanaan & pelaksanaan Gedung, Data Center, infrastruktur serta fasilitas industry sejak tahun 1996, beberapa Klien kami diantaranya adalah: Pertamina, PLN, AECOM, Triparta, Rekin, IKPT, JGC, Saipen, TechnipFMC,  Krakatau Engineering, Smart, Summicon, Jaya Obayashi, Shimizu Construction, Takenaka, Siemen , Total Bangun Persada, Wijaya Kusuma Contractors, ACSET Indonusa, Paramount, Summarecon Agung, Agung Podomoro Land,  ITDC Mandalika, MNC Land, PerumnasSemen Gresik, Semen Padang, Chandra Asri, Pupuk Kujang,  Aneka Tambang, Freeport Indonesia, Vale Indonesia, Amman Mineral, Bukit Asam,  ITM, Adaro, KPC, Arutmin, BP Indonesia, INPEX, ENI, Conocophilips Indonesia, Chevron Indonesia, ExxonMobile Indonesia, Badak LNG, Medco Energy,  Wijaya Karya Gedung Tbk,  Wijaya Karya Tbk,  Adhi Karya LRT, Waskita Karya Tbk , Waskita Beton Precast Tbk, Hutama Karya, Hutama Karya Infrastruktur, Pembangunan Perumahan, Jaya Konstruksi, Jaya CM , Virama Karya, Perencana Djaja, Cipta Strada,  Pelindo,  Jakarta Propertindo, Jakarta MRT, Angkasa Pura, CTP (Cilincing-Cibitung Toll Road) , CMNP. 
EDPMEDIA saat ini menyediakan kesempatan kerja :   
Kualifikasi & Kriteria : 
Diploma S1  Jurusan Manajemen Perkantoran / Manajemen Keuangan / Akuntansi 
IPK kumulatif minimal 3.5 
Pengalaman Kerja 1 tahun
Kandidate dengan pendidikan D3 akan di pertimbangan 
Kandidat yang di prioritaskan
Kandidat: Yang ber domisili di Jakarta Barat 
Kandidat dengan kemampuan berkomunikasi dalam bahasa mandarin (Level beginner Memadai)   
Tugas dan Tanggung Jawab  Management Assistant Trainee  adalah  untuk mendukung pelaksanaan tugas dan fungsi  Kepala Divisi  berikut ini :
Melaksanaan Tugas tugas administrasi yang antara lain (tapi tidak terbatas pada) : adminitrasi kegiatan kantor,  administrasi petty cash , administrasi kegiatan usaha,  menyusun laporan termasuk laporan keuangan hasil kegiatan usaha.     
Menata dan Mengelola Arsip berkas (terutama digital format) secara online sesuai prosedur  yang disepakati bersama.
Dibawah arahan atasan bertugas menghimpun pengetahuan umum seputar pemanfaatan technology untuk industri dari berbagai media online serta social media (terutama google dan linkedin)
Dibawah arahan atasan bertugas merencanakan kegiatan terutama kegiatan  promosi product & layanan  yang disediakan edpmedia. Serta menerima , mengelola data dan informasi feedback / response 
Manfaat Pembinaan dalam bulan pertama :
Calon yang lulus interview akan mendapatkan kesempatan pembinaan Prosedur ISO 9001  (sistem manajemen mutu ) perusahaan. 
Gross Take Home Pay dan Manfaat lainnya :
Gross Take Home Pay Full Time (Termasuk tunjangan BPJS, pajak penghasilan)  berkisar  6.5  sd 8 juta per bulan tergantung hasil evaluasi kualifikasi  serta penempatan. 
THR 1 bulan setiap tahun bekerja
Kontak edpmedia attn Senior Director Eddie Cendana MSc
Website www.edpmedia.com
Email : service@edpmedia.com",None
Senior QA Engineer,PT Amartha Mikro Fintek (Jakarta),"Kebayoran Lama, Jakarta",None,Full time,"About the role
As our next Quality Assurance, you will get a chance to help our customer, by recommending improvements, and develop automation to scale our testing process. You will actively collaborate with Product Managers, Engineering, and DevOps to help Amartha to deliver innovative and delightful user experiences.
Responsibilities
Improving, enhancing, automating: acting as a catalyst for change and improvement in performance and quality
Create test automation script for API and UI automation to improve the regression test efficiency
Create load-test script to assess the scalability of our system
Create security scan test to detect vulnerability of our system
Analyze bugs and errors found during tests
Recommend improvements in software to enhance user experience
Motivate the development process for efficiency and performance
Works together with the software developer to enhance and improve program
Requirements
Bachelor’s degree (Preferably Computer Science / Information Technology)
Has a minimum of 3 years experience in the related field
Experience with testing and testing automation tools: Robot Framework, Katalon Studio, Locust, Artillery, Browserstack, ZAP
Experience with API testing automation, UI Automation, Loadtest, and Security Scan
Knowledge and understanding of modern development techniques, branching strategies (gitflow, feature branches / flags, trunk-based development) and CI/CD
Understanding the need for testing automation at all levels: from database to UI
Possesses good problem solving skills (able to identify problems and find simple solutions). Able to think out-of-the-box
Fun to work with and a team player
Eager to learn (self-learning and from others), share and grow
Self motivated and able to inspire and motivate people",None
ERP Development (Sr. Staff - SPV) - IT Solutions (A-111294),RGF HR Agent Indonesia,"South Jakarta, Jakarta",Rp 10.000.000 – Rp 15.000.000 per month,Full time,"About The Company:
The working venue is in South Jakarta.
Our client is an IT Solutions company. Currently, they are looking for ERP Development (Sr. Staff - SPV).
Job Responsibilities:
Handle ERP Development projects.
Understand manufacturing industry systems.
Provide solutions on clients business systems problems.
Other tasks as assigned.
Job Requirements:
Bachelor's degree from Computer Science, information system, engineering or related major.
Have min 3+ experience ERP development in IT solutions especially in manufacture industry clients.
Maximum 36 years old.
Experience as technical Consultant and developer.
Have experience in SQL (Oracle/SQL Server).
Have experience in Web Application Development (C#/C++/C, .Net, Javascript,etc).
Business Level English.
[Only CV in English will be processed]",None
Frontend Web Developer,PT Bumi Amartha Teknologi Mandiri,"Tangerang, Banten",None,Contract/Temp,"Company Description
PT. Bumi Amartha Teknologi Mandiri (AMARTEK) is an IT Consulting company based in Jakarta, Indonesia. We are committed to delivering cost-effective and innovative solutions in Data & Analytics, Talent Augmentation, Regulatory Reporting, and Outcome-based services. Our goal is to provide the best value and highest quality of services to our clients by leveraging proven domain knowledge and professional expertise.
 Role Description
This is a contract position for a Frontend Web Developer at Amartek, located onsite in Bintaro, Tangerang.
Develop new user-facing features using ReactJS
Implement state management using Redux and React Hooks
Utilize React Query for efficient data fetching and caching
Build responsive and accessible UI components using TypeScript and Tailwind CSS
Collaborate closely with UX/UI designers, backend developers, and other stakeholders to deliver high-quality products
Optimize applications for performance, scalability, and cross-browser compatibility
Participate in code reviews, design discussions, and sprint planning sessions
 Qualifications
Bachelor or higher degree in Computer Science or related fields
2 - 4 years of experience as a Front End Developer using ReactJS
Experience with React Hooks for state management and side-effects
Familiarity with React Query for managing and caching asynchronous data
Strong proficiency in TypeScript
Good understanding of responsive design principles and experience with Tailwindcss or similar CSS frameworks
Knowledge of modern authorization mechanisms, such as JSON Web Token
Proficiency in CI/CD Tools (Jenkins, Bitbucket)
Excellent problem-solving skills and attention to detail
Willing to work on-site in Banking Industry (Bintaro, Tangerang)",None
WEB DEVELOPER,PT. DOMO MANAJEMEN GRUP,"North Jakarta, Jakarta",Rp 5.000.000 – Rp 7.000.000 per month,Contract/Temp,"Deskripsi Pekerjaan :
Membuat website sesuai dengan kebutuhan perusahaan
Mendesain layout dan interface halaman website yang responsif dan menarik
Membuat dan mengetes API atau Antarmuka pemrograman aplikasi sebagai protokol komunikasi, menyederhanakan implementasi, dan pemeliharaan perangkat lunak
Mengidentifikasi masalah yang ditemukan dari feedback atau testing dan memperbaikinya
Mengevaluasi code untuk memastikan bahwa code tersebut memenuhi standar, valid, terstruktur dengan baik, dan kompatibel dengan browser, perangkat, atau OS
Kualifikasi :
Usia Maksimal 35 tahun
Minimal pendidikan S1 IT / Semua Jurusan
Memahami cara mengembangkan desain website yang responsif
Memiliki pengalaman kerja sebagai web developer atau posisi terkait
Mampu bekerja sama dalam team ataupun bekerja individu
Memiliki kemampuan problem solving dan sudah familiar dengan berbagai bahasa pemrograman, framework dan juga library agar dapat menyusun code secara efisien.
Benefit :
Bonus / Komisi
Asuransi Kesehatan (BPJS)
Mess Karyawan
Jenjang Karir
Suasana Kerja yang FUN & Menyenangkan",None
Fullstack Developer,PT. OCS Global Services (OCS Indonesia),Jakarta,None,Full time,"Main Responsibility:
• Develop and maintain WebApp and RESTful API
• Implement and maintain database schemas
• Collaborate with cross-functional teams
• Troubleshoot, debugging, reporting and resolve issues
Requirement:
• Min Diploma / bachelor's degree from IT
• Understanding in Javascript Framework (ReactJS, ExpressJS) 
• Understanding of relational database (MySQL, SQL Server, Postgres)
• Understanding programming language of ASP.net
• Proficiency in using version control system (Git)
• Communication skills and ability to work collaboratively in a team environment
• Understanding in PHP Framework (Laravel & Codeigniter)
• Familiar with cloud ecosystems (Azure)
• Proficient English skills in passive communication",None
FULL STACK WEB DEVELOPER,ARKATEX,"Tangerang, Banten",Rp4.500.000 – Rp5.000.000 per month,Full time,"Pelamar diharapkan dapat melakukan pekerjaan sebagai berikut:
Mengembangkan website perusahaan
Melakukan pengembangan sistem IT internal perusahaan
Membuat perencanaan pembuatan sistem
Mencari dan memecahkan masalah ketika terjadi bug pada sistem
 Persyaratan Pelamar:
Diutamanakan Fresh Graduate
Minimal lulusan D3 / S1 jurusan yang sesuai
Menguasai dan memahami PHP, Javascript, Codeigniter, Laravel,  MYSQL, react, nodejs, postgresql, mongodb, python
Dapat bekerja dibawah tekanan deadline
Dapat bekerja sama dalam tim",None
IT Business Analyst,PT Nawa Data Solutions,"West Jakarta, Jakarta",Rp 8.000.000 – Rp 12.000.000 per month,Contract/Temp,"Requirements:
Have 3-5 years hands on experiences as business analyst.
Have the knowledge and experiences on project phases.
Experience handle project banking.
Familiar with create documentation for project (FSD / TSD / BRD, MOM, etc)
Have the knowledge and experience on implementation of Ambit Focus. and ALM system implementers.
Have a strong understanding and knowledge of SDLC methodologies (Waterfall/Agile/Iterative/Lean).
 Job desc:
Analyze business requirements and prepare project deliverables (BRD, MoM, etc).
Conduct discussion and requirement analysis with the business and implementers.
Bridging between Developer and Client if there are technical problems including gap requirements and providing recommendations for the best solutions.
Review and monitor overall project objectives and timeline.
Do regular updates to stakeholders and escalate if there are problems.",None
