Job Title,Company Name,Location,Salary,Job Type,Job Description,Date
SYSTEM ANALYST,PT Kinarya Alihdaya Mandiri,"West Jakarta, Jakarta",Rp 5.000.000 – Rp 6.500.000 per month,Full time,"Kualifikasi System Analyst
Pendidikan Minimal S1 semua jurusan diutamakan IT
Memiliki pengalaman System Analyst / Developer lebih dari 1 Tahun
Memiliki Pengalaman Testing Aplikasi
Komunikatif & dapat bekerjasama dengan Team
Tugas & Tanggungjawab System Analyst 
Menganalisa setiap kebutuhan pengembangan layanan yang memerlukan perubahan secara teknis (include security aspect) supaya dampak dan kelayakannya dapat diidentifikasi dengan tepat
Membuat keputusan terkait solusi dan flow teknis berdasarkan business requirement supaya dapat diimplementasikan secara teknis dengan baik dan sesuai
Berkoordinasi dan mensupport squad team, mulai dari fase development hingga ready for commercial (RFC) 
Mensupport squad team dan sre apabila terjadi gangguan pada layanan sehingga layanan dapat berjalan dengan normal kembali
Mensupport squad team dan QA team dalam proses testing sehingga layanan dapat berjalan dengan tepat sesuai rancangan",None
QA Tester,PT Triputra Investindo Arya (Triputra Group),"Tebet, Jakarta",None,Contract/Temp,"Job Description:
Melakukan pengujian manual dan otomatis terhadap perangkat lunak untuk memastikan kualitas dan performa.
Menyusun dan menjalankan test plan, cases, dan scripts untuk berbagai skenario.
Mengidentifikasi, mendokumentasikan, dan melacak temuan test lunak secara rinci dan akurat.
Bekerja sama dengan developer untuk memahami fitur dan fungsionalitas yang diuji serta memberikan feedback mengenai temuan test.
Mengelola dan memperbarui dokumentasi pengujian, termasuk laporan bug dan laporan hasil pengujian.
Berpartisipasi dalam review desain dan spesifikasi teknis untuk memastikan pengujian yang komprehensif.
Mengoptimalkan proses pengujian dan memberikan rekomendasi untuk perbaikan kualitas pada perangkat lunak.
Menggunakan berbagai tools pengujian otomatis untuk meningkatkan efisiensi pengujian.
Berkontribusi dalam pengembangan dan pemeliharaan standar pengujian perusahaan.
Job Requirement:
Sarjana bidang IT, ilmu komputer, teknik, atau bidang treat.
Pengalaman 1-2 tahun sebagai software testing atau quality assurance.
Pemahaman yang kuat tentang siklus hidup software development lifecycle (SDLC) dan metodologi pengujian.
Kemahiran dalam manual testing dan pengalaman dengan automated testing software (misalnya, JEST).
Pengalaman dalam menulis, menjalankan, dan mengelola kasus uji, rencana uji, dan laporan bug.
Kemampuan untuk mengidentifikasi, mendokumentasikan, dan melacak error, dengan perhatian terhadap detail dan keterampilan analitis yang kuat.
Pengalaman dalam pengujian aplikasi web, aplikasi mobile, dan API; familiaritas dengan layanan RESTful dan Postman merupakan nilai tambah.
Keterampilan pemecahan masalah yang kuat dan kemampuan untuk bekerja secara mandiri atau sebagai bagian dari tim dalam lingkungan startup yang dinamis.
Keterampilan komunikasi yang baik untuk berkolaborasi secara efektif dengan developer, product manager, dan stakeholders lainnya.
Kemampuan untuk memprioritaskan tugas, mengelola waktu dengan efisien, dan memenuhi tenggat waktu.
Ketertarikan terhadap kualitas dan komitmen untuk memastikan dan menyeimbangkan user experience dan functionality.",None
Specifier,PT Nipsea Paint & Chemicals,"Bandung, West Java",None,Full time,"PT Nipsea Paint and Chemicals (Nippon Paint Indonesia) is hiring for Specification Executive placement in Bandung and Head Office Jakarta.
 Qualification :
Bachelor's degree in any major
Experienced 3-5 years in project area
Have good networking with Architect and Developer 
Excellent communication skill
Can build a good relationship
Can operate Microsoft Word, Excel, and PowerPoint
Own car and driving license (A)
 Job Description :
Develop CRM with key customers such as architects, developers, consultants, government, and building owners.
Mentoring and monitoring Specifier Executive Team under them
Handle important key accounts and make sure it's well followed up
Coordination for all promotional activities for the customers
Evaluate the team weekly and make the report to the superior
Create a report and action plan every semester and present it to the superior and the team.
Regularly checking ProConnect filled out by self and also Specification Executive Team
Responsible as an advisor and brand promotor for the company brand in the project market.
Lead the specification activities, write down specifications incorporating company products, and get them specified in projects at the design stage
Familiar with paint industries in the project area",None
DevOps Engineer,PT Ako Media Asia,"West Jakarta, Jakarta",None,Full time,"Company Description
SALT is a leading technology consultant in Indonesia that empowers businesses within the dynamic technology landscape. Since its establishment in 2013, SALT has specialized in delivering innovative strategies and technologies tailored to foster business growth and acceleration for its diverse clientele. SALT has expertise in AI-driven transformations, technical talent augmentation, tailored technology solutions, and cyber security solutions, among others.
 Role Description
Creating CI/CD Pipeline on Jenkins to helping developer have continuous delivery and integration
Integrating developer CI/CD pipeline with automation testing (QA Engineer)
Providing clear logging, metric and support team for monitoring system / application.
Creating script for automation deployment and managing container
Creating script for automation business reporting
 Requirements
Candidate must possess at least Bachelor's Degree in Engineering (Computer/Telecommunication) or equivalent.
At least 3 Year(s) of working experience in the related field is required for this position.
Strong background in Linux/Unix Administration
Experience with container technologies (e.g. docker )
Experience with Jenkins and understand about Groovy language
Great understanding DevOps practices and why to use them (e.g. CI,CD, Infrastructure as code, automated testing)
Experience with at least some of our middleware and databases: NGINX, Elasticsearch, RabbitMQ, MySQL, Postgres
Experience in contributing to the systems architecture
Experience with application development (e.g. PHP, NodeJs, Golang) is plus
Experience with Ansible (IT Automation tools) is a plus
Experience with Sonarqube (Static code analysis) is a plus
Experience with data visualization monitoring ( Eg. Kibana, Grafana, Promotheus) is a plus
Experience with container orchestration ( Eg. Kubernetes) is a plus",None
Senior Specifier Project,PT Nipsea Paint & Chemicals,"North Jakarta, Jakarta",None,Full time,"Qualification :
Bachelor's degree in any major
Experienced 3-5 years in project area
Have good networking with Architect and Developer 
Excellent communication skill
Can build a good relationship
Can operate Microsoft Word, Excel, and PowerPoint
Own car and driving license (A)
 Job Description :
Develop CRM with key customers such as architects, developers, consultants, government, and building owners.
Mentoring and monitoring Specifier Executive Team under them
Handle important key accounts and make sure it's well followed up
Coordination for all promotional activities for the customers
Evaluate the team weekly and make the report to the superior
Create a report and action plan every semester and present it to the superior and the team.
Regularly checking ProConnect filled out by self and also Specification Executive Team
Responsible as an advisor and brand promotor for the company brand in the project market.
Lead the specification activities, write down specifications incorporating company products, and get them specified in projects at the design stage
Familiar with paint industries in the project area",None
Senior Data Warehouse Engineer (Indonesia),PT Aplikasi Karya Anak Bangsa (GO-JEK Indonesia),Jakarta,None,Full time,"About the Role
Gojek is a data-driven organisation. Data has become the most critical part of its strategy to become the market leader through innovations and service excellence.
As a Data Warehouse Developer, you’ll take a critical part in developing & maintaining our large-scale data environments that will be valuable for our main users to generate business insights, decision-making, deep analysis, and even data science products.
You’ll have the opportunity to work with multiple cross-functional teams, such as product managers, BI analysts, product engineers, finance managers, marketers, IT security experts, etc. You’ll also have the opportunity to flex your Data Warehouse core skills, such as SQL, data modelling, data architecture, data governance, and data engineering, in a large-scale environment.
One of our core values is a growth mindset. We’ll ensure that you learn a lot on this journey, which will be good for your career growth in the future.
About the Team
Our Data Warehouse team is based in Jakarta, Bangalore & Gurgaon. Working alongside stakeholders, we are predominantly concerned with utilising and translating data into critical information that can be used to make sound business decisions. This includes gathering any new data points, and working closely with various business teams to capture, connect, and convert any data changes into useful knowledge in guiding our next steps to create a meaningful business impact.
Our team works hard but plays hard, too. We mean the latter in a literal sense because we're a team full of musicians! We have 2 pianists, 1 guitarist, 1 drummer, more than 2 male singers, 1 female singer, 1 Rockstar, and 1 dangdut singer (yes, you read it right ). So, you best believe that we have several karaoke nights together! Even if you aren't musically inclined, no fear. We love bonding over card games (Werewolf is a team favourite) and even hosting mini-talent shows for our own entertainment. Join us and show your hidden skills!
Handle an end-to-end data pipelines from heterogeneous input and output for analytical purposes.
Design and implement scalable data models and architectures based on data types and use cases.
Responsible for managing a single version of truth and turning data into critical information and knowledge that can be used to make sound business decisions
Monitor data quality, implement governance practices, and address data issues promptly.
Define clear and well-scoped requirements documents, including specs and workflows, that are easily understood by technical and non-technical audiences.
Work with data stakeholders (Product managers, product/business analysts, and product engineers) to ship data warehouse features and improve data products.
Contribute to the product strategy and execute the prioritized roadmap.
Mentoring & develop junior team members in the team
Have at least 4 years experience in data environment as Data Warehouse Developer
Advanced in SQL and data warehouse concepts
Advanced in more than one programming language, especially Python or Go or Java
Have experiences working with batch / real-time data processing, data modeling concepts, and implementation
Have experiences working in GCP data environment such as GCS & BigQuery
Analytical and data-driven, you love digging into the data to understand what’s happening and define & measure success on every project
Strong communication skills to collaborate with cross-functional teams.",None
IT Web Developer,PT Borwita Citra Prima,"Taman, East Java",None,Full time,"Job Role :
As a IT Web Developer, you will be collaborate with Business Technology Improvement to create and develop web-based applications that can support the company's core business
 Requirements :
Education background minimal S1 Informatics Engineering
Experienced in using the Laravel framework
Skilled in using databases such as Microsoft SQL Server or PostgreSQL
Experienced in using Node.js, Vue.js, Linux, and Git is a plus
Have an understanding on the REST API, OOP, and MVC
Responsible, communicative, target oriented, able to work both in teams and individually
Have good analytical skills and problem solving",None
IT Mobile Developer,Private Advertiser,"Sidoarjo, East Java",None,Full time,"Job Description:
As a Mobile Apps Developer, you are responsible to produce new mobile applications or developing existing applications according to company needs, as well as reporting to the team so that the progress of each mobile developer's work is monitored.
 Job Qualifications:
Candidate must possess at least Bachelor's Degree in Computer Science/Information Technology or equivalent
Minimum 1 or 2 years of work experiences as Mobile Developer
Proficient in using Flutter
Experienced in using Git and REST API
Understanding of Microsoft SQL Server, PostgreSQL, SQLite
Understanding of software development life-cycle
Willing to be place in Sidoarjo (Head Office)",None
IT Developer,PT Indako Trading Coy,"Medan, North Sumatra",None,Full time,"Penempatan: Medan 
 Tanggung Jawab Utama:
Membuat program sesuai dengan spesifikasi yang disepakati dengan klien
Melakukan pemeliharaan program yang telah diluncurkan  
 Kualifikasi:
Pendidikan minimal D3 atau S1 Jurusan IT (sederajat)
Memiliki pengalaman kerja/magang di bidang IT
Menguasai bahasa pemrograman berupa Yii, Flutter, Laravel, React Native, Vue.js
Memiliki passion dalam dunia IT
Disiplin dan dapat bekerja sama dalam tim
Minimal telah vaksin kedua COVID-19",None
Odoo Developer,Staffinc Talent,"Kebayoran Lama, Jakarta",None,Contract/Temp,"Staffinc is seeking a skilled IT Developer with expertise in Odoo integration to join our client's dynamic team in manufacturing company. The ideal candidate will have a strong background in developing and implementing Odoo solutions for our clients in the manufacturing sector. You will be responsible for ensuring seamless integration of Odoo with various systems, optimizing performance, and providing technical support.
Key Responsibilities
Develop, customize, and maintain Odoo modules for manufacturing processes.
Integrate Odoo with other systems and databases using REST APIs.
Implement and manage databases using MongoDB and PostgreSQL.
Write and maintain Python scripts and Flask applications for various automation and integration tasks.
Collaborate with cross-functional teams to gather and analyze requirements, providing technical solutions.
Troubleshoot and resolve issues related to Odoo integration and server management.
Manage version control using Git and ensure smooth deployment of updates.
Administer and optimize Ubuntu servers to ensure high availability and performance.
Stay updated with the latest Odoo features, best practices, and industry trends.
Skills and Qualifications
Able to work on-site in Jakarta
Willing to be outsourced with contract basis (PKWT)
Bachelor's Degree in Information System, Computer Engineering, or related fields.
At least 3 years experiences in Odoo Integration.
Proven experience with Odoo version 12 and above.
Proficiency in Python programming language.
Experience with MongoDB and PostgreSQL databases.
Strong knowledge of Flask framework.
Familiarity with Git for version control.
Experience with Ubuntu server administration.
Ability to design, develop, and consume REST APIs.
Strong problem-solving skills and attention to detail.
Excellent communication and teamwork abilities.
Preferred Qualifications
Experience in the manufacturing industry.
Knowledge of other ERP systems and their integration.
Familiarity with front-end technologies like HTML, CSS, and JavaScript.",None
Digital Transformation (1 Year Fixed Term Contract),PT Bayer Indonesia,"Depok, West Java",None,Full time,"  Digital Transformation Officer 
          JOB PURPOSE
Deliver digitalization projects and ensuring digital products meet stakeholder needs. This position must liaise with many parties such as all functions in Cimanggis Site, Region PS Product / Category Team, Enabling Functions, Bayer’s Strategic Partner, as well as local providers. In addition, it must also maintain collaboration between related functions during continuity of the project.
KEY TASKS & RESPONSIBILITIES
Collect and elaborate requirements from users and translate into user stories/specifications
Select the right tools to fulfil user needs and also be able to integrate with IT-OT if necessary
Develop digital solutions using tools available at Bayer, including Microsoft 365, Tulip.
Manage collaboration and alignment with multiple stakeholders in Digitalization topics which includes (but not limited) site department, Global Functions, and also external.
Work closely with Cimanggis’ Information Security Manager to ensure compliant of digital services and products to Manufacturing IT Security and Data Integrity principles in GxP regulated environment.
Contribute in fostering digital culture and environment by providing training for Citizen Developer.
QUALIFICATIONS
Education - Bachelor's degree preferably in Computer Science, Industrial Engineering, Pharmacy or similar disciplines.
Minimum of two (2) years experience in manufacturing area
Familiar with GxP regulated environment
Knowledge in production network, Manufacturing IT Security, and Data Integrity will be an advantage
Experience as Citizen Developer will be an advantage
Main competencies: Core, Leaders, technical competencies. 
Self-motivated and internal-driven
Excellent communication skills in English. 
Able to work as individual and in team
Good analytical thinking
Have experience / knowledge in managing multiple stakeholders
Fluent in English both verbal and writtenBayer Competency:
At Bayer we’re visionaries, driven to solve the world’s toughest challenges and striving for a world where ,Health for all, Hunger for none’ is no longer a dream, but a real possibility. We’re doing it with energy, curiosity and sheer dedication, always learning from unique perspectives of those around us, expanding our thinking, growing our capabilities and redefining ‘impossible’. There are so many reasons to join us. If you’re hungry to build a varied and meaningful career in a community of brilliant and diverse minds to make a real difference, there’s only one choice.
      Application Period:
10/12/2024
Reference Code:
831281  
  Division:
Consumer Health  
Location:
Indonesia : West Java : Bandung || Indonesia : West Java : Cianjur || Indonesia : West Java : Cimanggis || Indonesia : West Java : Cirebon || Indonesia : West Java : Depok || Indonesia : West Java : Sukabumi  
  Functional Area:
Information Technology  
Position Grade:
unknown  
  Employment Type:
Regular 
Work Time:
Standard Working Hours
      Contact Us
  Address
Telephone
E-Mail
    ronwilfred.lee@bayer.com
         ",None
Web Developer,Mitra IT Bali ( Email : info.mitrait@gmail.com ),"Denpasar, Bali",Rp 2.500.000 – Rp 3.000.000 per month,Full time,"• Minimal 1 -2 tahun pengalaman dalam posisi don bidang yang sama
• Memiliki pengalaman dalam pengembangan aplikasi web
• Memahami relational database
• Menguasai PHP (OPP), Framework laravel & REST API
• Pernah membuat aplikasi inventory/e-comemerce dengan laravel (nilai plus) sertakan portopolio
• Familiar dengan javascript, css, tallwind/bootstrap, HTML
• Familiar dengan git source control
• Bisa bekerja soma dalam satu team atau individu
• Sopan don antusias untuk belajar hal-hal baru don juga pengembangan yang sudah ado
• Bersedia bekerja dikantor (onsite), penempatan di Denpasar,Bali",None
Web Developer (Programmer),PT Propan Raya Industrial Coating Chemicals (HCBP ),"Tangerang District, Banten",None,Full time,"Bachelor degree in Information Technology/Information System/Computer Engineering
Must have experienced as IT Programmer or Web Developer for at least 2 years
Required Skill : MySQL, C++, SQL server, PHP, Java & HTML, Ms. office (Excel)
Willing to work in Head Office -Tangerang (WFO)",None
System Analyst,Wirehire,Jakarta,None,Full time,"Job Description
Perform technical engineering tasks to support the technical team in achieving the company's business goals.
Lead, manage, and train the technical team in system development.
Create system designs to enhance the efficiency, availability, scalability, flexibility, functionality, and usability of company products.
Possess a deep understanding of software architecture, operating systems, and networks.
Collaborate with the technical team to set benchmarks, standards, and other mechanisms for non-functional requirements.
Engage with users and stakeholders to understand their business needs.
Develop tools and resources to improve the team's efficiency and effectiveness.
Requirements
Minimum of 1-2 years as a System Analyst or in a related field.
Mandatory at least 2 years of prior experience as a software developer/engineer/programmer.
Proficient in planning, architecting, designing, estimating, and executing software development projects.
Capable of leading and mentoring a team to ensure high-quality deliverables that meet business requirements.
Excellent verbal and written communication skills.
In-depth knowledge of information technology, software development, and distributed frameworks.
Strong problem-solving skills to identify and resolve technical issues in a dynamic environment.
Understanding of GIT, CI/CD, virtualization, and containerization technologies, and proficient in using issue tracking tools.
Familiarity with Agile Mindset and Scrum Framework.
Benefits
Competitive salary
Professional development opportunities
Collaborative and innovative work environment",None
Programmer,"PT Asuransi Tugu Pratama Indonesia, Tbk",Jakarta,None,Full time,"You will report directly to Digital & IT Application Development Department Head of PT Asuransi Tugu Pratama Indonesia Tbk, one of the top 5 general insurance companies in Indonesia. We have strong financial performance that recognized through A- Stable Outlook status from a reputable credit rating agency in the world, AM Best.
You will join with a diverse team with us and enjoy the dynamic of a public company that playing an important role in managing risk management for many top companies in Indonesia.
We look forward for you -qualified candidate- to apply and join with us. Please visit www.tugu.com or www.linkedin.com/company/tuguinsurance to know more about us
Responsibilities:
Managing programming resources to ensure the system programming runs smoothly and in accordance with the established design.
Coordinate the development and maintenance activities of company information system applications
Ensure the developed information system application is the most appropriate, adequate, and functions optimally.
Coordinate with external parties to support the smooth progress of company information system development activities.
Analyze third-party recommendations involved in the IT system development process in accordance with regulations to enhance company's business efficiency.
Qualifications:
Preferably a Bachelor's degree in Computer Science (Informatics)/Management Information Systems/Information Technology.
Preferred to have a certification in the field of programming.
Preferably 2 years of experience including 1 year in the field.
General administrative skills.
Proficient in English language skills.
Proficient in IT architecture, IT application development, and IT governance.
Have a good understanding about Database Management, IT Security, Data Analytics, and Modeling.",None
Application Developer,VIVERE GROUP,"Kalideres, Jakarta",None,Full time,"Application Developer
VIVERE Serpong South 78
Job Descriptions
Contribute in all phases of the development life cycle (concepts, design, test, release)
Responsible for developing & maintaining our System end to end process
Deliver products with standardized security, reliability, and stability
Understand customer needs and requirements
Ability to write clean and easily maintained code.
Job Requirements
Technical expertise : Minimum 1+ years experience of PHP-Laravel Experience
Experience with microservices Architecture
Good knowledge of Vue.Js / React.Js
Hands-on experience in REST API
Experience web server technologies (Apache, NGINX) and containerization (Docker, Kubernetes) is plus
Having interpersonal and communication skill
Apply",None
Full Stack Developer,Alegrium,"Kebayoran Lama, Jakarta",None,Full time,"Company Description
Alegrium is a casual game developer based in Jakarta, Indonesia. We've been developing lot of games since 2011. Some of our games which go viral were Icon Pop Quiz, Cash Inc, The Billionaires, and many more
Alegrium is a part of Lion Studios, Lion Studios has already achieved over a billion downloads and profitability in less than two years. You can identify many of our games sitting at the top of the iOS & Android stores such as Ink Inc, Blendy, Mr. Bullet, Happy Glass, etc
Job Description
If you are up for this challenges:
Develop and maintain backend services using NestJS (Node.js) with MongoDB databases.
Develop a CMS platform using Laravel (PHP) and Vue.js to manage content efficiently.
Integrate, maintain, and optimize (MongoDB/MariaDB) for scalable data storage.
Collaborate with front-end developers to ensure functionality and smooth system operations.
Debug and troubleshoot issues within the application to ensure effective and optimal data communication between client and server.
Stay updated on the latest trends and technologies, especially related to databases, cloud technologies, etc.
Qualifications
Bachelor's degree in Information Technology
Experience with NestJS (Node.js) for backend development.
Experience with MongoDB for database management.
Experience with Laravel (PHP) and Vue.js for CMS development.
Familiarity with RESTful API and/or GraphQL.
Strong understanding of version control systems like Git.
Ability to write clean, maintainable, and scalable code.",None
